question,sql
What venue has the away side scoring 15.23 (113)?,SELECT Venue FROM table WHERE Away team score = 15.23 (113)
What venue features hawthorn as the away team?,SELECT Venue FROM table WHERE Away team = hawthorn
How many people attended the game with the home side scoring 11.13 (79)?,SELECT COUNT Crowd FROM table WHERE Home team score = 11.13 (79)
How many cop apps in the season with fewer than 12 league apps?,SELECT SUM Cup Apps FROM table WHERE League Apps < 12
What season saw 6 cup apps and 5 cup goals?,SELECT Season FROM table WHERE Cup Apps = 6 AND Cup Goals = 5
How many league apps in the season with more than 2 cup goals and more than 6 cup apps?,SELECT SUM League Apps FROM table WHERE Cup Goals > 2 AND Cup Apps > 6
How many cup goals for the season with more than 34 league apps?,SELECT AVG Cup Goals FROM table WHERE League Apps > 34
"How many cup goals in the season with more than 5 league apps, 1 cup apps and fewer than 4 league goals?",SELECT SUM Cup Goals FROM table WHERE League Apps > 5 AND Cup Apps = 1 AND League Goals < 4
How many cup apps for the season where there are more than 10 league goals and 23 league apps?,SELECT Cup Apps FROM table WHERE League Goals > 10 AND League Apps = 23
Which route has a Date of 2 july?,SELECT Route FROM table WHERE Date = 2 july
Which length has a Stage of 9?,SELECT Length FROM table WHERE Stage = 9
"Which date has a Terrain of plain stage, and a Stage of 4?",SELECT Date FROM table WHERE Terrain = plain stage AND Stage = 4
"Who is the away team at the game at MCG with the crowd is larger than 15,500?","SELECT Away team FROM table WHERE Crowd > 15,500 AND Venue = mcg"
What is the score for Fitzroy when they are the home team?,SELECT Home team score FROM table WHERE Home team = fitzroy
What is the date of the game at Arden Street Oval?,SELECT Date FROM table WHERE Venue = arden street oval
What is the smallest crowd for a game when Melbourne is the home team?,SELECT MIN Crowd FROM table WHERE Home team = melbourne
Who drafted the player from Michigan after 2010?,SELECT Drafting Team FROM table WHERE Graduated > 2010 AND College/Prior = michigan
Where was the player from who graduated from Michigan after 2010?,SELECT Home Town FROM table WHERE Graduated > 2010 AND College/Prior = michigan
From what town was Steve Zakuani?,SELECT Home Town FROM table WHERE Player = steve zakuani
What year did Omar Gonzalez graduate?,SELECT SUM Graduated FROM table WHERE Player = omar gonzalez
Which university hosted in Long Beach?,SELECT Host FROM table WHERE City = long beach
What is the venue that Saint Joseph's University hosted at?,SELECT Venue FROM table WHERE Host = saint joseph's university
In which city is Hayman Hall (Tom Gola Arena) located?,SELECT City FROM table WHERE Venue = hayman hall (tom gola arena)
Which venue is in the city of Villanova?,SELECT Venue FROM table WHERE City = villanova
On which date did Ger Loughnane from Team Clare have a match?,SELECT Date FROM table WHERE Team = clare AND Player = ger loughnane
What team opposed Tipperary in the Munster Final game?,SELECT Team FROM table WHERE Opposition = tipperary AND Game = munster final
On what date did Limerick play in the All-Ireland Final game?,SELECT Date FROM table WHERE Opposition = limerick AND Game = all-ireland final
Who was the opposition in the game on July 29?,SELECT Opposition FROM table WHERE Date = july 29
What day did the team play week 13?,SELECT Date FROM table WHERE Week = 13
What was Bye's opponent's attendance?,SELECT Attendance FROM table WHERE Opponent = bye
"Which opponent, before Week 10, had an attendance of 63,672?","SELECT Opponent FROM table WHERE Week < 10 AND Attendance = 63,672"
"Which week had an attendance of 70,225","SELECT MIN Week FROM table WHERE Attendance = 70,225"
"What was the highest number of people injured at incidents located at Rohtas, Bihar where fewer than 13 were killed?","SELECT MAX Injured FROM table WHERE Place = rohtas, bihar AND Killed < 13"
"What was the highest number of people injured in incidents in Vaishali, Bihar?","SELECT MAX Injured FROM table WHERE Place = vaishali, bihar"
How many points did the Away team from Geelong score?,SELECT Away team score FROM table WHERE Away team = geelong
How many people were in the crowd at Victoria Park?,SELECT COUNT Crowd FROM table WHERE Venue = victoria park
How many points did the away team from Melbourne score?,SELECT Away team score FROM table WHERE Away team = melbourne
What date did the home team from Carlton play on?,SELECT Date FROM table WHERE Home team = carlton
Who is the manager of the St. Johnstone club?,SELECT Manager FROM table WHERE Club = st. johnstone
Who is the manager of the Stenhousemuir club?,SELECT Manager FROM table WHERE Club = stenhousemuir
What team was the away ream when they scored 13.12 (90)?,SELECT Away team FROM table WHERE Away team score = 13.12 (90)
What team was home team when south Melbourne was the away team?,SELECT Home team FROM table WHERE Away team = south melbourne
What was the away team score when the home team was Carlton?,SELECT Away team score FROM table WHERE Home team = carlton
"What is the Basin Area mi 2 when the Basin Area km 2 is larger than 2,261,763 and the Basin is Pearl River?","SELECT Basin Area mi 2 FROM table WHERE Basin Area km 2 > 2,261,763 AND Basin = pearl river"
"Which Basin's Continent is South America, has a Basin Area km 2 larger than 6,144,727, and a Basin Area mi 2 of 238,539?","SELECT Basin FROM table WHERE Continent = south america AND Basin Area km 2 > 6,144,727 AND Basin Area mi 2 = 238,539"
What was date of the bye week 11?,SELECT Date FROM table WHERE Attendance = bye AND Week = 11
Where did Essendon play as the away team?,SELECT Venue FROM table WHERE Away team = essendon
"Where did Carolyn Dawn Johnson win Female Artist of the Year, and Paul Brandt win Male Artist of the Year?",SELECT Location FROM table WHERE Female Artist of the Year = carolyn dawn johnson AND Male Artist of the Year = paul brandt
"Where did Doc Walker win Group or Duo of the Year, and where did Crystal Shawanda win Female Artist of the year?",SELECT Location FROM table WHERE Group or Duo of the Year = doc walker AND Female Artist of the Year = crystal shawanda
"Who won Female Artist of the year in 1983, in the same city that Family Brown won Group of Duo of the year?",SELECT Female Artist of the Year FROM table WHERE Group or Duo of the Year = family brown AND Year = 1983
What is the most recent season when Fernando Alonso had more than 13 podiums in a car with a Ferrari engine?,SELECT MAX Season FROM table WHERE Engine = ferrari AND Driver = fernando alonso AND Podiums > 13
What is the engine for the Bettenhausen Motorsports team?,SELECT Engine FROM table WHERE Team = bettenhausen motorsports
What engine does Steve Chassey drive with a march chassis?,SELECT Engine FROM table WHERE Chassis = march AND Drivers = steve chassey
What is the engine for the Arciero Racing team?,SELECT Engine FROM table WHERE Team = arciero racing
What chassis belongs with the Cosworth Engine driven by Scott Pruett on the Dick Simon Racing team?,SELECT Chassis FROM table WHERE Engine = cosworth AND Drivers = scott pruett AND Team = dick simon racing
What is the engine for the team of Alex Morales Motorsports?,SELECT Engine FROM table WHERE Team = alex morales motorsports
What is the engine for the Machinists Union Racing team?,SELECT Engine FROM table WHERE Team = machinists union racing
Who is the home side when the away side score is 11.14 (80)?,SELECT Home team FROM table WHERE Away team score = 11.14 (80)
What was the attendance for Week 1?,SELECT Attendance FROM table WHERE Week = 1
"Which team did the Patriots play when there was a game attendance of 73,369?","SELECT Opponent FROM table WHERE Attendance = 73,369"
What date was the Week 3 game played?,SELECT Date FROM table WHERE Week = 3
What was the highest attendance of the matches that took place at Windy Hill?,SELECT MAX Crowd FROM table WHERE Venue = windy hill
Which team has a home field at Glenferrie Oval?,SELECT Home team FROM table WHERE Venue = glenferrie oval
On what date is Footscray the away team?,SELECT Date FROM table WHERE Away team = footscray
What was the crowd population for Footscray as an away team?,SELECT MAX Crowd FROM table WHERE Away team = footscray
"On what date was there both a crowd larger than 16,570 and the away team was Footscray?","SELECT Date FROM table WHERE Crowd > 16,570 AND Away team = footscray"
How many bids were there for the .500 win percentage in the Ohio Valley conference?,SELECT SUM # of Bids FROM table WHERE Win % = .500 AND Conference = ohio valley
What is the Championship Game when the Final Four is 1 and the conference is American South?,SELECT Championship Game FROM table WHERE Final Four = 1 AND Conference = american south
What is the Final Four with a win percentage of .750?,SELECT Final Four FROM table WHERE Win % = .750
What is the date of the game at the Arden Street Oval?,SELECT Date FROM table WHERE Venue = arden street oval
What is the date where the home team scores 8.7 (55)?,SELECT Date FROM table WHERE Home team score = 8.7 (55)
What is the date of the game when the venue is Kardinia Park?,SELECT Date FROM table WHERE Venue = kardinia park
What is the total of the crowd when the away team score is 4.8 (32)?,SELECT SUM Crowd FROM table WHERE Away team score = 4.8 (32)
What is the date of the game when the home team score is 11.11 (77)?,SELECT Date FROM table WHERE Home team score = 11.11 (77)
Which away team played against the home team of St Kilda?,SELECT Away team FROM table WHERE Home team = st kilda
Which home team competed against the away team of Melbourne?,SELECT Home team FROM table WHERE Away team = melbourne
Which away team resulted in a 15.14 (104) score for the home team?,SELECT Away team FROM table WHERE Home team score = 15.14 (104)
Which venue hosted an away team with a score of 9.12 (66)?,SELECT Venue FROM table WHERE Away team score = 9.12 (66)
What venue hosted a home team with a score of 6.12 (48)?,SELECT Venue FROM table WHERE Home team score = 6.12 (48)
What was the result of week 1 and the opponent was bye?,SELECT Result FROM table WHERE Week = 1 AND Opponent = bye
What is the site of the game with a Record of 6-2?,SELECT Game site FROM table WHERE Record = 6-2
What week has a Record of 12-2?,SELECT Week FROM table WHERE Record = 12-2
What city has Sky Tower?,SELECT City FROM table WHERE Name = sky tower
What is the name of a building in Courbevoie built before 1973?,SELECT Name FROM table WHERE Year built < 1973 AND City = courbevoie
Who was the away team at Lake Oval?,SELECT Away team FROM table WHERE Venue = lake oval
What was the home team score for the game where Hawthorn is the home team?,SELECT Home team score FROM table WHERE Home team = hawthorn
Who is the home team that scored 14.19 (103)?,SELECT Home team FROM table WHERE Home team score = 14.19 (103)
What is the date of the game where Essendon is the away team?,SELECT Date FROM table WHERE Away team = essendon
What is the average crowd size when the home side scores 4.10 (34)?,SELECT Crowd FROM table WHERE Home team score = 4.10 (34)
What is the home team's score when the away team is south melbourne?,SELECT Home team score FROM table WHERE Away team = south melbourne
What venue featured the home side of st kilda?,SELECT Venue FROM table WHERE Home team = st kilda
How many metres tall is the building that is larger than 850 feet tall?,SELECT Metres FROM table WHERE Feet > 850
What was Geelong's score when they were the home team?,SELECT Home team score FROM table WHERE Home team = geelong
Where was the game when Collingwood was the home team?,SELECT Venue FROM table WHERE Away team = collingwood
Who was the away team that scored 8.12 (60)?,SELECT Away team FROM table WHERE Away team score = 8.12 (60)
What was Peter Woolfolk's Total Rebound average?,SELECT SUM Total Rebounds FROM table WHERE Player = peter woolfolk
What was week 3 score?,SELECT Result FROM table WHERE Week = 3
"What city had a crowd larger than 11,346 and score of 24-16?","SELECT City FROM table WHERE Crowd > 11,346 AND Score = 24-16"
What is the result of the game at Odsal Stadium?,SELECT Result FROM table WHERE Stadium = odsal stadium
Which championship had a margin of 10 strokes?,SELECT Championship FROM table WHERE Margin = 10 strokes
Which runner-up player(s) had a margin of 10 strokes?,SELECT Runner(s)-up FROM table WHERE Margin = 10 strokes
What was the most recent year that Kathy Ahern was a runner-up?,SELECT MAX Year FROM table WHERE Runner(s)-up = kathy ahern
What is the RTM build of the Windows Home Server 2011?,SELECT RTM build FROM table WHERE Name = windows home server 2011
What is the current version of windows 8 with an RTM build of 9200?,SELECT Current version FROM table WHERE RTM build = 9200 AND Name = windows 8
What home team scored 14.14 (98)?,SELECT Home team FROM table WHERE Home team score = 14.14 (98)
What was the home team's score that played Geelong?,SELECT Home team score FROM table WHERE Away team = geelong
At what venue did the home team score 12.10 (82)?,SELECT Venue FROM table WHERE Home team score = 12.10 (82)
How many rounds were fought with opponent Kevin Roddy?,SELECT COUNT Round FROM table WHERE Opponent = kevin roddy
"What was the score when attendance was 19,887?","SELECT Record FROM table WHERE Attendance = 19,887"
What week was the Bye attendance week?,SELECT Week FROM table WHERE Attendance = bye
Who won when the Patriots played the Denver Broncos?,SELECT Record FROM table WHERE Opponent = denver broncos
"Who won when the attendance was 8,000?","SELECT Record FROM table WHERE Attendance = 8,000"
What channel has an operator of ivptc?,SELECT Programming FROM table WHERE Operator = ivptc
What was the score when Richmond payed as the home team?,SELECT Home team score FROM table WHERE Home team = richmond
Who played against Carlton as the home team?,SELECT Home team FROM table WHERE Away team = carlton
What was the attendance when South Melbourne was the away team?,SELECT SUM Crowd FROM table WHERE Away team = south melbourne
Who was the home team when the VFL played Kardinia Park?,SELECT Home team score FROM table WHERE Venue = kardinia park
How many silver medals did the nation who received 32 bronze medals receive?,SELECT Silver FROM table WHERE Bronze = 32
What is the highest numbered grid with a time or retired time of 52:52.1881?,SELECT MAX Grid FROM table WHERE Time/Retired = 52:52.1881
Who recorded a time or retired time of 52:56.4653?,SELECT Name FROM table WHERE Time/Retired = 52:56.4653
What is the average grid number for paul cruickshank racing with less than 27 laps?,SELECT AVG Grid FROM table WHERE Team = paul cruickshank racing AND Laps < 27
"What is the lowest total metals of a team with more than 6 silver, 6 bronze, and fewer than 16 gold medals?",SELECT MIN Total FROM table WHERE Silver > 6 AND Bronze = 6 AND Gold < 16
"What 09-10 class, with a graduate percentage of 85% had the least amount of points?",SELECT MIN 09-10 Points FROM table WHERE 09-10 Graduation = 85%
What is the crowd size of the game at Brunswick Street Oval?,SELECT SUM Crowd FROM table WHERE Venue = brunswick street oval
Who was the home team of the game where Footscray is the away team?,SELECT Home team score FROM table WHERE Away team = footscray
Who is the away team with a score of 7.8 (50)?,SELECT Away team FROM table WHERE Away team score = 7.8 (50)
"What week has a date of September 3, 2000?","SELECT AVG Week FROM table WHERE Date = september 3, 2000"
Who was the home team when Hawthorn was the away team?,SELECT Home team FROM table WHERE Away team = hawthorn
Who was the away team when the home team scored 11.14 (80)?,SELECT Away team FROM table WHERE Home team score = 11.14 (80)
What was Fitzroy's score when they were the away team?,SELECT Away team score FROM table WHERE Away team = fitzroy
What was #7 BMW's speed?,SELECT Speed FROM table WHERE Team = bmw AND Rank = 7
What was the crowd size in the match South Melbourne played at home?,SELECT Crowd FROM table WHERE Home team = south melbourne
What was the away team's score at Western Oval?,SELECT Away team score FROM table WHERE Venue = western oval
What was the date when the away team scored 9.16 (70)?,SELECT Date FROM table WHERE Away team score = 9.16 (70)
What was the crowd size when Essendon was the away team?,SELECT COUNT Crowd FROM table WHERE Away team = essendon
"What was the home team that scored 13.13 (91) in front of a crowd larger than 10,000?","SELECT Home team FROM table WHERE Crowd > 10,000 AND Home team score = 13.13 (91)"
On what date was the time of 16:24.12 achieved?,SELECT Date FROM table WHERE Time = 16:24.12
What year did the Capital City Giants have a game with the final score of 8-0?,SELECT AVG Year FROM table WHERE Team = capital city giants AND Score = 8-0
What team lost a game by a score of 6-0?,SELECT Runner-up FROM table WHERE Score = 6-0
What teams played in Capital Bowl IV?,SELECT Team FROM table WHERE Game = capital bowl iv
What team defeated the Capital City Giants?,SELECT Team FROM table WHERE Runner-up = capital city giants
"What is the total tenure rank of the person with an uninterrupted time of 49 years, 349 days?","SELECT Total tenure rank FROM table WHERE Uninterrupted time = 49 years, 349 days"
"What is the total tenure time of Warren Magnuson, who had an uninterrupted rank larger than 4 and a total tenure rank larger than 9?",SELECT Total tenure time FROM table WHERE Uninterrupted rank > 4 AND Total tenure rank > 9 AND Name = warren magnuson
What round was the overall 63 drafted?,SELECT COUNT Round FROM table WHERE Overall = 63
What is the Swedish name for South Karelia?,SELECT In Swedish FROM table WHERE In English = south karelia
What was the home team in the match where the away team scored 15.12 (102)?,SELECT Home team FROM table WHERE Away team score = 15.12 (102)
What home team plays at Arden Street Oval?,SELECT Home team FROM table WHERE Venue = arden street oval
"Who has a Jump 2 of 7.06, and what is this person's Jump 3?",SELECT Jump 3 FROM table WHERE Jump 2 = 7.06
"Who has an x under Jump 1, a Jump 2 of 7.28, and what is this person's Best Jump?",SELECT Best Jump FROM table WHERE Jump 1 = x AND Jump 2 = 7.28
What is the Jump 2 of the person that has a Jump 3 of 7.77?,SELECT Jump 2 FROM table WHERE Jump 3 = 7.77
What is the Jump 2 of the person that has a Jump 1 of 7.14,SELECT Jump 2 FROM table WHERE Jump 1 = 7.14
"Which player from Tucson, Arizona won the Championship?","SELECT Champion FROM table WHERE City = tucson, arizona"
"What was the final score of the player from Inglewood, California?","SELECT Score FROM table WHERE City = inglewood, california"
What tour was cancelled?,SELECT Name FROM table WHERE Date = cancelled
Who won the Fedex tour of Calabarzon?,SELECT Winner FROM table WHERE Name = fedex tour of calabarzon
What year has the time of 55:29:20?,SELECT COUNT Year FROM table WHERE Time = 55:29:20
What was the score when Mark parterned with lorenzo manta?,SELECT Score FROM table WHERE Partner = lorenzo manta
Who was his partner when he played on carpet?,SELECT Partner FROM table WHERE Surface = carpet
When did he play with peter nyborg?,SELECT Date FROM table WHERE Partner = peter nyborg
What day did he play on hard with tom mercer?,SELECT Date FROM table WHERE Surface = hard AND Partner = tom mercer
What was the week 2's record?,SELECT Record FROM table WHERE Week = 2
What was week 12's record?,SELECT Record FROM table WHERE Week = 12
What was the Bye week attendance?,SELECT Attendance FROM table WHERE Record = bye
When was the kickoff time of the SB XXXVI?,SELECT Kickoff FROM table WHERE Week = sb xxxvi
What was the home team score for the game played at Princes Park?,SELECT Home team score FROM table WHERE Venue = princes park
What event had a time of 6:37.73?,SELECT Event FROM table WHERE Time = 6:37.73
What is the time for the 50m breaststroke?,SELECT Time FROM table WHERE Event = 50m breaststroke
What age group has a time of 6:37.73 at the 200m breaststroke?,SELECT Age Group FROM table WHERE Event = 200m breaststroke AND Time = 6:37.73
What date did the 90-94 year old have a tie of 1:25.91 at the LC pool?,SELECT Date FROM table WHERE Age Group = 90-94 AND Pool = lc AND Time = 1:25.91
How many point totals are there that rank higher than 9 and have a PPG avg higher than 13.4?,SELECT COUNT Total Points FROM table WHERE Rank > 9 AND PPG Avg. > 13.4
How many players played over 125 games and were named david gonzalvez?,SELECT COUNT Rank FROM table WHERE Games > 125 AND Player = david gonzalvez
Which host university is based in Missoula?,SELECT Host FROM table WHERE City = missoula
What state is the city of Ruston in?,SELECT State FROM table WHERE City = ruston
Which mideast regional state contains the city of Seattle?,SELECT State FROM table WHERE Region = mideast AND City = seattle
Which region does Old Dominion University represent?,SELECT Region FROM table WHERE Host = old dominion university
Which state is University of Tennessee based in?,SELECT State FROM table WHERE Host = university of tennessee
What was the grid for Bruno Junqueira for Dale Coyne Racing?,SELECT Grid FROM table WHERE Team = dale coyne racing AND Driver = bruno junqueira
What were the highest points for less than 78 laps and on grid 5?,SELECT MAX Points FROM table WHERE Grid = 5 AND Laps < 78
How many were in the crowd at the Junction Oval venue?,SELECT Crowd FROM table WHERE Venue = junction oval
What was the away team score in the game at Arden Street Oval?,SELECT Away team score FROM table WHERE Venue = arden street oval
What was the date of the Arden Street Oval game?,SELECT Date FROM table WHERE Venue = arden street oval
"What was the away team's score during the match where the crowd was larger than 25,819 and the home team scored 14.10 (94)?","SELECT Away team score FROM table WHERE Crowd > 25,819 AND Home team score = 14.10 (94)"
What is the sum of all the crowds at matches where the away team's score was 7.6 (48)?,SELECT SUM Crowd FROM table WHERE Away team score = 7.6 (48)
"What venue saw a crowd larger than 29,840?","SELECT Venue FROM table WHERE Crowd > 29,840"
When does week 11 start?,SELECT Date FROM table WHERE Week = 11
"Which week starts on December 28, 1997?","SELECT Week FROM table WHERE Date = december 28, 1997"
When does week 1 start?,SELECT Date FROM table WHERE Week = 1
Who one in the Tampa Bay Buccaneers?,SELECT Result FROM table WHERE Opponent = tampa bay buccaneers
"Which week starts on November 23, 1997?","SELECT Week FROM table WHERE Date = november 23, 1997"
Who is the home team that scored 8.15 (63)?,SELECT Home team FROM table WHERE Home team score = 8.15 (63)
Who is the away team when the home team was Fitzroy?,SELECT Away team FROM table WHERE Home team = fitzroy
What was Melbourne's score when they were the home team?,SELECT Home team score FROM table WHERE Home team = melbourne
What is the date of the game where Collingwood was the home team?,SELECT Date FROM table WHERE Home team = collingwood
Who watches North Melbourne when they are away?,SELECT Crowd FROM table WHERE Away team = north melbourne
What Away team is visiting Carlton?,SELECT Away team FROM table WHERE Home team = carlton
What team has Windy Hill as their home venue,SELECT Home team score FROM table WHERE Venue = windy hill
"When richmond played away, what was the largest number of people who watched?",SELECT MAX Crowd FROM table WHERE Away team = richmond
"Which country is ranked higher than 68, with a city named Santa Fe and a stadium that has a capacity of 32,000?","SELECT Country FROM table WHERE Rank > 68 AND Capacity = 32,000 AND City = santa fe"
What is the capacity of the stadium with a rank lower than 31 located in the city of Belém ?,SELECT Capacity FROM table WHERE Rank < 31 AND City = belém
"What is the sum of week(s) with an attendance of 30,751?","SELECT SUM Week FROM table WHERE Attendance = 30,751"
On what date did the home team Essendon play?,SELECT Date FROM table WHERE Home team = essendon
What was South Melbourne's home team score?,SELECT Home team score FROM table WHERE Home team = south melbourne
On what date was the venue of Glenferrie Oval?,SELECT Date FROM table WHERE Venue = glenferrie oval
What was the score for the away team when the home team scored 10.11 (71)?,SELECT Away team score FROM table WHERE Home team score = 10.11 (71)
What was the score for the away team when they played collingwood?,SELECT Away team score FROM table WHERE Home team = collingwood
What was the score when essendon was the home team?,SELECT Home team score FROM table WHERE Home team = essendon
What is the date of the game where Richmond was the away team?,SELECT Date FROM table WHERE Away team = richmond
Who was the home team when Carlton was the away team?,SELECT Home team FROM table WHERE Away team = carlton
Which home team played against Hawthorn?,SELECT Home team score FROM table WHERE Away team = hawthorn
What date did the Geelong team play on as a home team?,SELECT Date FROM table WHERE Home team = geelong
What school/club team did the player who was drafted after round 13 with an overall rank of 384 play for?,SELECT School/Club Team FROM table WHERE Round > 13 AND Overall = 384
What is the largest overall rank for a center drafted before round 10?,SELECT MAX Overall FROM table WHERE Position = center AND Round < 10
What position does the player from Texas State who was drafted before round 11 with an overall rank lower than 306 play?,SELECT Position FROM table WHERE Overall < 306 AND Round < 11 AND School/Club Team = texas state
What is the average overall rank of all players drafted from Duke after round 9?,SELECT AVG Overall FROM table WHERE School/Club Team = duke AND Round > 9
