question,sql
"How many different results were there for the scores 6–7 (2–7) , 6–2, 7–6 (7–3)?","SELECT COUNT Result FROM table WHERE Score = 6–7 (2–7) , 6–2, 7–6 (7–3)"
Who was the writer for episode 3?,SELECT Writer FROM table WHERE Episode = 3
What was the original airdate for the episode written by daisuke habara and directed by akimitsu sasaki,SELECT Original airdate FROM table WHERE Writer = Daisuke Habara AND Director = Akimitsu Sasaki
What episode did tomoyuki furumaya,SELECT Title FROM table WHERE Director = Tomoyuki Furumaya
What is the earliest round where collingswood lost by 36 points?,SELECT MIN Round FROM table WHERE Result (includes margin) = Lost by 36 points
"What was the score on saturday, 26 june 7:10pm?","SELECT Score (Collingwoods score is in bold) FROM table WHERE Date = Saturday, 26 June 7:10pm"
"What is the round number of the round against melbourne on saturday, 4 april 2:10pm?","SELECT MIN Round FROM table WHERE Opponent = Melbourne AND Date = Saturday, 4 April 2:10pm"
Which venue did collingsworth play essendon in when they had the 3rd position on the ladder?,SELECT Venue FROM table WHERE Opponent = Essendon AND Position on Ladder = 3rd
Was the round where they were in 6th at home or away?,SELECT Home/Away FROM table WHERE Position on Ladder = 6th
What was the previous school for the forward with a height of  ft5in (m)?,SELECT Previous School FROM table WHERE Height = ft5in (m) AND Position = Forward
What is the lowest listed number for a player?,SELECT MIN # FROM table
Who previously attended south kent school / brentwood hs?,SELECT Name FROM table WHERE Previous School = South Kent School / Brentwood HS
What is the highest number a guard from brophy college prep wore?,SELECT MAX # FROM table WHERE Position = Guard AND Previous School = Brophy College Prep
How many directed by entries have UK viewership over 6.16 million?,SELECT COUNT Directed by FROM table WHERE UK viewers (million) = 6.16
Who directed the episode with a UK viewership of exactly 5.77 million?,SELECT Directed by FROM table WHERE UK viewers (million) = 5.77
What was the airdate of the episode with a UK viewership of 6.02 million?,SELECT Original air date FROM table WHERE UK viewers (million) = 6.02
Who directed the episode with UK viewership of 6.09 million?,SELECT Directed by FROM table WHERE UK viewers (million) = 6.09
Name the general classification for mauricio soler,SELECT General classification FROM table WHERE Winner = Mauricio Soler
Name the general classification for steven kruijswijk,SELECT General classification FROM table WHERE Winner = Steven Kruijswijk
Name the points classification for levi leipheimer,SELECT Points classification FROM table WHERE General classification = Levi Leipheimer
Name the mountains classification for rabobank and damiano cunego,SELECT Mountains Classification FROM table WHERE Team Classification = Rabobank AND General classification = Damiano Cunego
Name the team classification for thomas de gendt,SELECT Team Classification FROM table WHERE Winner = Thomas De Gendt
What is listed in built for when the original number is 24d?,SELECT Built for FROM table WHERE Original no. = 24D
"What is the original air date when the title is ""be prepared""?","SELECT Original air date FROM table WHERE Title = ""Be Prepared"""
What is the season # when ther are 5.3 million U.S viewers?,SELECT MAX Season # FROM table WHERE U.S. viewers (millions) = 5.3
"What dat did ""The changeling"" originally air?","SELECT Original air date FROM table WHERE Title = ""The Changeling"""
"What date did ""the eye of the phoenix"" originally air?","SELECT Original air date FROM table WHERE Title = ""The Eye of the Phoenix"""
"What episode number of the series is ""the coming of arthur (part 1)""?","SELECT No. for series FROM table WHERE Title = ""The Coming of Arthur (Part 1)"""
What are the titles of episodes written by Eric Trueheart?,SELECT Title FROM table WHERE Written by = Eric Trueheart
"What is the highest numbered episode where the title is ""The Ruff Ruff Bunch""?","SELECT MAX Series # FROM table WHERE Title = ""The Ruff Ruff Bunch"""
"Who were the writers of episode/s first aired in the US on June 9, 2012?","SELECT Written by FROM table WHERE United States Original Airdate = June 9, 2012"
"When was the episode titled ""The Fraud Princess"" first aired in the United States?","SELECT United States Original Airdate FROM table WHERE Title = ""The Fraud Princess"""
"Who were the writers of the episodes directed by Greg Sullivan and which first aired on July 21, 2012?","SELECT Written by FROM table WHERE Directed by = Greg Sullivan AND United States Original Airdate = July 21, 2012"
Which episode/s were written by Evan Gore?,SELECT Series # FROM table WHERE Written by = Evan Gore
How many home teams are there when the away team score was 4.2 (26) and away team was footscray?,SELECT COUNT Home team score FROM table WHERE Away team score = 4.2 (26) AND Away team = Footscray
Which team was the away team when home team was essendon?,SELECT Away team FROM table WHERE Home team = Essendon
How many scores were there for the home team when the  away team was fitzroy?,SELECT COUNT Home team score FROM table WHERE Away team = Fitzroy
Which team was the away team when the home team was north melbourne?,SELECT Away team FROM table WHERE Home team = North Melbourne
What is the date of the game when the home team is melbourne?,SELECT Date FROM table WHERE Home team = Melbourne
What is the date when the  home team score is 2.4 (16)?,SELECT Date FROM table WHERE Home team score = 2.4 (16)
Name the singer for 1.45m,SELECT Singer(s) FROM table WHERE Ratings = 1.45m
Name the singer for joe wilkinson,SELECT Singer(s) FROM table WHERE Comedian = Joe Wilkinson
Name the singer for bruce forsyth,SELECT Singer(s) FROM table WHERE Guest(s) = Bruce Forsyth
Name the number of ratings for bruce forsyth,SELECT COUNT Ratings FROM table WHERE Guest(s) = Bruce Forsyth
Name the guest for 1.64m ratings,SELECT Guest(s) FROM table WHERE Ratings = 1.64m
What was the constructor in the Belgian Grand Prix round?,SELECT Constructor FROM table WHERE Grand Prix = Belgian Grand Prix
Who had the fastest lap in round 15?,SELECT Fastest Lap FROM table WHERE Rd. = 15
When was the home team Essendon? ,SELECT Date FROM table WHERE Home team = Essendon
"When Richmond played as the away team, what was the ground?",SELECT Ground FROM table WHERE Away team = Richmond
When did Fitzroy play as the home team?,SELECT Date FROM table WHERE Home team = Fitzroy
what was the result on 01x06,SELECT Scores FROM table WHERE Episode = 01x06
what was the size when tom daley appeared,SELECT Episode FROM table WHERE Jamie and Johns guest = Tom Daley
Who was Andrew and Georgie's gues when Jamie and John's guest was Phil Taylor?,"SELECT Andrew and Georgies guest FROM table WHERE Jamie and Johns guest Dermot OLeary replaced Jamie Redknapp as team captain for one week in series 3, episode 8. = Phil Taylor"
Which episode had Jamie and John's guest as Mike Tindall?,"SELECT Episode FROM table WHERE Jamie and Johns guest Dermot OLeary replaced Jamie Redknapp as team captain for one week in series 3, episode 8. = Mike Tindall"
How many scores had an episode of 03x06?,SELECT COUNT Scores FROM table WHERE Episode = 03x06
Who was Andrew and Georgie's guest when Jamie and John's guest was Amy Williams?,"SELECT Andrew and Georgies guest FROM table WHERE Jamie and Johns guest Dermot OLeary replaced Jamie Redknapp as team captain for one week in series 3, episode 8. = Amy Williams"
What was the score for the episode when Jamie and John's guest was Boris Becker?,"SELECT Scores FROM table WHERE Jamie and Johns guest Dermot OLeary replaced Jamie Redknapp as team captain for one week in series 3, episode 8. = Boris Becker"
When id the episode broadcast with Mark Webber as Jamie and John's guest?,SELECT First broadcast FROM table WHERE Jamie and Johns guest = Mark Webber
What date did the episode with Andy Murray as Jamie and John's guest first broadcast?,SELECT First broadcast FROM table WHERE Jamie and Johns guest = Andy Murray
How many items are listed under 'andrew and georgies guest lee mack replaced andrew flint as team captain for one week' for episode 04x04?,"SELECT COUNT Andrew and Georgies guest Lee Mack replaced Andrew Flintoff as team captain for one week in series 4, episode 2. FROM table WHERE Episode = 04x04"
who guest starred on the episode with a 1.44m rating,SELECT Guest(s) FROM table WHERE Ratings = 1.44m
when was the episode on which barbara windsor and heston blumenthal guest starred broadcasted,SELECT Broadcast date FROM table WHERE Guest(s) = Barbara Windsor and Heston Blumenthal
how many broadcaste dates features the overtones,SELECT COUNT Broadcast date FROM table WHERE Singer(s) = The Overtones
how many guest stars did the episode that was broadcasted 11september2012 have,SELECT COUNT Guest(s) FROM table WHERE Broadcast date = 11September2012
when was the episode guest starring michael mcintyre and alex james broadcasted,SELECT Broadcast date FROM table WHERE Guest(s) = Michael McIntyre and Alex James
which episode did sarah millican and grayson perry appear in,SELECT MIN Episode FROM table WHERE Guest(s) = Sarah Millican and Grayson Perry
When were episodes first broadcast with jessica ennis as andrew and jacks guest?,SELECT First broadcast FROM table WHERE Andrew and Jacks guest = Jessica Ennis
Who directed the episode that is written by Eli Attie and production code is 2t5018?,SELECT Directed by FROM table WHERE Written by = Eli Attie AND Production code = 2T5018
How many episodes are 122 in the series?,SELECT COUNT No. in season FROM table WHERE No. in series = 122
What was the score for the episode with Matt Smith as Andrew and Jack's guest?,SELECT Scores FROM table WHERE Andrew and Jacks guest = Matt Smith
When was the episode with Amy Williams as Andrew and Jack's guest broadcast?,SELECT First broadcast FROM table WHERE Andrew and Jacks guest = Amy Williams
What is the last episode in the season that had 3.91 million viewers in the US?,SELECT MIN Season no. FROM table WHERE U.S. viewers (millions) = 3.91
"What are the episode numbers in season that were titled ""The Consoler""?","SELECT Season no. FROM table WHERE Title = ""The Consoler"""
How many episodes were written by Warren Leight?,SELECT COUNT Season no. FROM table WHERE Written by = Warren Leight
"How many million viewers in the US did the episode titled ""Cadaver"" have?","SELECT U.S. viewers (millions) FROM table WHERE Title = ""Cadaver"""
"What is the number in season of the episode titled ""Cadaver""?","SELECT Season no. FROM table WHERE Title = ""Cadaver"""
Who was the regular season winner of the 1999 Big Sky Men's Basketball Tournament was the conference tournament?,SELECT Regular Season Winner FROM table WHERE Conference Tournament = 1999 Big Sky Men's Basketball Tournament
"How many championships were there where the score was  4–6, 7–6 (7–5) , [5–10]?","SELECT COUNT Championship FROM table WHERE Score = 4–6, 7–6 (7–5) , [5–10]"
"On what surface was it the year when the score was 6–1, 4–6, [12–10]?","SELECT Surface FROM table WHERE Score = 6–1, 4–6, [12–10]"
"How many times has the score been 6–4, 3–6, [11–13]?","SELECT COUNT Opponent FROM table WHERE Score = 6–4, 3–6, [11–13]"
Who are the outgoing head coaches whose manner of departure is Gardening Leave 1?,SELECT Outgoing Head Coach FROM table WHERE Manner of departure = Gardening leave 1
Who was the incoming head coach after Wan Jamak Wan Hassan quit the coaching job?,SELECT Incoming Head Coach FROM table WHERE Outgoing Head Coach = Wan Jamak Wan Hassan
Who had the fastest lap in round 1?,SELECT Fastest Lap FROM table WHERE Round = 1
Who had the pole position when matt davies had the fastest lap?,SELECT Pole Position FROM table WHERE Fastest Lap = Matt Davies
Who had the pole position(s) when rob guiver won and kyle ryde had the fastest lap?,SELECT Pole Position FROM table WHERE Winning Rider = Rob Guiver AND Fastest Lap = Kyle Ryde
What is the earliest year in which the result is championship US Open (2)?,SELECT MIN Year FROM table WHERE Championship = US Open (2)
Who was Bob Bryan's partner in the Championship where the result is US Open (2)?,SELECT Partner FROM table WHERE Championship = US Open (2)
What are the results of those matches where the championship is French Open?,SELECT Score FROM table WHERE Championship = French Open
on how many days did the episode written by harold hayes jr. & craig s. phillips originally air,SELECT COUNT Original Air date FROM table WHERE Written by = Harold Hayes Jr. & Craig S. Phillips
"who directed ""grampires""(part 1)","SELECT Directed by FROM table WHERE Title = ""Grampires""(Part 1)"
"how many episodes originally aired january19,2013","SELECT COUNT No. in series FROM table WHERE Original Air date = January19,2013"
"which episode of the season aired on october20,2012","SELECT MAX No. in season FROM table WHERE Original Air date = October20,2012"
Which team was the opponent in game 5?,SELECT Team FROM table WHERE Game = 5
When did the official rating 4+ reach 4 633 925?,SELECT Date FROM table WHERE Official rating 4+ = 4 633 925
Lis the series for game 5.,SELECT Series FROM table WHERE Game = 5
What was the final in the game that boris diaw (34) scored the most points?,SELECT Score FROM table WHERE High points = Boris Diaw (34)
What is the figure for December 28 for ang tanging ina mo (last na 'to!)?,SELECT December 28 FROM table WHERE Movies = Ang Tanging Ina Mo (Last na 'To!)
What is the figure for December 27 for ang tanging ina mo (last na 'to!)?,SELECT December 27 FROM table WHERE Movies = Ang Tanging Ina Mo (Last na 'To!)
How many figures are provided for December 28 for Rosario?,SELECT COUNT December 28 FROM table WHERE Movies = Rosario
What is the figure for December 25 for the film that totalled p15.3 million for December 25-28 total?,SELECT December 25 FROM table WHERE December 25-28 total = P15.3 million
What film earmed p3.2 million on December 25?,SELECT Movies FROM table WHERE December 25 = P3.2 million
"What was the Friday June 3 practice time of the rider who did 20' 50.45 108.623mph on Thursday, June 2?",SELECT Fri 3 June FROM table WHERE Thurs 2 June = 20' 50.45 108.623mph
"What's the Wednesday, June 1 practice time for the rider that did 21' 05.87 107.300mph on Thursday, June 2?",SELECT Wed 1 June FROM table WHERE Thurs 2 June = 21' 05.87 107.300mph
How many people wrote episode 9 in the season that was directed by Ernest Dickerson?,SELECT COUNT Written by FROM table WHERE Directed by = Ernest Dickerson AND No. in season = 9
Who wrote the episode that was directed by Milan Cheylov?,SELECT Written by FROM table WHERE Directed by = Milan Cheylov
"How many episodes in the season had the title, ""first blood""?","SELECT COUNT No. in season FROM table WHERE Title = ""First Blood"""
Who was the EP winning team when the CP winning team was Dave Clark and the GM winning team was Stuart Northrup?,SELECT EP Winning Team FROM table WHERE CP Winning Team = Dave Clark AND GM Winning Team = Stuart Northrup
Who was the CM winning team when the FM winning team was #17 Elva - Ford?,SELECT CM Winning Team FROM table WHERE FM Winning Team = #17 Elva - Ford
Who the GM winning team when the EP winning team was #37 Porsche? ,SELECT GM Winning Team FROM table WHERE EP Winning Team = #37 Porsche
Who was the EP winning team when the FM winning team was Brabham - Ford and the HM winning team was Osca?,SELECT EP Winning Team FROM table WHERE FM Winning Team = Brabham - Ford AND HM Winning Team = Osca
Who was the HP winning team when the EP winning team was Hans Zereis and the GM winning team was Charles Gibson? ,SELECT HP Winning Team FROM table WHERE EP Winning Team = Hans Zereis AND GM Winning Team = Charles Gibson
what was the name of the team opponent to elfsborg,SELECT Team FROM table WHERE Opponent = Elfsborg
what is the score in the 1st leg where the contest and round was in europa league play off round,SELECT COUNT 1st leg score* FROM table WHERE Contest and round = Europa League Play Off Round
what is the name of the team which aggregate score is l 1–2,SELECT Team FROM table WHERE Aggregate score = L 1–2
what is the aggregate score for the europa league play off round contest and round,SELECT Aggregate score FROM table WHERE Contest and round = Europa League Play Off Round
How many dollars is listed under Sydney when the distance is 10km?,SELECT Sydney FROM table WHERE Distance = 10km
How many distance places have brisbane at $3.80?,SELECT COUNT Distance FROM table WHERE Brisbane = $3.80
How many listings under Melbourne has a distance at 15km?,SELECT COUNT Melbourne FROM table WHERE Distance = 15km
What is the distance when brisbane is $4.80?,SELECT Distance FROM table WHERE Brisbane = $4.80
What is the distance when brisbane is $5.20?,SELECT Distance FROM table WHERE Brisbane = $5.20
How many scores did Helen Sildna give when Iiris Vesik gave a 3?,SELECT COUNT Helen Sildna FROM table WHERE Iiris Vesik = 3
What is the maximum points received when Peeter Vähl gave a 9?,SELECT MIN Points FROM table WHERE Peeter Vähi = 9
Who is the manager for the fc inter club?,SELECT Manager FROM table WHERE Club = FC Inter
Which club is at the location of kuopio?,SELECT Club FROM table WHERE Location = Kuopio
How many stadiums have haka as the club?,SELECT COUNT Stadium FROM table WHERE Club = Haka
Who is the artist 2 on the setlist where the artist 1 is Sparfunk & D-Code?,SELECT Artist 2 FROM table WHERE Artist 1 = Sparfunk & D-Code
Who is the mix artist for the closing party setlist where artist 1 is Dillinja and Skibadee?,SELECT Mix artist FROM table WHERE Setlist = Closing Party AND Artist 1 = Dillinja and Skibadee
"Who is the artist 1 on the setlist where the song 1 title is ""Bounce (Remix)""?","SELECT Artist 1 FROM table WHERE Song 1 title = ""Bounce (Remix)"""
On how many different dates was the episode written by Charlie Day aired for the first time?,SELECT COUNT Original air date FROM table WHERE Written by = Charlie Day
Who are the writers of the episode with production code IP02009?,SELECT Written by FROM table WHERE Production code = IP02009
"Who are the writers of the episode titled ""Mac Bangs Dennis' Mom""?","SELECT Written by FROM table WHERE Title = ""Mac Bangs Dennis' Mom"""
How many different titles does the episode with production code IP02003 have?,SELECT COUNT Title FROM table WHERE Production code = IP02003
Who wrote the episode with a production code of ip03007?,SELECT Written by FROM table WHERE Production code = IP03007
What is the name of episode number 29 in the series?,SELECT Title FROM table WHERE No. in series = 29
Who wrote the episode with ip03012 as the production code?,SELECT Written by FROM table WHERE Production code = IP03012
Who directed the episode with production code ip03010?,SELECT Directed by FROM table WHERE Production code = IP03010
What is the least amount in each season? ,SELECT MIN No. in season FROM table
What is the least number in a season?,SELECT MIN No. in season FROM table
Who directed an episode with 1.19 million? ,SELECT Directed by FROM table WHERE U.S. viewers (million) = 1.19
At what location was the March 17 race held?,SELECT Location FROM table WHERE Date = March 17
What location did Zach Veach have the fastest lap?,SELECT Location FROM table WHERE Fastest lap = Zach Veach
Where was the race with Luke Ellery as fastest lap and Wayne Boyd as winning driver?,SELECT Location FROM table WHERE Fastest lap = Luke Ellery AND Winning driver = Wayne Boyd
When 318676 is the population of 2010 and 1st class is the income classification what is the area in kilometers squared?,SELECT Area (km²) FROM table WHERE Income Classification = 1st Class AND Population (2010) = 318676
"When itogon, benguet is the city/municipality and 1st class is the income classification how many measurements of population in 2010?","SELECT COUNT Population (2010) FROM table WHERE Income Classification = 1st Class AND City/Municipality = Itogon, Benguet"
When 82.74 is the area in kilometers squared what is the pop.density (per km2)?,SELECT Pop. density (per km²) FROM table WHERE Area (km²) = 82.74
When 106 is the area in kilometers squared what is the city/municipality?,SELECT City/Municipality FROM table WHERE Area (km²) = 106
How many episodes have the production code ip04004?,SELECT COUNT Title FROM table WHERE Production code = IP04004
"What season number is the episode ""The Gang Cracks The Liberty Bell""?","SELECT MIN No. in season FROM table WHERE Title = ""The Gang Cracks the Liberty Bell"""
"How many people wrote ""Paddy's Pub: The Worst Bar in Philadelphia""?","SELECT COUNT Written by FROM table WHERE Title = ""Paddy's Pub: The Worst Bar in Philadelphia"""
Who wrote episode number 11?,SELECT Written by FROM table WHERE No. in season = 11
"Who wrote the episode ""The Gang Gets Extreme: Home Makeover Edition""?","SELECT Written by FROM table WHERE Title = ""The Gang Gets Extreme: Home Makeover Edition"""
Who was the challenger when guillaume brahimi was the iron chef?,SELECT Challenger FROM table WHERE Iron Chef = Guillaume Brahimi
Who was the iron chef when herb Faust was the challenger?,SELECT Iron Chef FROM table WHERE Challenger = Herb Faust
What date did the episode air when guy grossi won?,SELECT Airdate FROM table WHERE Winner = Guy Grossi
"In the 2010 revival, who played the character that was played by Morgan Albrecht in the New Zealand 2012 production?","SELECT Revival Cast, 2010 FROM table WHERE New Zealand Cast, 2012 = Morgan Albrecht"
"In the 2012 production in Wales, who played the character that Owen Little played in Australia?","SELECT Wales Cast, 2012 FROM table WHERE Australian Cast, 2012 = Owen Little"
Who played Lily Cahill in the Australian 2012 production?,"SELECT Australian Cast, 2012 FROM table WHERE Character = Lily Cahill"
"In the 2012 Wales production, who played the character that Clementine Mills played in Australia?","SELECT Wales Cast, 2012 FROM table WHERE Australian Cast, 2012 = Clementine Mills"
"In the original cast, who played the character portrayed by Edward Franklin in the revival?","SELECT Original Cast, 2009 FROM table WHERE Revival Cast, 2010 = Edward Franklin"
"In the original cast, who played the character portrayed by Christopher Harris in Wales?","SELECT Original Cast, 2009 FROM table WHERE Wales Cast, 2012 = Christopher Harris"
"which tournament was the champion nick saviano florin segărceanu 6–3, 6–4?","SELECT Tournament FROM table WHERE Champion = Nick Saviano Florin Segărceanu 6–3, 6–4"
Which tournament was runner-up  paul annacone eric korita?,SELECT Tournament FROM table WHERE Runner-up = Paul Annacone Eric Korita
Who were the semifinalists when sammy giammalva was  runner-up?,SELECT Semifinalists FROM table WHERE Runner-up = Sammy Giammalva
"which tournament was the champion pat cash 4–6, 6–4, 6–3?","SELECT Tournament FROM table WHERE Champion = Pat Cash 4–6, 6–4, 6–3"
"Which tournament was on the week of  24 october and champion is matt doyle 1–6, 6–1, 6–2?","SELECT Tournament FROM table WHERE Week of = 24 October AND Champion = Matt Doyle 1–6, 6–1, 6–2"
"How many runner ups were there for the cologne , germany carpet – $75,000 – s32/d16 when the champion was matt doyle 1–6, 6–1, 6–2?","SELECT COUNT Runner-up FROM table WHERE Tournament = Cologne , Germany Carpet – $75,000 – S32/D16 AND Champion = Matt Doyle 1–6, 6–1, 6–2"
which train number departs pune at 13:00,SELECT Train Number FROM table WHERE Departure Pune = 13:00
which train number arrives in lonavla at 17:45,SELECT Train Number FROM table WHERE Arrival Lonavla = 17:45
which train name arrives in lonavla at 17:45,SELECT Train Name FROM table WHERE Arrival Lonavla = 17:45
how many trains run daily to lonavla and arrive at 12:25,SELECT COUNT Train Number FROM table WHERE Frequency = Daily AND Arrival Lonavla = 12:25
how many trains have the number 99808,SELECT COUNT Train Name FROM table WHERE Train Number = 99808
what time does the train that arrives in lonavla at 22:22 depart pune,SELECT Departure Pune FROM table WHERE Arrival Lonavla = 22:22
Who became the champion for the 1984 Grand Prix where Marty Davis was the runner-up?,SELECT Champion FROM table WHERE Runner-up = Marty Davis
"Who were the quarter-finalists in the event where the champion was Terry Moor 3-6, 7-6, 6-2?","SELECT Quarterfinalists FROM table WHERE Champion = Terry Moor 3-6, 7-6, 6-2"
Who was the champion in the tournament where Scott Davis Chris Dunk was the runner up?,SELECT Champion FROM table WHERE Runner-up = Scott Davis Chris Dunk
"Who were the semifinalists in the tournament where Mats Wilander 7-6, 6-3 was declared the champion?","SELECT Semifinalists FROM table WHERE Champion = Mats Wilander 7-6, 6-3"
How many years saw 3 hurricanes wherein the strongest storm was level three?,SELECT COUNT Year FROM table WHERE Number of hurricanes = 3 AND Strongest storm = Three
What is the largest overall number of major hurricanes?,SELECT MAX Number of major hurricanes FROM table
When the death is none what is the number of major hurricanes?,SELECT COUNT Number of major hurricanes FROM table WHERE Deaths = None
What is the lowest overall number of hurricanes?,SELECT MIN Number of hurricanes FROM table
What country offered a prize of 66400 US dollars?,SELECT Country FROM table WHERE Prize Money (USD) = 66400
What country does the player named Mark Cox play for?,SELECT Country FROM table WHERE Name = Mark Cox
How many deaths did the eyar with exactly 6 hurricanes have?,SELECT COUNT Deaths FROM table WHERE Number of hurricanes = 6
What is the maximum number of tropical storms in the year that had exactly 34 deaths?,SELECT MAX Number of tropical storms FROM table WHERE Deaths = 34
