question,sql
What is the acreage of the Maghereen in the civil parish of Macroom?,SELECT COUNT Area( acres ) FROM table WHERE Civil parish = Macroom AND Townland = Maghereen
What is the poor law union when the townland is bohonagh?,SELECT Poor law union FROM table WHERE Townland = Bohonagh
How many entries are in barony when the townland is derrigra?,SELECT COUNT Barony FROM table WHERE Townland = Derrigra
How many entries are listed in poor law union when townland is dromidiclogh?,SELECT COUNT Poor law union FROM table WHERE Townland = Dromidiclogh
What is the area when the poor law union is skibbereen and the townland is knockmore?,SELECT Area( acres ) FROM table WHERE Poor law union = Skibbereen AND Townland = Knockmore
"What is the circuit located in baltimore , maryland?","SELECT Circuit FROM table WHERE Location = Baltimore , Maryland"
"Which circuit was located in st. petersburg, florida?","SELECT Circuit FROM table WHERE Location = St. Petersburg, Florida"
"Who had the fastest lap in bowmanville, ontario?","SELECT Fastest lap FROM table WHERE Location = Bowmanville, Ontario"
Who had the fastest lap on september 4?,SELECT Fastest lap FROM table WHERE Date = September 4
What is the 1985 value for the year when GDP as of 2012 after PPP was 369.38?,SELECT 1985 FROM table WHERE GDP as of 2012 after purchasing power parity (PPP) calculations (USD billions) = 369.38
What was the gap from Thailand as of 2012 for China?,SELECT Gap from Thailand as of 2012 (times) FROM table WHERE Economy = China
What is the maximum 2010 value for China?,SELECT MAX 2010 FROM table WHERE Economy = China
What is the gap from Thailand as of 2012 for the country whose 1980 gap was 0.29?,SELECT Gap from Thailand as of 2012 (times) FROM table WHERE Gap from Thailand as of 1980 (times) = 0.29
How many GDPs as of 2012 after PPP values are associated with a 2012 value of 23113?,SELECT COUNT GDP as of 2012 after purchasing power parity (PPP) calculations (USD billions) FROM table WHERE 2012 = 23113
What is the max 2010 value for a 1980 gap value is 2.43?,SELECT MAX 2010 FROM table WHERE Gap from Thailand as of 1980 (times) = 2.43
How many viewers in the UK did episode 50 have?,SELECT UK Total viewers FROM table WHERE Episode no. = 50
Tell me the doubles W-L for player of laurynas grigelis,SELECT Doubles W–L FROM table WHERE Player = laurynas grigelis
What is the newest Cap with a Goals stat larger than 17 and which was done by Brian Turner?,SELECT Most Recent Cap FROM table WHERE Goals > 17 AND Name = brian turner
What is the nationality of school/club team of barton cc (ks)?,SELECT Nationality FROM table WHERE School/Club Team = barton cc (ks)
Shawn Respert play for what school/club team?,SELECT School/Club Team FROM table WHERE Player = shawn respert
Who has position in year 1996-97 in Toronto?,SELECT Position FROM table WHERE Years in Toronto = 1996-97
Roy Rogers play for what school/club team?,SELECT School/Club Team FROM table WHERE Player = roy rogers
What year is United States school/club team from Arkansas play in Toronto,SELECT Years in Toronto FROM table WHERE Nationality = united states AND School/Club Team = arkansas
Who is the player from United States who play in year 2003-06 in Toronto?,SELECT Player FROM table WHERE Nationality = united states AND Years in Toronto = 2003-06
Tell me the average units sold for square enix,SELECT AVG Units sold FROM table WHERE Publisher = square enix
Tell me the date for nicolas pereira,SELECT Date FROM table WHERE Partnering = nicolas pereira
what is the date in 1986?,SELECT Date FROM table WHERE Year = 1986
"What is the average year for Ponce, Puerto Rico events?","SELECT AVG Year FROM table WHERE Venue = ponce, puerto rico"
What year did she place 8th in the junior race?,SELECT Year FROM table WHERE Event = junior race AND Position = 8th
Tell me the NHL team for ryan johnson,SELECT NHL team FROM table WHERE Player = ryan johnson
Tell me the position for pick of 47,SELECT Position FROM table WHERE Pick = 47
Tell me the pick for pittsburgh penguins,SELECT Pick FROM table WHERE NHL team = pittsburgh penguins
Tell me the nationality for rudolf vercik,SELECT Nationality FROM table WHERE Player = rudolf vercik
Tell me the player for nationality of canada for pick of 43,SELECT Player FROM table WHERE Nationality = canada AND Pick = 43
Tell me the college for jason holland,SELECT College/junior/club team FROM table WHERE Player = jason holland
Tell me the date for rudolf caracciola for avusrennen,SELECT Date FROM table WHERE Winning driver = rudolf caracciola AND Name = avusrennen
Tell me the circuit for 10 may for targa florio,SELECT Circuit FROM table WHERE Date = 10 may AND Name = targa florio
What was the score of the Washington tournament?,SELECT Score FROM table WHERE Tournament = washington
On what date was Patty Fendick an opponent?,SELECT Date FROM table WHERE Opponent = patty fendick
"What score does Vasil Levski National Stadium, Sofia earn?","SELECT Score FROM table WHERE Venue = vasil levski national stadium, sofia"
"What score did vasil levski national stadium, sofia, which was friendly during competition, earn?","SELECT Score FROM table WHERE Competition = friendly AND Venue = vasil levski national stadium, sofia"
What is the nationality of the Washington Capitals?,SELECT Nationality FROM table WHERE NHL team = washington capitals
On what NHL team does Roman Vopat play for?,SELECT NHL team FROM table WHERE Player = roman vopat
What is the position of the player from the Ukraine?,SELECT Position FROM table WHERE Nationality = ukraine
What Tournament did he place 12th in?,SELECT Tournament FROM table WHERE Result = 12th
What was the first year he placed 12th,SELECT MIN Year FROM table WHERE Result = 12th
Tell me the circuit for alfa romeo swedish ice race,SELECT Circuit FROM table WHERE Winning constructor = alfa romeo AND Name = swedish ice race
Tell me the date for bugatti fpr stanislas czaykowski,SELECT Date FROM table WHERE Winning constructor = bugatti AND Winning driver = stanislas czaykowski
Tell me the circuit for 20 august,SELECT Circuit FROM table WHERE Date = 20 august
Tell me the winning driver for avusrennen,SELECT Winning driver FROM table WHERE Name = avusrennen
Tell me the report for bugatti and brooklands,SELECT Report FROM table WHERE Winning constructor = bugatti AND Circuit = brooklands
How many years has there been a competition in Helsinki?,SELECT COUNT Year FROM table WHERE Location = helsinki
Which competition before 1982 had a score of 2:3?,SELECT Competition FROM table WHERE Year < 1982 AND Score = 2:3
Which competition occurred after 1980 with a score of 0:5 in Jerusalem?,SELECT Competition FROM table WHERE Year > 1980 AND Score = 0:5 AND Location = jerusalem
"When was there an attendance of 51,342?","SELECT Date FROM table WHERE Attendance = 51,342"
What was the attendance during week 7?,SELECT Attendance FROM table WHERE Week = 7
What was the score during week 16?,SELECT Result FROM table WHERE Week = 16
Who is the mInister who left office during 1960?,SELECT Minister FROM table WHERE Left office = 1960
Which government is number 6?,SELECT Government FROM table WHERE Number = 6
Which rider had a speed of 90.57mph?,SELECT Rider FROM table WHERE Speed = 90.57mph
Which country has a place smaller than 8 and points smaller than 5?,SELECT Country FROM table WHERE Place < 8 AND Points < 5
"What is the lowest number of Losses when the number of Wins is less than 4, the number of Tie is 2, and the Place is 5?",SELECT MIN Losses FROM table WHERE Wins < 4 AND Ties = 2 AND Place = 5
Tell me the post-season record for kansas city,SELECT Post-season record [e ] FROM table WHERE MLB affiliate = kansas city
Tell me the venue of 29 april 2007,SELECT Venue FROM table WHERE Date = 29 april 2007
Tell me the competition of 20 august 2008,SELECT Competition FROM table WHERE Date = 20 august 2008
"Tell me the date of stade des martyrs, dr congo","SELECT Date FROM table WHERE Venue = stade des martyrs, dr congo"
"How much money, in millions, is paid to Infotalent?",SELECT Amount (millions) FROM table WHERE Payee = infotalent
What is the purpose of Euromarine?,SELECT Purpose FROM table WHERE Payee = euromarine
What signatory has a purpose of police security and Infotalent payee?,SELECT Signatories FROM table WHERE Purpose = police security AND Payee = infotalent
Tell me the highest launced for trn,SELECT MAX Launched FROM table WHERE Name = trn
"Tell me the average launced for capacity mln tpa of 15,0","SELECT AVG Launched FROM table WHERE Capacity, mln tpa = 15,0"
Tell me the period for red rock,SELECT Period FROM table WHERE Place = red rock
Tell me the province for 260km ese of calgary,SELECT Province FROM table WHERE Location = 260km ese of calgary
Tell me the province of 1941-1946,SELECT Province FROM table WHERE Period = 1941-1946
Tell me the degree for degree year of 1983,SELECT Degree FROM table WHERE Degree Year = 1983
Tell me the degree for chemistry 1965,SELECT Degree FROM table WHERE Award Year = 1965 AND Award = chemistry
What is the MP's term who was elected from grey and bell?,SELECT MP's term FROM table WHERE Electorate = grey and bell
What is the Election date for Member william richmond category:articles with hcards?,SELECT Election date FROM table WHERE Member = william richmond category:articles with hcards
What is Member alfred east category:articles with hcards's term?,SELECT MP's term FROM table WHERE Member = alfred east category:articles with hcards
What is the election date for the city of auckland category:articles with hcards?,SELECT Election date FROM table WHERE Electorate = city of auckland category:articles with hcards
What electorate does Member dingley brittin category:articles with hcards represent?,SELECT Electorate FROM table WHERE Member = dingley brittin category:articles with hcards
What is the election date for the electorate of member charles brown category:articles with hcards?,SELECT Election date FROM table WHERE Member = charles brown category:articles with hcards
Tell me the date for acts of 6 bands and year larger than 1981 for monsters of rock,SELECT Date FROM table WHERE Acts = 6 bands AND Year > 1981 AND Event = monsters of rock
Tell me the stages for 1981,SELECT Stages FROM table WHERE Year = 1981
Tell me the event for 6 bands,SELECT Event FROM table WHERE Acts = 6 bands
What is the lightweight value with no information model and the flexible value is unknown?,SELECT Lightweight FROM table WHERE Information Model = no AND Flexible = unknown
What value for U.S. dance occurred in 1986 when the value of U.S. R&B was 9?,SELECT U.S. dance FROM table WHERE Year = 1986 AND U.S. R&B = 9
What is the bore for a 9-cyl radial on a 9 AD?,SELECT Bore FROM table WHERE Cyl. = 9-cyl radial AND Name = 9 ad
What bore goes with an 18 AB?,SELECT Bore FROM table WHERE Name = 18 ab
Tell me the venue for notes of 10.93 secs,SELECT Venue FROM table WHERE Notes = 10.93 secs
Tell me the venue for year less than 2003,SELECT Venue FROM table WHERE Year < 2003
What is the total number of points team Alfa Romeo 184T won?,SELECT SUM Points FROM table WHERE Team/Chassis = alfa romeo 184t
What engine was used after 1984?,SELECT Engine FROM table WHERE Year > 1984
In which year were the points more than 0?,SELECT Year FROM table WHERE Points > 0
What were the Tyres after 1984?,SELECT Tyres FROM table WHERE Year > 1984
Tell me the bp comp 2 for % wt comp 1 of 76,SELECT b.p. comp. 2 (˚C) FROM table WHERE % wt comp. 1 = 76
Tell me the total number of % wt comp 1 foR % wt comp 2 or 27,SELECT COUNT % wt comp. 1 FROM table WHERE % wt comp. 2 = 27
What is the percentage of the popular vote when there were 90 seats available?,SELECT % of popular vote FROM table WHERE # of seats available = 90
Name the gold for silver of 39,SELECT Gold FROM table WHERE Silver = 39
What is the compression ratio for the 302-2v Windsor v8 engine?,SELECT Compression Ratio FROM table WHERE Engine = 302-2v windsor v8
How many games had 41 rushes and were than 197 yards?,SELECT COUNT Games FROM table WHERE Rushes = 41 AND Yards < 197
What was the highest number of yards in years where there were fewer than 51 rushes and more than 12 games?,SELECT MAX Yards FROM table WHERE Rushes < 51 AND Games > 12
What is the pick # for Dimelon Westfield?,SELECT MIN Pick # FROM table WHERE Player = dimelon westfield
"What was the final score of the November 8, 2001 game?","SELECT Result FROM table WHERE Date = november 8, 2001"
Tell me the bullet tip color of headstamp id of h1z,SELECT Bullet Tip Color FROM table WHERE Headstamp ID = h1z
Tell me the total number of gold for bronze more than 0 and total more than 100,SELECT COUNT Gold FROM table WHERE Bronze > 0 AND Rank = total AND Total > 100
Tell me the least silver for total less than 6 and rank of 8,SELECT MIN Silver FROM table WHERE Total < 6 AND Rank = 8
Who played men's singles in 1951?,SELECT Men's singles FROM table WHERE Year = 1951
Who played women's singles in 1955?,SELECT Women's singles FROM table WHERE Year = 1955
"Who played Women's singles when xiong guobao played men's singles, and tian bingyi li yongbo played Men's doubles?",SELECT Women's singles FROM table WHERE Men's singles = xiong guobao AND Men's doubles = tian bingyi li yongbo
Who played men's doubles when gao ling huang sui played women's doubles in 2007?,SELECT Men's doubles FROM table WHERE Women's doubles = gao ling huang sui AND Year = 2007
What year did huang nanyan yang wei play women's doubles and Men's doubles was played by lee dong-soo yoo yong-sung?,SELECT Year FROM table WHERE Women's doubles = huang nanyan yang wei AND Men's doubles = lee dong-soo yoo yong-sung
"Who played men's doubles when men's singles were played by wong peng soon and Women's singles was played by cecilia samuel, in 1952?",SELECT Men's doubles FROM table WHERE Men's singles = wong peng soon AND Women's singles = cecilia samuel AND Year = 1952
What is the first leg score in that match where Marseille was the first team?,SELECT 1st leg FROM table WHERE Team 1 = marseille
Tell me the discovery/publication for still living,SELECT Discovery / publication of name FROM table WHERE Fossil record = still living
Tell me the discovery/publication for red deer cave people,SELECT Discovery / publication of name FROM table WHERE Species = red deer cave people
Tell me the discovery/publicatio of name for h.heidelbergensis,SELECT Discovery / publication of name FROM table WHERE Species = h.heidelbergensis
Tell me the fossil record for name of 1994/2003,SELECT Fossil record FROM table WHERE Discovery / publication of name = 1994/2003
Tell me lived for name of 1994/2003,SELECT Lived when ( mya ) FROM table WHERE Discovery / publication of name = 1994/2003
When was the Monza circuit?,SELECT Date FROM table WHERE Circuit = monza
What is Metro's win percentage?,SELECT Win % FROM table WHERE Conference = metro
How many elite eight teams came from the Atlantic 10?,SELECT Elite Eight FROM table WHERE Conference = atlantic 10
"Tell me the opponent for attendance of 55,527","SELECT Opponent FROM table WHERE Attendance = 55,527"
Which version B-58 aircraft model originated in the United States has 2 in service?,SELECT Aircraft FROM table WHERE In service = 2 AND Origin = united states AND Versions = b-58
What aircraft type is the Casa C-212 Aviocar?,SELECT Type FROM table WHERE Aircraft = casa c-212 aviocar
How many T-260 EU aircrafts are currently in service?,SELECT In service FROM table WHERE Versions = t-260 eu
How many C-95 aircrafts originating in Brazil are currently in service?,SELECT In service FROM table WHERE Origin = brazil AND Versions = c-95
Tell me the lowest other for albanians more than 8793 and Roma less than 1030,SELECT MIN Other FROM table WHERE Albanians > 8793 AND Roma < 1030
Tell me the highest bosniaks for year more than 2002,SELECT MAX Bosniaks FROM table WHERE Census year > 2002
Name the lowest ERP W with a frequency mhz less than 103.1,SELECT MIN ERP W FROM table WHERE Frequency MHz < 103.1
Name the city with 103.1 frequency and ERP W less than 80,SELECT City of license FROM table WHERE Frequency MHz = 103.1 AND ERP W < 80
Tell me the affiliation for pick number less than 59 and position of gk,SELECT Affiliation FROM table WHERE Pick # < 59 AND Position = gk
What Tournament of canada happened in 1998?,SELECT 1998 FROM table WHERE Tournament = canada
Who had 1990 of 2–2 in 1993?,SELECT 1993 FROM table WHERE 1990 = 2–2
What Tournament of monte carlo had 1996 and a 1987 of nme?,SELECT 1996 FROM table WHERE 1987 = nme AND Tournament = monte carlo
What Tournament of the french open had 2004 that has a 1998 of 2r?,SELECT 2004 FROM table WHERE 1998 = 2r AND Tournament = french open
What is the margin at the Nabisco Championship?,SELECT Margin FROM table WHERE Championship = nabisco championship
What was the margin in 2001 at the McDonald's LPGA Championship?,SELECT Margin FROM table WHERE Year = 2001 AND Championship = mcdonald's lpga championship
Tell me the date of goal 5,SELECT Date FROM table WHERE Goal = 5
Tell me the date for goal of 5,SELECT Date FROM table WHERE Goal = 5
What was the result of Sopot (pol)?,SELECT Result FROM table WHERE Location = sopot (pol)
Which division was the Rampage in when they were in the 2nd round in the Open Cup?,SELECT Division FROM table WHERE Open Cup = 2nd round
What was the Rampage's regular season in 1997?,SELECT Reg. Season FROM table WHERE Year = 1997
What was the Rampage's status in the Open Cup in the year that they made it to the 2nd round of the playoffs?,SELECT Open Cup FROM table WHERE Playoffs = 2nd round
"What was the Rampage's result in the playoffs in the year that their regular season resulted in 4th, central?","SELECT Playoffs FROM table WHERE Reg. Season = 4th, central"
Which method resulting in a win against Ed Mahone?,SELECT Method FROM table WHERE Result = win AND Opponent = ed mahone
When did  the technical knockout against Fatu Tuimanono happen?,SELECT Date FROM table WHERE Method = technical knockout AND Opponent = fatu tuimanono
When did the opponent knockout Barry Prior in more than 2 rounds?,SELECT Date FROM table WHERE Method = knockout AND Round > 2 AND Opponent = barry prior
What resulted after 4 rounds with Ed Mahone?,SELECT Result FROM table WHERE Round > 4 AND Opponent = ed mahone
Tell me the region for georgia,SELECT Region FROM table WHERE State = georgia
Tell me the host for midwest thomas assembly center,SELECT Host FROM table WHERE Region = midwest AND Venue = thomas assembly center
Tell me the region for frank erwin center,SELECT Region FROM table WHERE Venue = frank erwin center
"In 1971 at MCG, what was the score of the VFL Reserves?",SELECT Score FROM table WHERE Competition = vfl reserves AND Venue = mcg AND Year = 1971
What was the score when Richmond was the opponent?,SELECT Score FROM table WHERE Opponent = richmond
Where was the match with a score of 18.6 (114) - 21.14 (140)?,SELECT Venue FROM table WHERE Score = 18.6 (114) - 21.14 (140)
"At the VFL Reserves, who was the opponent when the score was 18.6 (114) - 21.14 (140)?",SELECT Opponent FROM table WHERE Competition = vfl reserves AND Score = 18.6 (114) - 21.14 (140)
Where was the match with a score of 4.10 (34) - 8.12 (60)?,SELECT Venue FROM table WHERE Score = 4.10 (34) - 8.12 (60)
How much is the total BBC 2 viewing in 1999?,SELECT BBC Two total viewing FROM table WHERE Year = 1999
What was the rank of BBC 2 in 2005?,SELECT BBC Two Rank FROM table WHERE Year = 2005
"What is the BBC 2 rank when BBC 1 is 1st rank and the total viewing is 9,840,000?","SELECT BBC Two Rank FROM table WHERE BBC One Rank = 1st AND BBC One total viewing = 9,840,000"
In what year was BBC 2 13th in rank?,SELECT Year FROM table WHERE BBC Two Rank = 13th
How many goals occurred for Stein Huysegems when the caps value is more than 8?,SELECT Goals FROM table WHERE Caps > 8 AND Player = stein huysegems
What is the largest caps value for Glen Moss?,SELECT MAX Caps FROM table WHERE Player = glen moss
What is the oldest year that the Royal Philharmonic Orchestra released a record with Decca Records?,SELECT MIN Year of Recording FROM table WHERE Orchestra = royal philharmonic orchestra AND Record Company = decca records
What format was conductor Erich Leinsdorf's album released on?,SELECT Format FROM table WHERE Conductor = erich leinsdorf
What record company released a CD in 1964?,SELECT Record Company FROM table WHERE Year of Recording = 1964 AND Format = cd
What division has finalist playoffs and was 3rd round Open Cup?,SELECT Division FROM table WHERE Playoffs = finalist AND Open Cup = 3rd round
What year was the team 8th in the season and made it to the 3rd round in Open Cup?,SELECT Year FROM table WHERE Reg. Season = 8th AND Open Cup = 3rd round
Tell me the launch date/time for payload of gsat-4,SELECT Launch date/time (UTC) FROM table WHERE Payload = gsat-4
Tell me the launch pad for 25 december 2010 10:34,SELECT Launch Pad FROM table WHERE Launch date/time (UTC) = 25 december 2010 10:34
"Who had a rank more than 48, and a last in 2005?",SELECT Name FROM table WHERE Rank > 48 AND Last = 2005
Which UEFA confederation member had a rank more than 17 and caps of 114?,SELECT Name FROM table WHERE Rank > 17 AND Confederation = uefa AND Caps = 114
"Tell me the result of july 16, 2000","SELECT Result FROM table WHERE Date = july 16, 2000"
What is the maximum cap number where 0 goals were scored with a rank of 15?,SELECT MAX Caps FROM table WHERE Goals = 0 AND Rank = 15
What were the fewest amount of guns possessed by a frigate that served in 1815?,SELECT MIN Guns FROM table WHERE Class = frigate AND Year = 1815
"Of the games that sold 321,000 units in the UK, what is their average place?","SELECT AVG Place FROM table WHERE Units sold in the UK = 321,000"
"How many units were sold in the US of the game that sold 346,000 units in japan?","SELECT Units sold in the US FROM table WHERE Units sold in Japan = 346,000"
Tell me the player from dallas burn,SELECT Player FROM table WHERE MLS team = dallas burn
Tell me the sum of pick number for kenny arena,SELECT SUM Pick # FROM table WHERE Player = kenny arena
What city is the Northeast Louisiana University located in?,SELECT City FROM table WHERE Host = northeast louisiana university
What region is the city of Philadelphia located in?,SELECT Region FROM table WHERE City = philadelphia
What venue is in Long Beach?,SELECT Venue FROM table WHERE City = long beach
What state is Knoxville and the mideast region located in?,SELECT State FROM table WHERE Region = mideast AND City = knoxville
What is the host in Georgia?,SELECT Host FROM table WHERE State = georgia
What state is the University of Tennessee located in?,SELECT State FROM table WHERE Host = university of tennessee
Tell me the date that has a week larger than 3 and a result of w 28-27,SELECT Date FROM table WHERE Week > 3 AND Result = w 28-27
Tell me the sum of attendane for a result of w 12-3 and week more than 12,SELECT SUM Attendance FROM table WHERE Result = w 12-3 AND Week > 12
Tell me the total number of attendance for result of l 18-6,SELECT COUNT Attendance FROM table WHERE Result = l 18-6
Tell me the total number of attendance for week of 16,SELECT COUNT Attendance FROM table WHERE Week = 16
How many bronzes were held by those with a total of 4 and less than 3 silvers.,SELECT SUM Bronze FROM table WHERE Total = 4 AND Silver < 3
How many rounds did the IFL: Oakland event have?,SELECT SUM Round FROM table WHERE Event = ifl: oakland
Which opponent has a record of 3-0?,SELECT Opponent FROM table WHERE Record = 3-0
Tell me the constructor for david coulthard,SELECT Constructor FROM table WHERE Driver = david coulthard
Tell me the pos for adrian sutil,SELECT Pos. FROM table WHERE Driver = adrian sutil
Tell me the part 1 of grid of 1,SELECT Part 1 FROM table WHERE Grid = 1
Name the city of license for call sign of k215es,SELECT City of license FROM table WHERE Call sign = k215es
Name the FCC info for call sign of k208eq,SELECT FCC info FROM table WHERE Call sign = k208eq
Tell me the total number of date for carpet,SELECT COUNT Date FROM table WHERE Surface = carpet
"Tell me the opponent for 6–2, 3–6, 4–6","SELECT Opponent in the final FROM table WHERE Score in the final = 6–2, 3–6, 4–6"
What is the nationality of Martin Lewis?,SELECT Nationality FROM table WHERE Player = martin lewis
Tell me the opponent of week 14,SELECT Opponent FROM table WHERE Week = 14
Tell me the average attendance for week of 11,SELECT AVG Attendance FROM table WHERE Week = 11
Tell me opponent for result of w 33-31,SELECT Opponent FROM table WHERE Result = w 33-31
"What Name is administered by oral or iv, and is being investigated for thyroid imaging thyroid metastases imaging?",SELECT Name FROM table WHERE Route of administration = oral or iv AND Investigation = thyroid imaging thyroid metastases imaging
Who is the owner with a call sign of cjgx?,SELECT Owner FROM table WHERE Call sign = cjgx
Who is the owner of the branding gx94?,SELECT Owner FROM table WHERE Branding = gx94
What is the call frequency sign of cjjc-fm?,SELECT Frequency FROM table WHERE Call sign = cjjc-fm
Who is the owner with the branding fox fm?,SELECT Owner FROM table WHERE Branding = fox fm
What is the branding frequency of cbc radio 2?,SELECT Frequency FROM table WHERE Branding = cbc radio 2
Tell me the location for altitude being less thaan 6102,SELECT Location FROM table WHERE Altitude (metres) < 6102
Say the region for 6854 altitudes,SELECT Region FROM table WHERE Altitude (metres) = 6854
What is the frequency of number 161?,SELECT Frequency FROM table WHERE Number = 161
What is the frequency of number 3 with a bus station origin?,SELECT Frequency FROM table WHERE Origin = bus station AND Number = 3
What is the origin of the one with a number larger than 161?,SELECT Origin FROM table WHERE Number > 161
