question,sql
What is the frequency of the Chennai Egmore Dibrugarh Express to Dibrugarh?,SELECT Frequency FROM table WHERE Destination = dibrugarh AND Train Name = chennai egmore dibrugarh express
"How many Norwegian Americans have Norwegian Americans (2000) of 109,744?","SELECT COUNT Norwegian Americans (2009) FROM table WHERE Norwegian Americans (2000) = 109,744"
Which state has a Percent (2009) of 6.2%?,SELECT State FROM table WHERE Percent (2009) = 6.2%
What is the holding of the customers?,SELECT Holding FROM table WHERE Component = customers
"What Allied-Unrelated is labeled as ""common""?",SELECT Allied-Unrelated FROM table WHERE Allied-Related = common
Which integrated has an allied-related of some shared?,SELECT Integrated FROM table WHERE Allied-Related = some shared
What integrated has an allied-related of centralized?,SELECT Integrated FROM table WHERE Allied-Related = centralized
What component has an integrated of one?,SELECT Component FROM table WHERE Integrated = one
How many candidates had 0 percent of the vote in 1999?,SELECT COUNT candidates FROM table WHERE % of vote = 0 AND Election = 1999 AND seats won > 0
What is the score of the game with Manu ginóbili (44) as the leading scorer?,SELECT Score FROM table WHERE Leading scorer = manu ginóbili (44)
"What is the record of the game on February 21, 2008?","SELECT Record FROM table WHERE Date = february 21, 2008"
Who was the home team of the game with manu ginóbili (34) as the leading scorer?,SELECT Home FROM table WHERE Leading scorer = manu ginóbili (34)
"What is the record of the game on February 25, 2008?","SELECT Record FROM table WHERE Date = february 25, 2008"
What type is shown with a moving to of valenciennes?,SELECT Type FROM table WHERE Moving to = valenciennes
"What is the transfer window with n/a as the Transfer fee, free agent for the Moving to, and Joe Sagar as the name?",SELECT Transfer window FROM table WHERE Transfer fee = n/a AND Moving to = free agent AND Name = joe sagar
"What is the name of the person with a type of end of contract, nat of sco, and the Moving to is cardiff city?",SELECT Name FROM table WHERE Type = end of contract AND Nat. = sco AND Moving to = cardiff city
"What Transfer window that has a Transfer fee of free, with a Moving to of derby county?",SELECT Transfer window FROM table WHERE Transfer fee = free AND Moving to = derby county
"What is the first game number that had attendance of 56,505?","SELECT MIN Game FROM table WHERE Attendance = 56,505"
What was the crowd size for the away team footscray?,SELECT Crowd FROM table WHERE Away team = footscray
On what date did the away team score 10.12 (72)?,SELECT Date FROM table WHERE Away team score = 10.12 (72)
Which Race Name has Goodwood in the Curcuit?,SELECT Race Name FROM table WHERE Circuit = goodwood
"Which Constructor has the Winning Driver, Jim Clark and the Circuit, Syracuse?",SELECT Constructor FROM table WHERE Winning driver = jim clark AND Circuit = syracuse
"Which Constructor has the Winning Driver, Jo Siffert?",SELECT Constructor FROM table WHERE Winning driver = jo siffert
Which Constructor has Pergusa in the Circuit?,SELECT Constructor FROM table WHERE Circuit = pergusa
What is the smallest crowd that attended a game where the away team scored 14.19 (103)?,SELECT MIN Crowd FROM table WHERE Away team score = 14.19 (103)
On what date was a game played at MCG?,SELECT Date FROM table WHERE Venue = mcg
What is the average total medals of the team with 2 gold and less than 1 silver?,SELECT AVG Total FROM table WHERE Gold = 2 AND Silver < 1
"What is the lowest amount of silver medals Iceland, who has less than 87 medals, has?",SELECT MIN Silver FROM table WHERE Nation = iceland AND Total < 87
"What is the least amount of bronze Andorra, who has more than 6 total medals, has?",SELECT MIN Bronze FROM table WHERE Nation = andorra AND Total > 6
"What is the lowest amount of bronze Liechtenstein, who has more than 11 gold, has?",SELECT MIN Bronze FROM table WHERE Nation = liechtenstein AND Gold > 11
"What is the average amount of silver medals Montenegro, who has less than 15 bronze and more than 11 total medals, has?",SELECT AVG Silver FROM table WHERE Bronze < 15 AND Nation = montenegro AND Total > 11
What is the lower turnout that has a byut of 50.7 and an ou psd smaller than 36.8?,SELECT MIN Voter turnout FROM table WHERE BYuT = 50.7 AND OU-PSD < 36.8
What is the voter registration that has a BYut of 48.2?,SELECT COUNT Voter registration FROM table WHERE BYuT = 48.2
Who was the home team at VFL Park?,SELECT Home team FROM table WHERE Venue = vfl park
Who was the home team at Kardinia Park?,SELECT Home team FROM table WHERE Venue = kardinia park
What type of paper is the 1 cent denominations made on?,SELECT Paper Type FROM table WHERE Denomination = 1 cent
What is the paper type that the one that was issued on 26 july 2007 done on?,SELECT Paper Type FROM table WHERE Date of Issue = 26 july 2007
What did the home team footscray score?,SELECT Home team score FROM table WHERE Home team = footscray
What was the total crowd size for the him team footscray?,SELECT COUNT Crowd FROM table WHERE Home team = footscray
What is the Home team at corio oval?,SELECT Home team FROM table WHERE Venue = corio oval
"What was the away team score when the crowd is larger than 22,000 and hawthorn is the home team?","SELECT Away team score FROM table WHERE Crowd > 22,000 AND Home team = hawthorn"
"What livery was worn on the date before 1936, with the description of Gresley RF?",SELECT Livery FROM table WHERE Date < 1936 AND Description = gresley rf
Which number and name has the description Gresley RB and a date before 1937?,SELECT Number & Name FROM table WHERE Description = gresley rb AND Date < 1937
"Who is the owner before 1940, who had a number and name of no. 1222?",SELECT Owner(s) FROM table WHERE Date < 1940 AND Number & Name = no. 1222
What type has a scratch of 750 GB?,SELECT Type FROM table WHERE Scratch = 750 gb
What is the Cache for a Number 64 with a Memory of 24 gb qpi 5.86 gt/s?,SELECT Cache FROM table WHERE Memory = 24 gb qpi 5.86 gt/s AND Number = 64
What is the Memory for a Number 32 with a Clock of 2.26ghz?,SELECT Memory FROM table WHERE Clock = 2.26ghz AND Number = 32
"Of those acquired in 2008, where were they born?",SELECT Place of Birth FROM table WHERE Acquired = 2008
"What is the shooting preference of Matthew Myers, acquired in 2010?",SELECT Shoots FROM table WHERE Acquired = 2010 AND Player = matthew myers
In what year was player Bruce Graham acquired?,SELECT Acquired FROM table WHERE Player = bruce graham
Name th D 43 √ when R 51 + is r 30,SELECT D 43 √ FROM table WHERE R 51 + = r 30
Name the R 53 + which has a D 42 √ of d 17,SELECT R 53 + FROM table WHERE D 42 √ = d 17
Name the D 45 O which has R 51 + of d 30,SELECT D 45 O FROM table WHERE R 51 + = d 30
Name the D 42 √ when it has D 44 √ of r 36 √,SELECT D 42 √ FROM table WHERE D 44 √ = r 36 √
Name the D 45 O that has D 46 O of d 26,SELECT D 45 O FROM table WHERE D 46 O = d 26
Name the least goals for goal difference of 7 and losses more than 13,SELECT MIN Goals against FROM table WHERE Goal Difference = 7 AND Losses > 13
Tell me the total number of positions with goal difference more than -17 and played less than 38,SELECT COUNT Position FROM table WHERE Goal Difference > -17 AND Played < 38
Where did Melbourne play as the away team?,SELECT Venue FROM table WHERE Away team = melbourne
What was the attendance when South Melbourne played as the home team?,SELECT MIN Crowd FROM table WHERE Home team = south melbourne
What was the attendance when Footscray played as the away team?,SELECT COUNT Crowd FROM table WHERE Away team = footscray
"What is the lowest quantity for GWR Nos. 696, 779, 93 5 from the manufacturer Peckett and Sons?","SELECT MIN Quantity FROM table WHERE Manufacturer = peckett and sons AND GWR Nos. = 696, 779, 93 5"
What is the lowest capacity with an opening larger than 2015 in Trabzon?,SELECT MIN Capacity FROM table WHERE Opening > 2015 AND City = trabzon
"What is the average opening at Stadyum Samsun with a capacity smaller than 34,658?","SELECT AVG Opening FROM table WHERE Stadium = stadyum samsun AND Capacity < 34,658"
What is the Years for Jazz Club at Oregon State?,SELECT Years for Jazz FROM table WHERE School/Club Team = oregon state
Which player is Andre Owens in Year for Jazz?,SELECT Years for Jazz FROM table WHERE Player = andre owens
What is the Year for Jazz club of Houston?,SELECT Years for Jazz FROM table WHERE School/Club Team = houston
What is position does Dan O'Sullivan play?,SELECT Position FROM table WHERE Player = dan o'sullivan
What position in the club team of Kansas?,SELECT Position FROM table WHERE School/Club Team = kansas
"Who is the center position of Years for Jazz, Greg Ostertag?",SELECT Years for Jazz FROM table WHERE Position = center AND Player = greg ostertag
What is the Date for the Away team University?,SELECT Date FROM table WHERE Away team = university
What is the Home team score at junction oval?,SELECT Home team FROM table WHERE Venue = junction oval
What is the Away team score when Home team score is at 5.10 (40)?,SELECT Away team score FROM table WHERE Home team score = 5.10 (40)
What Date did the Home team play in essendon?,SELECT Date FROM table WHERE Home team = essendon
What country has OF-1 Locotenent?,SELECT Country FROM table WHERE OF-1 = locotenent
What country has OF-1 Locotenent?,SELECT Country FROM table WHERE OF-1 = locotenent
Which OF-5 is in Ghana?,SELECT OF-5 FROM table WHERE Country = ghana
What is the OF-4 of Albania?,SELECT OF-4 FROM table WHERE Country = albania
What is the total pick numbers for the CFL team Edmonton Eskimos?,SELECT SUM Pick # FROM table WHERE CFL Team = edmonton eskimos
What p;layer attended Concordia College?,SELECT Player FROM table WHERE College = concordia
What is the total number of picks for the position of OL?,SELECT SUM Pick # FROM table WHERE Position = ol
Name the highest week for result of w 38-13,SELECT MAX Week FROM table WHERE Result = w 38-13
"I want to know the date with attendance of 35,763","SELECT Date FROM table WHERE Attendance = 35,763"
Which series with a total of 27 albums did Dargaud edit?,SELECT Series FROM table WHERE Editor = dargaud AND Albums = 27
What years did the magazine Vaillant and Pif run?,SELECT Years FROM table WHERE Magazine = vaillant and pif
What state is susana martinez from?,SELECT State FROM table WHERE Current Governor = susana martinez
Which away team has a Home team score of 15.14 (104)?,SELECT Away team FROM table WHERE Home team score = 15.14 (104)
What is the Home team score when away team is hawthorn?,SELECT Home team score FROM table WHERE Away team = hawthorn
What league is ordabasy-2 in?,SELECT League FROM table WHERE Team = ordabasy-2
How many people attended the game where the home team scored 10.13 (73)?,SELECT AVG Crowd FROM table WHERE Home team score = 10.13 (73)
What is the lowest amount of people that attended a game where the home team scored 10.13 (73)?,SELECT MIN Crowd FROM table WHERE Home team score = 10.13 (73)
On what date was Richmond hosted as the away team?,SELECT Date FROM table WHERE Away team = richmond
Tell me the Hindu with Jewish of source: uk 2001 census,SELECT Hindu FROM table WHERE Jewish = source: uk 2001 census
Tell me the ethnic group for jewish of 0.47%,SELECT Ethnic group FROM table WHERE Jewish = 0.47%
Tell me the Hindu for ethnic group for white irish,SELECT Hindu FROM table WHERE Ethnic group = white irish
Name the ethnic group with a buddhist of 0.19%,SELECT Ethnic group FROM table WHERE Buddhist = 0.19%
What was the attendance of week 8?,SELECT Attendance FROM table WHERE Week = 8
How many points did the home score at a game that had their opponents scoring 12.16 (88)?,SELECT Home team score FROM table WHERE Away team score = 12.16 (88)
Who was the home team that had a score of 13.14 (92)?,SELECT Home team FROM table WHERE Home team score = 13.14 (92)
Who was the opponent of carlton at their home game?,SELECT Away team FROM table WHERE Home team = carlton
Tell me the result for 3 goals,SELECT Result FROM table WHERE Goal = 3
Name the score for november 16,SELECT Score FROM table WHERE Date = november 16
On what date did an away team score 22.17 (149)?,SELECT Date FROM table WHERE Away team score = 22.17 (149)
In what Venue was the Away Team Score 19.13 (127)?,SELECT Venue FROM table WHERE Away team score = 19.13 (127)
What is the Away Team Score of the Hawthorn Home Team?,SELECT Away team score FROM table WHERE Home team = hawthorn
What is the Away Team Score of the Collingwood Home Team?,SELECT Away team score FROM table WHERE Away team = collingwood
What Away Team's venue is Arden Street Oval?,SELECT Away team FROM table WHERE Venue = arden street oval
Name the least Laps for accident and gird more than 13,SELECT MIN Laps FROM table WHERE Time/Retired = accident AND Grid > 13
Tell me the lowest Grid for engine and driver of emerson fittipaldi with more laps than 70,SELECT MIN Grid FROM table WHERE Time/Retired = engine AND Driver = emerson fittipaldi AND Laps > 70
"What the score when Richmond played at home and the crowd was larger than 15,184?","SELECT Home team score FROM table WHERE Crowd > 15,184 AND Home team = richmond"
In what venue was the away team South Melbourne?,SELECT Venue FROM table WHERE Away team = south melbourne
Where did the away team Carlton play?,SELECT Venue FROM table WHERE Away team = carlton
What home team played against Richmond?,SELECT Home team FROM table WHERE Away team = richmond
What is the smallest crowd size for punt road oval?,SELECT MIN Crowd FROM table WHERE Venue = punt road oval
Where did a home team score 23.20 (158)?,SELECT Venue FROM table WHERE Home team score = 23.20 (158)
Which team scored 11.17 (83) while away?,SELECT Away team FROM table WHERE Away team score = 11.17 (83)
Which Number of people 1991 has a Percent of Slovenes 1991 of 14.4%?,SELECT MAX Number of people 1991 FROM table WHERE Percent of Slovenes 1991 = 14.4%
"Which Percent of Slovenes 1951 has a Number of people 1991 larger than 8, and a Village (German) of plöschenberg?",SELECT Percent of Slovenes 1951 FROM table WHERE Number of people 1991 > 8 AND Village (German) = plöschenberg
Where was Collingwood's away game played?,SELECT Venue FROM table WHERE Away team = collingwood
What did the home team score in the game that the away team scored 10.17 (77)?,SELECT Home team score FROM table WHERE Away team score = 10.17 (77)
What was the away team's score at Western Oval?,SELECT Away team score FROM table WHERE Venue = western oval
When did Collingwood play an away game?,SELECT Date FROM table WHERE Away team = collingwood
How many people attended the game that the Away team scored 10.17 (77) points in?,SELECT COUNT Crowd FROM table WHERE Away team score = 10.17 (77)
Where was the game played when the home team score was 11.9 (75)?,SELECT Venue FROM table WHERE Home team score = 11.9 (75)
What team is based at junction oval?,SELECT Home team FROM table WHERE Venue = junction oval
What is the team set at junction oval?,SELECT Home team FROM table WHERE Venue = junction oval
What was the home team that scored 20.21 (141)?,SELECT Home team FROM table WHERE Home team score = 20.21 (141)
How big was the crowd in a game that had the home team score 18.19 (127)?,SELECT COUNT Crowd FROM table WHERE Home team score = 18.19 (127)
What was the place that had the home team score 16.19 (115)?,SELECT Venue FROM table WHERE Home team score = 16.19 (115)
What driver has a grid under 12 with a Time/Retired of + 3 laps?,SELECT Driver FROM table WHERE Grid < 12 AND Time/Retired = + 3 laps
"What is the high grid for osella - alfa romeo, and a Laps larger than 61?",SELECT MAX Grid FROM table WHERE Constructor = osella - alfa romeo AND Laps > 61
How many picks does Matt Moran have altogether after round 6?,SELECT COUNT Pick FROM table WHERE Name = matt moran AND Round > 6
What position after round 8 has a pick less than 270?,SELECT Position FROM table WHERE Round > 8 AND Pick < 270
What is the total number of rounds that UCLA has?,SELECT COUNT Round FROM table WHERE School = ucla
What is the lowest round for Georgia Tech?,SELECT MIN Round FROM table WHERE School = georgia tech
What is the average round for Georgia Tech with a pick greater than 103?,SELECT AVG Round FROM table WHERE School = georgia tech AND Pick > 103
Which player is featured for 2001-2002?,SELECT Player FROM table WHERE Year = 2001-2002
"Which player is from Queens, NY?","SELECT Player FROM table WHERE Hometown = queens, ny"
Where did Maya Moore attend school?,SELECT School FROM table WHERE Player = maya moore
What is the difference with a loss smaller than 5 and points lower than 32?,SELECT COUNT Diff FROM table WHERE Lost < 5 AND Points < 32
Which loss had a player lower than 18?,SELECT MIN Lost FROM table WHERE Played < 18
Who won the 2012 game that had a score of 15–0?,SELECT Winner FROM table WHERE Year = 2012 AND Result = 15–0
"Tell me the week for result of l 31-27, and an Attendance smaller than 85,865","SELECT AVG Week FROM table WHERE Result = l 31-27 AND Attendance < 85,865"
"I want the date for week less than 5 and attendance more than 43,922 with a result of w 21-7","SELECT Date FROM table WHERE Week < 5 AND Attendance > 43,922 AND Result = w 21-7"
Who had notes of Prizzi's Honor?,SELECT Director FROM table WHERE Notes = prizzi's honor
What Superlative had a record set of 12 nominations?,SELECT Superlative FROM table WHERE Record Set = 12 nominations
What is the highest number of laps completed by driver Joe Nemechek?,SELECT MAX Laps FROM table WHERE Driver = joe nemechek
What is the home team score when they played at Victoria Park?,SELECT Home team score FROM table WHERE Venue = victoria park
What was the away team score when the home team score was 11.18 (84)?,SELECT Away team score FROM table WHERE Home team score = 11.18 (84)
What was the venue when the home team was Fitzroy?,SELECT Venue FROM table WHERE Home team = fitzroy
What team was the home team when the home team score was 12.16 (88)?,SELECT Home team FROM table WHERE Home team score = 12.16 (88)
What team was the away team when the home team score was 16.11 (107)?,SELECT Away team FROM table WHERE Home team score = 16.11 (107)
What is the date for proposed for revere textile prints corporation,SELECT Proposed FROM table WHERE Name = revere textile prints corporation
What is the deleted for tolland?,SELECT Deleted FROM table WHERE County = tolland
What venue has the away side scoring 16.14 (110)?,SELECT Venue FROM table WHERE Away team score = 16.14 (110)
What is the away side score when hawthorn is the home side?,SELECT Away team score FROM table WHERE Home team = hawthorn
What is the average lap total for grids under 19 and a Time/Retired of +4 laps?,SELECT AVG Laps FROM table WHERE Time/Retired = +4 laps AND Grid < 19
Who drive over 43 laps in grid 5?,SELECT Driver FROM table WHERE Laps > 43 AND Grid = 5
What team played away in the game that the home team scored 7.8 (50)?,SELECT Away team FROM table WHERE Home team score = 7.8 (50)
What did the home team score when the away team scored 6.8 (44)?,SELECT Home team score FROM table WHERE Away team score = 6.8 (44)
Which Away team score has a Venue of princes park?,SELECT Away team score FROM table WHERE Venue = princes park
Which Away team score has a Home team of melbourne?,SELECT Away team score FROM table WHERE Home team = melbourne
What genre is revolving doors of vengeance 酒店風雲?,SELECT Genre FROM table WHERE English title (Chinese title) = revolving doors of vengeance 酒店風雲
"What is the english title of the modern drama, episode 20, that airs on 26 sep- 21 oct?",SELECT English title (Chinese title) FROM table WHERE Genre = modern drama AND Number of episodes = 20 AND Airing date = 26 sep- 21 oct
What is the D48 when the D 50 O is d 31?,SELECT D 48 √ FROM table WHERE D 50 O = d 31
What was Catalogue tojp 60121-22's Date?,SELECT Date FROM table WHERE Catalogue = tojp 60121-22
What was the Date of Country of United States?,SELECT Date FROM table WHERE Country = united states
"What Catalogue is Dated 14 november 2003, with the Format compact disc?",SELECT Catalogue FROM table WHERE Date = 14 november 2003 AND Format = compact disc
"What is the Label for Date of 14 November 2003, and Catalogue tojp 60121-22?",SELECT Label FROM table WHERE Date = 14 november 2003 AND Catalogue = tojp 60121-22
What Label was Catalogued tojp 60121-22?,SELECT Label FROM table WHERE Catalogue = tojp 60121-22
What is the record for Norway on 23 august 1981?,SELECT Record FROM table WHERE Nationality = norway AND Date = 23 august 1981
What is the record for the 20000 m walk?,SELECT Record FROM table WHERE Event = 20000 m walk
When was the Bye week?,SELECT Date FROM table WHERE Result = bye
Which Open 2nd VIII had a U15 6th Quad of BGS and a U16 1st VII of TSS?,SELECT Open 2nd VIII FROM table WHERE U15 6th Quad = bgs AND U16 1st VIII = tss
What U15 3rd Quad has a U15 2nd Quad of ACGS?,SELECT U15 3rd Quad FROM table WHERE U15 2nd Quad = acgs
Which U15 4th Quad had a U15 3rd Quad of BBC and U15 6th Quad of GT?,SELECT U15 4th Quad FROM table WHERE U15 3rd Quad = bbc AND U15 6th Quad = gt
Which U15 1st Quad had an Open 3rd VIII of BBC and U16 3rd VIII of BBC?,SELECT U15 1st Quad FROM table WHERE Open 3rd VIII = bbc AND U16 3rd VIII = bbc
What was the nationality of the athlete with a final result of 4.50?,SELECT Nationality FROM table WHERE Result = 4.50
What was the athlete with a final result of 4.30?,SELECT Athlete FROM table WHERE Result = 4.30
Which country has the Highest mountain of rettlkirchspitze?,SELECT Country FROM table WHERE Highest mountain = rettlkirchspitze
What is the average height with the Highest mountain of hochgall?,SELECT AVG Height (m) FROM table WHERE Highest mountain = hochgall
What US Country released an album of singles only in 1967?,SELECT U.S. Country FROM table WHERE Album = singles only AND Year = 1967
What was the best album in 1965?,SELECT U.S. AC FROM table WHERE Album = the best AND Year = 1965
What is the result of the fight that had a tko (low kicks)?,SELECT Result FROM table WHERE Method = tko (low kicks)
What event went under 3 rounds and was no contest (punch after knockdown)?,SELECT Event FROM table WHERE Round < 3 AND Method = no contest (punch after knockdown)
What event was in hong kong and went less than 2 rounds?,SELECT Event FROM table WHERE Round < 2 AND Location = hong kong
How many rounds was the fight against carter williams?,SELECT Round FROM table WHERE Opponent = carter williams
In rounds 7-13 what engine was featured?,SELECT Engine FROM table WHERE Rounds = 7-13
What score was conceded by Richmond?,SELECT Away team score FROM table WHERE Home team = richmond
What is the number of Goals on 1950-05-30?,SELECT COUNT Goals FROM table WHERE Date = 1950-05-30
"In 1948-10-28, what were the lowest Goals in Tehran, Iran?","SELECT MIN Goals FROM table WHERE Venue = tehran, iran AND Date = 1948-10-28"
In what Venue was the Result 1-3?,SELECT Venue FROM table WHERE Result = 1-3
"In 1948-10-28, in what Venue was the Competition of International Match held?",SELECT Venue FROM table WHERE Competition = international match AND Date = 1948-10-28
What was the Zakspeed 1500/4 1.5 l4 t chassis?,SELECT Chassis FROM table WHERE Engine = zakspeed 1500/4 1.5 l4 t
What was the Michele Alboreto's engine?,SELECT Engine FROM table WHERE Driver = michele alboreto
What is the average rank for antun salman?,SELECT AVG Rank FROM table WHERE Candidate name = antun salman
"Khalil chawka has a gender of ♂, a religion of ☪, and how many votes?",SELECT Votes FROM table WHERE Gender = ♂ AND Religion = ☪ AND Candidate name = khalil chawka
Who has a religion of ☪ and more than 1853 votes?,SELECT Candidate name FROM table WHERE Votes > 1853 AND Religion = ☪
What is the recorder has a Track more than 11 with a time 3:06,SELECT Recorded FROM table WHERE Track > 11 AND Time = 3:06
Which track has a title : Just a little bit,SELECT MIN Track FROM table WHERE Song Title = just a little bit
What is the Trophy with a Season with 2008–2009?,SELECT Trophy FROM table WHERE Season = 2008–2009
What Wasatch time corresponds to a total time of 122:13:40?,SELECT Wasatch FROM table WHERE Total time = 122:13:40
Who were the opponents in the final on 9 January 1994?,SELECT Opponents in Final FROM table WHERE Date = 9 january 1994
Who was Melbourne's home team opponent?,SELECT Home team FROM table WHERE Away team = melbourne
Who was Richmond's away team opponent?,SELECT Away team FROM table WHERE Home team = richmond
"What is the average FA Cup value with a total greater than 2, a League Cup of 1, a league less than 3, and Paul Ince scoring?",SELECT AVG FA Cup FROM table WHERE Total > 2 AND League Cup = 1 AND Name = paul ince AND League < 3
What is the average total value in a League less than 1 with more than 1 League Cup?,SELECT AVG Total FROM table WHERE League < 1 AND League Cup > 1
"What is the smallest value for League Cup when the League number is greater than 1, no FA Cups, and Brian Deane scoring?",SELECT MIN League Cup FROM table WHERE League > 1 AND Name = brian deane AND FA Cup < 1
Name the region before 2008 when name of best 1200,SELECT Region FROM table WHERE Year < 2008 AND Name = best 1200
What method resulted in a win and a time of 4:36?,SELECT Method FROM table WHERE Res. = win AND Time = 4:36
At what venue did the Essendon team play as an away team?,SELECT Venue FROM table WHERE Away team = essendon
Who was the home team for the game played at Junction Oval?,SELECT Home team FROM table WHERE Venue = junction oval
What was the score of the home team when the away team was Geelong?,SELECT Home team score FROM table WHERE Away team = geelong
What was the venue where the away team ended in a score of 6.8 (44)?,SELECT Venue FROM table WHERE Away team score = 6.8 (44)
