question,sql
Who won the mens singles when lau sui fei won the womens singles?,SELECT Mens Singles FROM table WHERE Womens Singles = Lau Sui Fei
Who won the mens doubles when wang hao won the mens singles?,SELECT Mens Doubles FROM table WHERE Mens Singles = Wang Hao
Who won in the men singles group in the year when Yoshie Takada won in the women singles?,SELECT Mens Singles FROM table WHERE Womens Singles = Yoshie Takada
When and where did Chen Qi win in men singles?,SELECT Year Location FROM table WHERE Mens Singles = Chen Qi
Who is listed under mens singles when womens has wang nan zhang yining?,SELECT Mens Singles FROM table WHERE Womens Doubles = Wang Nan Zhang Yining
How many womens singles entries are there when womens doubles is li xiaodan wen jia?,SELECT COUNT Womens Singles FROM table WHERE Womens Doubles = Li Xiaodan Wen Jia
Who is listed under womens singles when year location is 1998 doha?,SELECT Womens Singles FROM table WHERE Year Location = 1998 Doha
Who is listed under mens singles when the year location is 2009 doha?,SELECT Mens Singles FROM table WHERE Year Location = 2009 Doha
How many  year locations are there for the womens doubles in jing junhong li jiawei?,SELECT COUNT Year Location FROM table WHERE Womens Doubles = Jing Junhong Li Jiawei
How many players are there for mens singles when chen qi ma lin played mens doubles?,SELECT COUNT Mens Singles FROM table WHERE Mens Doubles = Chen Qi Ma Lin
Who played mens doubles for the 1999 kobe tour?,SELECT Mens Doubles FROM table WHERE Year Location = 1999 Kobe
Where was the tour when  jing junhong li jiawei played womens doubles?,SELECT Year Location FROM table WHERE Womens Doubles = Jing Junhong Li Jiawei
How many years did lin gaoyuan wu jiaji play  mens doubles?,SELECT COUNT Year Location FROM table WHERE Mens Doubles = Lin Gaoyuan Wu Jiaji
How many people are shown for mens doubles when guo yue played womens singles?,SELECT COUNT Mens Doubles FROM table WHERE Womens Singles = Guo Yue
Who won the Womens Singles in the year the Jean-Michel Saive won the Mens Singles?,SELECT Womens Singles FROM table WHERE Mens Singles = Jean-Michel Saive
In what year and location did Liu Guozheng win the Mens Singles?,SELECT Year Location FROM table WHERE Mens Singles = Liu Guozheng
In what year and location did Wang Liqin win the Mens Singles?,SELECT Year Location FROM table WHERE Mens Singles = Wang Liqin
Who won the mens doubles at the 2006 guangzhou event?,SELECT Mens Doubles FROM table WHERE Year Location = 2006 Guangzhou
How many times was the womens doubles in china?,SELECT COUNT Mens Singles FROM table WHERE Womens Doubles = China
How many times did  li ju win the womens singles and wang liqin win the mens singles?,SELECT COUNT Womens Doubles FROM table WHERE Womens Singles = Li Ju AND Mens Singles = Wang Liqin
Name the mens singles for lee eun-sil moon hyun-jung,SELECT Mens Singles FROM table WHERE Womens Doubles = Lee Eun-Sil Moon Hyun-Jung
Name the number of womens doubles for 2011 rio de janeiro,SELECT COUNT Womens Doubles FROM table WHERE Year Location = 2011 Rio de Janeiro
Name the year location for  haruna fukuoka,SELECT Year Location FROM table WHERE Womens Singles = Haruna Fukuoka
Name the mens doubles for dimitrij ovtcharov,SELECT Mens Doubles FROM table WHERE Mens Singles = Dimitrij Ovtcharov
Name the number of womens singles for 1999 rio de janeiro,SELECT COUNT Womens Singles FROM table WHERE Year Location = 1999 Rio de Janeiro
Name the womens doubles for werner schlager,SELECT Womens Doubles FROM table WHERE Mens Singles = Werner Schlager
Who was the womens double winner when the womens singles winner was Ding Ning?,SELECT Womens Doubles FROM table WHERE Womens Singles = Ding Ning
Who wrote episode number 19 in the series?,SELECT Written by FROM table WHERE No. in series = 19
How many marks are there when tackles are 3?,SELECT Marks FROM table WHERE Tackles = 3
What was the goal accuracy % when the total disposals are 481?,SELECT Goal Accuracy % FROM table WHERE Total Disposals = 481
"Who directed ""it's a wonderful lie""?","SELECT Directed by FROM table WHERE Title = ""It's a Wonderful Lie"""
What date did the episode with a production code of 60072 originally air?,SELECT Original air date FROM table WHERE Production code = 60072
"How many different people directed the episode titled ""Fail Fish""?","SELECT COUNT Directed by FROM table WHERE Title = ""Fail Fish"""
"How many millions of people in the US watched the episode titled ""Peopleing""?","SELECT U.S. viewers (millions) FROM table WHERE Title = ""Peopleing"""
"How many different pairs of people did the story and storyboard of the episode titled ""Milo's big idea""?","SELECT COUNT Story & Storyboards by FROM table WHERE Title = ""Milo's Big Idea"""
"Who directed the episode titled ""Baldwin the Super FIsh""?","SELECT Directed by FROM table WHERE Title = ""Baldwin the Super Fish"""
What's the title of the episode with series number 36?,SELECT Title FROM table WHERE No. in series = 36
when was the next coach appointed after niger tornadoes fired their coach?,SELECT Date of appointment FROM table WHERE Manner of departure = fired AND Team = Niger Tornadoes
how many managers left sunshine stars?,SELECT COUNT Outgoing manager FROM table WHERE Team = Sunshine Stars
how many new managers replaced  manager(s) who resigned? ,SELECT COUNT Incoming manager FROM table WHERE Manner of departure = Resigned
how many times did tunde abdulrahman leave the team?,SELECT COUNT Date of vacancy FROM table WHERE Outgoing manager = Tunde Abdulrahman
How many platforms have celsius calibur as mystic arte?,SELECT COUNT Platform FROM table WHERE Mystic Arte = Celsius Calibur
Which character is yumi kakazu the character voice?,SELECT Character FROM table WHERE Character Voice = Yumi Kakazu
How many mystic arte have hisui (jadeite) hearts 1 as the character?,SELECT COUNT Mystic Arte FROM table WHERE Character = Hisui (Jadeite) Hearts 1
How many platforms have nanaly fletch as the character?,SELECT COUNT Platform FROM table WHERE Character = Nanaly Fletch
What is the status of the character keel (keele) zeibel?,SELECT Status FROM table WHERE Character = Keel (Keele) Zeibel
Which character is mio yasuda the character voice?,SELECT Character FROM table WHERE Character Voice = Mio Yasuda
What sesaon(s) did they have 254 goals against?,SELECT Season FROM table WHERE Goals against = 254
What is the largest number of points in a season?,SELECT MAX Points FROM table
"What is the phonology used in the example streht > ""straight""?","SELECT Early Middle English FROM table WHERE Example = streht > ""straight"""
"What is the Anglian phonology used in the example dæg > ""day""; grǣg > ""gray""?","SELECT Late Old English (Anglian) FROM table WHERE Example = dæg > ""day""; grǣg > ""gray"""
"What is the modern English phonology used in the example weg > ""way""; regn > ""rain""?","SELECT Modern English FROM table WHERE Example = weg > ""way""; regn > ""rain"""
"What is the Early Modern English phonology used in the example bōg > ""bough""; plōg > plōh > ""plough""?","SELECT Early Modern English FROM table WHERE Example = bōg > ""bough""; plōg > plōh > ""plough"""
"What is the Late Middle English equivalent of the Anglian æg, ǣg?","SELECT Late Middle English FROM table WHERE Late Old English (Anglian) = æg, ǣg"
What is the example of the Early Modern English ( [x] → /f/) /ɔf/?,SELECT Example FROM table WHERE Early Modern English = ( [x] → /f/) /ɔf/
List the numer of miles for 2010.,SELECT Miles (km) FROM table WHERE Year = 2010
On what day did tommy ellis drive?,SELECT Date FROM table WHERE Driver = Tommy Ellis
On what day did joe gibbs racing record a time of 1:53:26?,SELECT Date FROM table WHERE Team = Joe Gibbs Racing AND Race Time = 1:53:26
What is the average speed for filmar racing?,SELECT Average Speed (mph) FROM table WHERE Team = FILMAR Racing
List the race time for may 11.,SELECT Race Time FROM table WHERE Date = May 11
What is the total number of modern grannies performed?,SELECT COUNT Act FROM table WHERE Name/Name of Act = Modern Grannies
What is the name of the performance zhu xiaoming performed?,SELECT Act FROM table WHERE Name/Name of Act = Zhu Xiaoming
How many performers are 29 that made it to the semi finals?,SELECT Semifinal (Week) FROM table WHERE Age(s) = 29
What is the name of the zhou jinsong's hometown?,SELECT Hometown FROM table WHERE Name/Name of Act = Zhou Jinsong
"How many different production codes does the episode originally aired on October 18, 1984 have?","SELECT COUNT Production code FROM table WHERE Original air date = October 18, 1984"
What's the title of the episode with production code 104?,SELECT Title FROM table WHERE Production code = 104
"How many different titles does the episode originally aired on September 27, 1984 have?","SELECT COUNT Title FROM table WHERE Original air date = September 27, 1984"
"What's the production code of the episode originally aired on February 21, 1985?","SELECT MIN Production code FROM table WHERE Original air date = February 21, 1985"
"When did the episode titled ""Bad dreams"" air for the first time?","SELECT Original air date FROM table WHERE Title = ""Bad Dreams"""
"When did the episode titled ""Vanessa's new class"" air for the first time?","SELECT Original air date FROM table WHERE Title = ""Vanessa's New Class"""
when roberts 86' is the scorer what is the round?,SELECT Round FROM table WHERE Scorers = Roberts 86'
When semi final (2nd leg) is the round what is the highest attendance?,SELECT MAX Attendance FROM table WHERE Round = Semi Final (2nd leg)
When Mark Stimson started his job in 2007-08 what posiiton was the team on the table,SELECT Position in table FROM table WHERE Replaced by = Mark Stimson
"In football league one, what coach was hired as a replacement on 8 October 2007",SELECT Replaced by FROM table WHERE Date of vacancy = 8 October 2007
One 6 November 2007 what was the manner of departure for the coach release in football league one?,SELECT Manner of departure FROM table WHERE Date of appointment = 6 November 2007
What is the series number for the episode written by janet leahy?,SELECT MIN No. in series FROM table WHERE Written by = Janet Leahy
What was the air date of the episode with the production code of 322?,SELECT Original air date FROM table WHERE Production code = 322
"What is the series number for the episode directed by  jay sandrich that aired October 23, 1986?","SELECT MIN No. in series FROM table WHERE Directed by = Jay Sandrich AND Original air date = October 23, 1986"
"Who wrote the episode titled ""man talk""?","SELECT Written by FROM table WHERE Title = ""Man Talk"""
What are the title(s) of episodes directed by david solomon and written by marti noxon?,SELECT Title FROM table WHERE Directed by = David Solomon AND Written by = Marti Noxon
What was the number of episodes whose production code is 7ABB21?,SELECT COUNT # FROM table WHERE Production code = 7ABB21
Who wrote episode number 18?,SELECT Written by FROM table WHERE # = 18
Name the tries for when L is less than 2.0,SELECT Tries for FROM table WHERE L < 2.0
Name the points for for when try diff is +19,SELECT Points for FROM table WHERE Try diff = +19
Name the most points for when tries against is 8,SELECT MAX Points for FROM table WHERE Tries against = 8
What is the most recent year shown for Betty Stove?,SELECT MAX Year FROM table
Who was Betty's partner when the surface is hard?,SELECT Partner FROM table WHERE Surface = Hard
What is the lowest number of drawn games by a team?,SELECT MIN Drawn FROM table
How many points did the team that won 5 games make?,SELECT Pts For FROM table WHERE Won = 5
How many points does the club that had 45 points against it have?,SELECT Points FROM table WHERE Pts Agst = 45
When gray wolves is the team nickname how many institutions are there?,SELECT COUNT Institution FROM table WHERE Team Nickname = Gray Wolves
"When sylvania, oh is the location what is the team nickname?","SELECT Team Nickname FROM table WHERE Location = Sylvania, OH"
"When indianapolis, indiana is the location what is the institution?","SELECT Institution FROM table WHERE Location = Indianapolis, Indiana"
When private/ nonsectarian is the the affiliation what is the team nickname?,SELECT Team Nickname FROM table WHERE Affiliation = Private/ Nonsectarian
4512 is the enrollment what is the team nickname?,SELECT Team Nickname FROM table WHERE Enrollment = 4512
What championship was played with Allan Stone as a partner?,SELECT Championship FROM table WHERE Partner = Allan Stone
How many different partners played in the finale in 1973?,SELECT COUNT Partner FROM table WHERE Year = 1973
What was the score in the final played with Fred McNair as partner?,SELECT Score in the final FROM table WHERE Partner = Fred McNair
What was the orginal air date for episodes with production code 2acx12?,SELECT Original air date FROM table WHERE Prod. code = 2ACX12
Who wrote the episode with production code 2acx12?,SELECT Written by FROM table WHERE Prod. code = 2ACX12
What numbered episode was directed by greg colton and written by patrick meighan?,SELECT No. (episode #) FROM table WHERE Directed by = Greg Colton AND Written by = Patrick Meighan
Who directed # (season #) is 1 ( 2 )?,SELECT Directed by FROM table WHERE # (season #) = 1 ( 2 )
Who is everyone on the men's doubles when men's singles is Ma Wenge?,SELECT Mens Doubles FROM table WHERE Mens Singles = Ma Wenge
Who are all men's doubles when men's singles is Jean-Michel Saive?,SELECT Mens Doubles FROM table WHERE Mens Singles = Jean-Michel Saive
Who are all men's doubles when men's singles is Jean-Michel Saive?,SELECT Mens Doubles FROM table WHERE Mens Singles = Jean-Michel Saive
Who are all hosts when men's singles is Ma Wenge?,SELECT Host FROM table WHERE Mens Singles = Ma Wenge
How many people are women's singles in the season of 2000/01?,SELECT COUNT Womens Singles FROM table WHERE Season = 2000/01
Name the winners of the mens doubles in the season of 1963/64.,SELECT Mens Doubles FROM table WHERE Season = 1963/64
Who was the director of the episode with series number 116?,SELECT Directed by FROM table WHERE No. in series = 116
"Who's the writer of the episode titled ""Safe Haven""?","SELECT Written by FROM table WHERE Title = ""Safe Haven"""
What's the title of the episode seen by 12.85 millions of people in the US?,SELECT Title FROM table WHERE U.S. viewers (millions) = 12.85
"How many different people wrote the episode titled ""Reflection of Desire""?","SELECT COUNT Written by FROM table WHERE Title = ""Reflection of Desire"""
How many episodes had 11.86 million US viewers?,SELECT COUNT No. in Series FROM table WHERE U.S. viewers (millions) = 11.86
What is the title(s) of episodes written by aron eli coleite?,SELECT Title FROM table WHERE Written by = Aron Eli Coleite
What are the original air date(s) for episodes written by aron eli coleite?,SELECT Original air date FROM table WHERE Written by = Aron Eli Coleite
"How many episodes were titled ""second chances""?","SELECT COUNT U.S. viewers (millions) FROM table WHERE Title = ""Second Chances"""
how many producers are responsible for the song 'calling out to marlboro?,SELECT COUNT Producer (s) FROM table WHERE Song (s) = Calling Out to Marlboro
what was the first year that kid creole and the coconuts recorded with I Too Have Seen The Woods / Sire Records?,SELECT MIN Year FROM table WHERE Artist = Kid Creole and the Coconuts
How many seasons are there with Formula Holden?,SELECT COUNT Seasons FROM table WHERE Series = Formula Holden
How many poles are there with 2 races?,SELECT MAX Poles FROM table WHERE Races = 2
What's the most amount of point finishes for v8supercar?,SELECT MAX Point Finishes (Non-podium) FROM table WHERE Series = V8Supercar
How many people had high rebounds in game 14?,SELECT COUNT High rebounds FROM table WHERE Game = 14
What is every score when the date is January 2?,SELECT Score FROM table WHERE Date = January 2
What was the highest number of students in attendance for the university of north texas?,SELECT MAX Enrollment FROM table WHERE Institution = University of North Texas
What is the mascot for texas tech university?,SELECT Team Nickname FROM table WHERE Institution = Texas Tech University
What is the total enrollment for private/ disciples of christ?,SELECT Enrollment FROM table WHERE Affiliation = Private/ Disciples of Christ
"How many mascotts are there for college station, texas","SELECT COUNT Team Nickname FROM table WHERE Location = College Station, Texas"
List the highest number of students in attendance for the institution that started in 1923.,SELECT MAX Enrollment FROM table WHERE Founded = 1923
How many next in lines had heirs of Archduke Karl?,SELECT COUNT Next in line FROM table WHERE Heir = Archduke Karl
"Which team has a song based on  ""wee deoch an doris""?","SELECT Club name FROM table WHERE Basis for team song = ""Wee Deoch an Doris"""
Name the team that has a song writer named larry spokes.,SELECT Club name FROM table WHERE Writer/composer = Larry Spokes
How man teams have a writer named harry angus?,SELECT COUNT Name of team song FROM table WHERE Writer/composer = Harry Angus
Name the team anthem that was written by quentin eyers and les kaczmarek.,SELECT Name of team song FROM table WHERE Writer/composer = Quentin Eyers and Les Kaczmarek
How many team songs does fremantle have?,SELECT COUNT Basis for team song FROM table WHERE Club name = Fremantle
What is the name of the team song written by ken walther?,SELECT Basis for team song FROM table WHERE Writer/composer = Ken Walther
In how many different years was the team nicknamed Comets founded?,SELECT COUNT Founded FROM table WHERE Team Nickname = Comets
What's the nickname of the team with enrollment of 40747?,SELECT Team Nickname FROM table WHERE Enrollment = 40747
"What school is located in Huntsville, Texas?","SELECT Institution FROM table WHERE Location = Huntsville, Texas"
How many students are enrolled in the team nicknamed Comets?,SELECT Enrollment FROM table WHERE Team Nickname = Comets
Name the number of tenants for russia at the saransk stadium,SELECT COUNT Tenant FROM table WHERE Country = Russia AND Stadium = Saransk Stadium
Name the country for lusail national stadium,SELECT Country FROM table WHERE Stadium = Lusail National Stadium
Name the city for los angeles stadium,SELECT City FROM table WHERE Stadium = Los Angeles Stadium
Name the stadium for nizhny novgorod,SELECT Stadium FROM table WHERE City = Nizhny Novgorod
Name the country for athens,SELECT COUNT Country FROM table WHERE City = Athens
When did the episode 1.13 air for the first time?,SELECT Date Aired FROM table WHERE Episode = 1.13
What's the weekly rank of episode 1.03?,SELECT Weekly Rank FROM table WHERE Episode = 1.03
What is the rating of episode 1.04?,SELECT Rating FROM table WHERE Episode = 1.04
How many items are listed under caps when burnley is the club team?,SELECT COUNT Cap(s) FROM table WHERE Club(s) = Burnley
What club did the championship player come from who had 10 goals?,SELECT Club(s) FROM table WHERE Goal(s) = 10
How many goals did the player from Ipswich town score?,SELECT MIN Goal(s) FROM table WHERE Club(s) = Ipswich Town
When 16 is the cap who is the player?,SELECT Player FROM table WHERE Cap(s) = 16
When 2010 v australia is the interantional debut what is the club?,SELECT Club(s) FROM table WHERE International Debut = 2010 v Australia
When winston reid category:articles with hcards is the player what is the club?,SELECT Club(s) FROM table WHERE Player = Winston Reid Category:Articles with hCards
When tommy smith category:articles with hcards is the player and 1 is the goal how many cap(s) are there?,SELECT COUNT Cap(s) FROM table WHERE Goal(s) = 1 AND Player = Tommy Smith Category:Articles with hCards
When  rory fallon category:articles with hcards is the player when is the international debut?,SELECT International Debut FROM table WHERE Player = Rory Fallon Category:Articles with hCards
What is th title of the episode written by Nick Thiel?,SELECT Title FROM table WHERE Written by = Nick Thiel
How many million u.s. viewers watched the episode with a production code of 2t7004?,SELECT U.S. viewers (millions) FROM table WHERE Production code = 2T7004
What is the name of the episode that was directed by Dennis Smith?,SELECT Title FROM table WHERE Directed by = Dennis Smith
"What date did ""The runner"" originally air on?","SELECT Original air date FROM table WHERE Title = ""The Runner"""
What is the name of the episode nick thiel wrote?,SELECT Title FROM table WHERE Written by = Nick Thiel
How many site entries are there at 3:30pm and the visiting team is coastal carolina?,SELECT COUNT Site FROM table WHERE Time = 3:30pm AND Visiting team = Coastal Carolina
What is the result when the visiting team is syracuse?,SELECT Result FROM table WHERE Visiting team = Syracuse
When svein tuft is the winner what is the highest stage?,SELECT MAX Stage FROM table WHERE Winner = Svein Tuft
when svein tuft is the winner how many stages are there?,SELECT COUNT Stage FROM table WHERE Winner = Svein Tuft
when hayden roulston is the winner what is the team classification?,SELECT Team classification FROM table WHERE Winner = Hayden Roulston
When michael reihs is the mountains classification what is the stage?,SELECT Stage FROM table WHERE Mountains classification = Michael Reihs
When michael van stayen is the points classification what is the team classification?,SELECT Team classification FROM table WHERE Points classification = Michael Van Stayen
When hayden roulston is the winner what is the stage?,SELECT Stage FROM table WHERE Winner = Hayden Roulston
What date was the game where Texas Southern was the visiting team?,SELECT Date FROM table WHERE Visiting team = Texas Southern
How many Connecticut home games were broadcast?,SELECT COUNT Broadcast FROM table WHERE Home team = Connecticut
In what facility was Pittsburgh's home game played?,SELECT Site FROM table WHERE Home team = Pittsburgh
What was the final score of Washington's home game?,SELECT Result FROM table WHERE Home team = Washington
"Where is the team that has a stadium capable of a capacity of 10,517 5,006 located?","SELECT Location FROM table WHERE Capacity = 10,517 5,006"
Where is the home venue of the team founded in 1993?,SELECT Home Venue FROM table WHERE Founded = 1993
How long has the team who owns North Shore Events Centre Vector Arena been active?,SELECT Years Active FROM table WHERE Home Venue = North Shore Events Centre Vector Arena
What is the capacity for the Home Venue of the New Zealand Breakers club?,SELECT Capacity FROM table WHERE Club = New Zealand Breakers
"Who directed ""From Russia With Love""?","SELECT Directed by FROM table WHERE Title = ""From Russia With Love"""
How many episodes were directed by Jeff Melman and 1.21million viewers?,SELECT MIN No. in season FROM table WHERE Directed by = Jeff Melman AND U.S. viewers (millions) = 1.21
What air date had 1.01 million U.S. viewers?,SELECT Original air date FROM table WHERE U.S. viewers (millions) = 1.01
Name the aircraft type for  furstenau/vorden,SELECT Aircraft Type FROM table WHERE Geschwader Base = Furstenau/Vorden
Name the parent unit for ludwig franzisket,SELECT Parent unit FROM table WHERE Commanding Officer = Ludwig Franzisket
Name the aircraft type for jagdgeschwader 6,SELECT Aircraft Type FROM table WHERE Parent unit = Jagdgeschwader 6
Name the aircraft type for  jagdgeschwader 26,SELECT Aircraft Type FROM table WHERE Parent unit = Jagdgeschwader 26
Name the parent unit for josef priller,SELECT Parent unit FROM table WHERE Commanding Officer = Josef Priller
"Name who directed the episode  ""bro-lo el cuñado""","SELECT Directed by FROM table WHERE Title = ""Bro-Lo El Cuñado"""
Name the production code for number 8,SELECT Production code FROM table WHERE # = 8
Name the least number for xle02007,SELECT MIN No. FROM table WHERE Production code = XLE02007
Who wrote the episode with the code xle05012?,SELECT Written by FROM table WHERE Production code = XLE05012
what are the numbers of episodes that had 0.79 million US views?,SELECT # FROM table WHERE U.S. viewers (million) = 0.79
What female fenced with a saber on the team that had an average fencer rank of 3.5?,SELECT Female saber FROM table WHERE Average fencers rank = 3.5
What team had an average fencer rank of 1.33?,SELECT Team FROM table WHERE Average fencers rank = 1.33
"What is the name of the corporation that incorporated on october 15, 1955?","SELECT Corporate name FROM table WHERE Incorporation date (city) = October 15, 1955"
"What is the area of the corporation named the powell river, the corporation of the city of?","SELECT Area (km²) FROM table WHERE Corporate name = Powell River, The Corporation of the City of"
How many Area's are there for Armstrong?,SELECT COUNT Area (km²) FROM table WHERE Name = Armstrong
"What is the name of the city which incorporated on july 16, 1860?","SELECT Name FROM table WHERE Incorporation date (city) = July 16, 1860"
What is the name of the corporation with an area of 15.63 km?,SELECT Corporate name FROM table WHERE Area (km²) = 15.63
"How many areas are there for the corporation named fort st. john, city of?","SELECT COUNT Area (km²) FROM table WHERE Corporate name = Fort St. John, City of"
What was Emma Bunton's score for the performance with a total score of 22?,SELECT Emma Bunton FROM table WHERE Total = 22
What was the total score when the guest judge gave a score of 10?,SELECT Total FROM table WHERE Guest Judge = 10
"how many millions of north american viewers had the episode called ""smother""? ","SELECT U.S. viewers (million) FROM table WHERE Title = ""Smother"""
what is the number of  the episode in the season whose production code is 101? ,SELECT COUNT No. FROM table WHERE Production code = 101
