question,sql
What is the 7:30 feature with an 8:30 feature Melrose Place?,SELECT 7:30 FROM table WHERE 8:30 = melrose place
What is the 8:30 feature with a 7:00 feature Loft Story?,SELECT 8:30 FROM table WHERE 7:00 = loft story
What is the 8:00 feature with a 7:00 feature Air Farce?,SELECT 8:00 FROM table WHERE 7:00 = air farce
What is the 10:30 feature with Hercule as the 7:30 feature?,SELECT 10:30 FROM table WHERE 7:30 = hercule
What is the 8:00 feature with Mad About You as the 8:30 feature?,SELECT 8:00 FROM table WHERE 8:30 = mad about you
What is the 7:30 feature with an 8:00 feature of Cosby?,SELECT 7:30 FROM table WHERE 8:00 = cosby
What is the Hindi associated with a Domari of tærən?,SELECT Hindi FROM table WHERE Domari = tærən
What is the Lomavren associated with a Persian of se?,SELECT Lomavren FROM table WHERE Persian = se
What is the Romani associated with a Domari of na?,SELECT Romani FROM table WHERE Domari = na
"What is the Domari associated with a Persian of yak, yek?","SELECT Domari FROM table WHERE Persian = yak, yek"
What is the Lomavren associated with a Hindi of sāt?,SELECT Lomavren FROM table WHERE Hindi = sāt
What is the Version before 2001 with a Length of 7:42?,SELECT Version FROM table WHERE Year < 2001 AND Length = 7:42
In what Year is the length of the Song 7:42?,SELECT AVG Year FROM table WHERE Length = 7:42
"Which College/Junior/Club Team (League) has a Position of right wing, and a Round smaller than 3?",SELECT College/Junior/Club Team (League) FROM table WHERE Position = right wing AND Round < 3
What is the orbital regime of launches greater than 4 and failures less than 2?,SELECT Orbital regime FROM table WHERE Launches > 4 AND Failures < 2
"What is the total of medium earth orbital regime, accidentally achieved and successes greater than 3?",SELECT SUM Accidentally Achieved FROM table WHERE Orbital regime = medium earth AND Successes > 3
What is the greatest successes that have failures greater than 1 and launches less than 28?,SELECT MAX Successes FROM table WHERE Failures > 1 AND Launches < 28
What is the total failures of heliocentric orbit orbital regimes and launches less than 1?,SELECT SUM Failures FROM table WHERE Orbital regime = heliocentric orbit AND Launches < 1
What was the rank of tris speaker when BB/SO was 7?,SELECT Rank FROM table WHERE Player = tris speaker AND BB/SO = 7
What is the average rank for team cle when the BB/SO is 10.89?,SELECT AVG Rank FROM table WHERE Team = cle AND BB/SO = 10.89
What is the name of a partner that played on a hard surface on 18 April 2011?,SELECT Partner FROM table WHERE Surface = hard AND Date = 18 april 2011
What was the score for the final played on 2 July 2012?,SELECT Score FROM table WHERE Date = 2 july 2012
"What was the Score on February 18, 2008?","SELECT Score FROM table WHERE Date = february 18, 2008"
"What was the Opponent on the game played on a Hard Surface with a Score of 3–6, 6–3, [7–10]?","SELECT Opponent in the Final FROM table WHERE Surface = hard AND Score = 3–6, 6–3, [7–10]"
"On what Surface was the game with Partner David Martin played Scoring 4–6, 6–7 (4-7)?","SELECT Surface FROM table WHERE Partner = david martin AND Score = 4–6, 6–7 (4-7)"
"What was the Outcome of the game with a Score of 3–6, 4–6?","SELECT Outcome FROM table WHERE Score = 3–6, 4–6"
"What was the Partner on June 17, 2012?","SELECT Partner FROM table WHERE Date = june 17, 2012"
What record has Glenn Robinson (16) as the leading scorer?,SELECT Record FROM table WHERE Leading scorer = glenn robinson (16)
What date has 136-134 as the score?,SELECT Date FROM table WHERE Score = 136-134
What home has 136-134 as the score?,SELECT Home FROM table WHERE Score = 136-134
What is the most recent year that China won a bronze?,SELECT MAX Year FROM table WHERE Bronze = china
What is the oldest year that the location was at Guangzhou?,SELECT MIN Year FROM table WHERE Location = guangzhou
For how many years was the location at Beijing?,SELECT SUM Year FROM table WHERE Location = beijing
What location is previous to 1994?,SELECT Location FROM table WHERE Year < 1994
Who won the men's doubles before 1979 when carol silman prina ben shushan won the women's doubles?,SELECT Men's doubles FROM table WHERE Year < 1979 AND Women's doubles = carol silman prina ben shushan
What college(s) did the player(s) picked in round 4 with a pick number less than 98 play for?,SELECT College FROM table WHERE Pick # < 98 AND Round = round 4
What is the pick number for the player(s) drafted in round 8?,SELECT Pick # FROM table WHERE Round = round 8
What position(s) did the player(s) with a pick number of 125 play?,SELECT Position FROM table WHERE Pick # = 125
What mean number of extra points was there when James Lawrence was a player and the touchdown number was less than 1?,SELECT AVG Extra points FROM table WHERE Player = james lawrence AND Touchdowns < 1
What is the smallest amount of touchdowns when there is a total player and a number of field goals of more than 0?,SELECT MIN Touchdowns FROM table WHERE Player = total AND Field goals > 0
On what Date were the Results¹ 4:0?,SELECT Date FROM table WHERE Results¹ = 4:0
On what Date were the Results¹ 5:1?,SELECT Date FROM table WHERE Results¹ = 5:1
On what Date were the Results¹ 4:0?,SELECT Date FROM table WHERE Results¹ = 4:0
What is the pseudoknot prediction of the software named tfold?,"SELECT Knots Knots: Pseudoknot prediction, . FROM table WHERE Name = tfold"
What Chilean word is used for the Castilian word ordenador?,SELECT Chilean FROM table WHERE Castilian = ordenador
What is the Italian word for the Mexican word frijol?,SELECT Italian FROM table WHERE Mexican = frijol
What word would a Castilian speaker use for the Italian word auto(mobile)?,SELECT Castilian FROM table WHERE Italian = auto(mobile)
What word would a Castilian speaker use for the Italian word auto(mobile)?,SELECT Castilian FROM table WHERE Italian = auto(mobile)
How would an Italian say the Andalusian word coche?,SELECT Italian FROM table WHERE Andalusian = coche
"Which Home has a Visitor of ny rangers, and a Series of flyers win 4–3?",SELECT Home FROM table WHERE Visitor = ny rangers AND Series = flyers win 4–3
Which Score has a Series of flyers lead 3–2?,SELECT Score FROM table WHERE Series = flyers lead 3–2
Which Decision has a Date of april 25?,SELECT Decision FROM table WHERE Date = april 25
Which Decision has a Date of april 30?,SELECT Decision FROM table WHERE Date = april 30
Which Home has a Series of series tied 3–3?,SELECT Home FROM table WHERE Series = series tied 3–3
"Events of 22, and a Rank smaller than 4 involved which of the lowest earnings ($)?",SELECT MIN Earnings ( $ ) FROM table WHERE Events = 22 AND Rank < 4
"Player of corey pavin, and a Rank larger than 4 involved which highest earnings ($)?",SELECT MAX Earnings ( $ ) FROM table WHERE Player = corey pavin AND Rank > 4
"Events larger than 22, and a Earnings ( $ ) of 1,543,192, and a Rank smaller than 2 has the lowest wins?","SELECT MIN Wins FROM table WHERE Events > 22 AND Earnings ( $ ) = 1,543,192 AND Rank < 2"
"Country of united states, and a Events of 22, and a Earnings ( $ ) larger than 1,340,079 has the highest rank?","SELECT MAX Rank FROM table WHERE Country = united states AND Events = 22 AND Earnings ( $ ) > 1,340,079"
"What is the mascot with an enrollment (2010) less than 980, and heritage as the school?",SELECT Mascot FROM table WHERE Enrollment (2010) < 980 AND School = heritage
What is the class of the player with a weight of 242 pounds?,SELECT Class FROM table WHERE Weight = 242
How many games were played by the player at FB?,SELECT COUNT Games↑ FROM table WHERE Position = fb
"Which Name has a Round smaller than 5, and a Pick # larger than 13?",SELECT Name FROM table WHERE Round < 5 AND Pick # > 13
"Which Pick # has a Round smaller than 6, and an Overall larger than 13, and a College of penn state?",SELECT Pick # FROM table WHERE Round < 6 AND Overall > 13 AND College = penn state
Which Name has an Overall of 235?,SELECT Name FROM table WHERE Overall = 235
"How many cosponsors have a Date introduced of may 22, 2008?","SELECT COUNT # of cosponsors FROM table WHERE Date introduced = may 22, 2008"
Which Congress has a # of cosponsors of 19?,SELECT Congress FROM table WHERE # of cosponsors = 19
On what date was a friendly match held at Auckland?,SELECT Date FROM table WHERE Competition = friendly match AND Venue = auckland
What were the goals at Sydney?,SELECT Goals FROM table WHERE Venue = sydney
How many sets lost have a sets won less than 0?,SELECT COUNT Sets Lost FROM table WHERE Sets Won < 0
What shows for IATA for the City of sapporo?,SELECT IATA FROM table WHERE City = sapporo
What is the ICAO when the IATA shows cts?,SELECT ICAO FROM table WHERE IATA = cts
What is the Country when the IATA shows cju?,SELECT Country FROM table WHERE IATA = cju
What is the ICAO when the IATA shows mfm?,SELECT ICAO FROM table WHERE IATA = mfm
What is the ICAO for Hong Kong?,SELECT ICAO FROM table WHERE Country = hong kong
What is the Airport when the ICAO shows rpvm?,SELECT Airport FROM table WHERE ICAO = rpvm
What is the lowest goals for value with fewer than 5 draws and under 70 points?,SELECT MIN Goals For FROM table WHERE Draw < 5 AND Points < 70
What is the lowest goals against value for a team with 83 points and a difference over 50?,SELECT MIN Goals Against FROM table WHERE Points = 83 AND Goal difference > 50
What is the earliest season that has a position over 12?,SELECT MIN Season FROM table WHERE Position > 12
"What is the average goals for with a position under 12, draws over 1, and goals against under 28?",SELECT AVG Goals For FROM table WHERE Position < 12 AND Draw > 1 AND Goals Against < 28
Who was the Opponent with a Result of l 17–24?,SELECT Opponent FROM table WHERE Result = l 17–24
What Date has a Result of l 21–34?,SELECT Date FROM table WHERE Result = l 21–34
"What Game Site has a Week smaller than 11, and a Date of october 21, 1973?","SELECT Game Site FROM table WHERE Week < 11 AND Date = october 21, 1973"
What is the value of the lowest Week with a Record of 2–9?,SELECT MIN Week FROM table WHERE Record = 2–9
Who is the opponent for the game that occurred after week 13?,SELECT Opponent FROM table WHERE Week > 13
What day did the play on week 6?,SELECT Date FROM table WHERE Week = 6
Which tournament had a 2009 result of 1R?,SELECT Tournament FROM table WHERE 2009 = 1r
Which tournament had a 2010 result of QF and a 2012 result of SF?,SELECT Tournament FROM table WHERE 2012 = sf AND 2010 = qf
Which tournament had a result in 2010 and 2012 of a?,SELECT Tournament FROM table WHERE 2012 = a AND 2010 = a
Who was third during round 6 in Rybinsk?,SELECT Third FROM table WHERE Venue = rybinsk AND Round = 6
Who was third in round 14?,SELECT Third FROM table WHERE Round = 14
What was the venue with a 3.3km c prologue discipline?,SELECT Venue FROM table WHERE Discipline = 3.3km c prologue
Who was the winner on 28 December 2007?,SELECT Winner FROM table WHERE Date = 28 december 2007
Who was third at the 0.8km f sprint discipline?,SELECT Third FROM table WHERE Discipline = 0.8km f sprint
What is the highest total cargo of an airport ranked larger than 19 with a code of BKK/VTBS?,SELECT MAX Total Cargo (Metric Tonnes) FROM table WHERE Code (IATA/ICAO) = bkk/vtbs AND Rank > 19
What is the rank of the airport with the BKK/VTBS code?,SELECT Rank FROM table WHERE Code (IATA/ICAO) = bkk/vtbs
Which Matches has champion Rank of 5?,SELECT MAX Matches as champion FROM table WHERE Rank = 5
Which Matches is on 24 march 1963 with a Rank larger than 44?,SELECT MAX Matches as champion FROM table WHERE Title last held = 24 march 1963 AND Rank > 44
what game was on may 24,SELECT Game FROM table WHERE Date = may 24
what game was on may 29,SELECT Result FROM table WHERE Date = may 29
what team played on may 20 on the home side,SELECT Home Team FROM table WHERE Date = may 20
what team played in game 2,SELECT Road Team FROM table WHERE Game = game 2
Which Raison Blue has the highest nicotine?,SELECT MAX Nicotine FROM table WHERE Name = raison blue
"For Raison Blue with a nicotine larger than 0.30000000000000004, what's the lowest quantity?",SELECT MIN Quantity FROM table WHERE Name = raison blue AND Nicotine > 0.30000000000000004
What was the result for the fil Paljas?,SELECT Result FROM table WHERE Film title = paljas
In what year was the rank less than 6 for Damac Heights?,SELECT Year FROM table WHERE Rank < 6 AND Name = damac heights
What is the height for rank greater than 10 in Tameer Tower?,SELECT Height m (ft) FROM table WHERE Rank > 10 AND Name = tameer tower
What was the earliest year with rank 20 and less than 60 floors?,SELECT MIN Year FROM table WHERE Rank = 20 AND Floors < 60
What is the highest floors with rank greater than 1 in Conrad Dubai?,SELECT MAX Floors FROM table WHERE Rank > 1 AND Name = conrad dubai
How many Laps have a Driver of satrio hermanto?,SELECT SUM Laps FROM table WHERE Driver = satrio hermanto
Which Time has a Grid of 19?,SELECT Time FROM table WHERE Grid = 19
"Which Grid is the lowest one that has a Team of germany, and Laps smaller than 45?",SELECT MIN Grid FROM table WHERE Team = germany AND Laps < 45
WHich team draft the player who went to college in Washington?,SELECT NFL Team FROM table WHERE College = washington
What position did the palyer drafted out of Washington play?,SELECT Position FROM table WHERE College = washington
What is the average number of Gold medals when there are 5 bronze medals?,SELECT AVG Gold FROM table WHERE Bronze = 5
What is the highest amount of bronze medals when the rank was larger than 9?,SELECT MAX Bronze FROM table WHERE Rank > 9
What is the leowest number of Bronze medals for Jamaica who ranked less than 4 and had more than 0 silver medals and a total of less than 22 medals?,SELECT MIN Bronze FROM table WHERE Silver > 0 AND Rank < 4 AND Nation = jamaica AND Total < 22
"Nation of bulgaria, and a Place larger than 1 had what highest 3 Balls, 2 Ribbons?","SELECT MAX 3 Balls, 2 Ribbons FROM table WHERE Nation = bulgaria AND Place > 1"
"5 Hoops that has a Place larger than 7, and a Total larger than 38.525 had what sum?",SELECT SUM 5 Hoops FROM table WHERE Place > 7 AND Total > 38.525
"5 Hoops larger than 19.325, and a Total of 39.4, and a Place larger than 2 had what total number of 3 balls and 2 ribbons?","SELECT COUNT 3 Balls, 2 Ribbons FROM table WHERE 5 Hoops > 19.325 AND Total = 39.4 AND Place > 2"
"Total of 38.55, and a 3 Balls, 2 Ribbons smaller than 19.4 had what lowest place?","SELECT MIN Place FROM table WHERE Total = 38.55 AND 3 Balls, 2 Ribbons < 19.4"
what voice acter played tien,SELECT Voice Actor (Japanese) FROM table WHERE Character Name = tien
what character did Laara sadiq play,SELECT Character Name FROM table WHERE Voice Actor (English 1998 / Pioneer) = laara sadiq
what character did Masaharu satou play,SELECT Character Name FROM table WHERE Voice Actor (Japanese) = masaharu satou
what character did dave ward play,SELECT Voice Actor (English 1998 / Pioneer) FROM table WHERE Voice Actor (English 1997 / Saban) = dave ward
what character did naoko watanabe play,SELECT Character Name FROM table WHERE Voice Actor (Japanese) = naoko watanabe
At what Location was Miss World 2009?,SELECT Location FROM table WHERE Year = 2009
"What is the score of the 1996 Emarate cup on March 25, 1996?","SELECT Score FROM table WHERE Competition = 1996 emarate cup AND Date = march 25, 1996"
"Which competition was on August 11, 1996?","SELECT Competition FROM table WHERE Date = august 11, 1996"
Which competition was in Dubai?,SELECT Competition FROM table WHERE Venue = dubai
What is the result of the match in Bangkok?,SELECT Result FROM table WHERE Venue = bangkok
What is the date of the match with a result of 4-0?,SELECT Date FROM table WHERE Result = 4-0
What is the score of the match with a 4-0 result?,SELECT Score FROM table WHERE Result = 4-0
"Which name has an overall number of more than 164, when the pick number is more than 2, the position is running back, and the round is 16?",SELECT Name FROM table WHERE Overall > 164 AND Pick # > 2 AND Position = running back AND Round = 16
"Which college's round is more than 4, when the overall is less than 237 and Ted Cottrell was the name?",SELECT College FROM table WHERE Round > 4 AND Overall < 237 AND Name = ted cottrell
What is the smallest overall for Oregon State?,SELECT MIN Overall FROM table WHERE College = oregon state
"What is the class of the qb, Josh Riddell?",SELECT Class FROM table WHERE Position = qb AND Name = josh riddell
What position does Jamar Chaney play?,SELECT Position FROM table WHERE Name = jamar chaney
What hometown is Kyle love from?,SELECT Hometown FROM table WHERE Name = kyle love
"Which Attendance has a Home of philadelphia, and Points smaller than 23?",SELECT SUM Attendance FROM table WHERE Home = philadelphia AND Points < 23
Which Visitor has a Record of 9–12–5?,SELECT Visitor FROM table WHERE Record = 9–12–5
Which Date has a Visitor of boston?,SELECT Date FROM table WHERE Visitor = boston
What is the date for the grass surface final against Nathan Healey?,SELECT Date FROM table WHERE Surface = grass AND Opponent in the final = nathan healey
What was the score of the final against Dane Propoggia?,SELECT Score FROM table WHERE Opponent in the final = dane propoggia
What was the total score when the E score was larger than 9.6 and the A score was 6?,SELECT Total FROM table WHERE E Score > 9.6 AND A Score = 6
What was the average E score when the T score was less than 4?,SELECT AVG E Score FROM table WHERE T Score < 4
What was the average T score when the E score was larger than 9.6 and the team was from Spain?,SELECT AVG T Score FROM table WHERE Nation = spain AND E Score > 9.6
What was the total number of A scores for Japan when the T score was more than 4?,SELECT COUNT A Score FROM table WHERE Nation = japan AND T Score > 4
What was the sum of the E scores when the total score was 19.466?,SELECT SUM E Score FROM table WHERE Total = 19.466
What is the total number of E scores when the total score was 19.7 and the A score was more than 6?,SELECT COUNT E Score FROM table WHERE Total = 19.7 AND A Score > 6
What is the highest number of draws with 14 points and less than 7 games?,SELECT MAX Drawn FROM table WHERE Points = 14 AND Games < 7
What was the attendance at the game with a record of 4-5?,SELECT Attendance FROM table WHERE Record = 4-5
What was the date of the week 16 game?,SELECT Date FROM table WHERE Week = 16
What was the record at the game with a result of W 13-12 after week 4?,SELECT Record FROM table WHERE Week > 4 AND Result = w 13-12
"Who was the opponent at the game attended by 62,019 before week 17?","SELECT Opponent FROM table WHERE Week < 17 AND Attendance = 62,019"
"Name the surface for january 8, 2001","SELECT Surface FROM table WHERE Date = january 8, 2001"
"Name the outcome for jordan kerr july 19, 2004","SELECT Outcome FROM table WHERE Partnering = jordan kerr AND Date = july 19, 2004"
Name the score for opponents of nathan healey igor kunitsyn,SELECT Score FROM table WHERE Opponents in the final = nathan healey igor kunitsyn
Name the outcome for opponents of jonas björkman john mcenroe,SELECT Outcome FROM table WHERE Opponents in the final = jonas björkman john mcenroe
"Name the surface for paul goldstein and date of october 2, 2006","SELECT Surface FROM table WHERE Partnering = paul goldstein AND Date = october 2, 2006"
"Which Games have a Drawn smaller than 1, and a Lost smaller than 1?",SELECT Games FROM table WHERE Drawn < 1 AND Lost < 1
"Which Drawn is the lowest one that has a Lost of 5, and Points larger than 4?",SELECT MIN Drawn FROM table WHERE Lost = 5 AND Points > 4
Which Government has 57 seats?,SELECT Government FROM table WHERE Seats = 57
How many seats does the 6th Dail have?,SELECT COUNT Seats FROM table WHERE Dáil = 6th
What is the number of the dail with 61 seats?,SELECT Dáil FROM table WHERE Seats = 61
What is the lowest number of seats from the election with 27.0% of votes?,SELECT MIN Seats FROM table WHERE Share of votes = 27.0%
What is the 6th dail share of votes?,SELECT Share of votes FROM table WHERE Dáil = 6th
What was the highest week when the record was 1-3?,SELECT MAX Week FROM table WHERE Record = 1-3
"Who was the opponent at the game attended by 62,657?","SELECT Opponent FROM table WHERE Attendance = 62,657"
What is the year built for the Fay No. 4?,SELECT MAX Year Built FROM table WHERE Name = fay no. 4
"Where the length is 91', what is the year built?",SELECT Year Built FROM table WHERE Length = 91'
What is the address for the Scorpions' mascot?,SELECT Address FROM table WHERE Mascot = scorpions
What is the address for the assistant principal named Kelly Papke?,SELECT Address FROM table WHERE Assistant Principal (2013-2014) = kelly papke
What was the mascot for the 2013-2014 principal named Frank Hendricsen?,SELECT Mascot FROM table WHERE Principal (2013-2014) = frank hendricsen
Who were the assistant and main principals of Kat Hughes?,SELECT Assistant Principal (2013-2014) FROM table WHERE Principal (2013-2014) = kat hughes
What is the address for the school that has the coyotes mascot?,SELECT Address FROM table WHERE Mascot = coyotes
What is the result of the game played at Jinan?,SELECT Result FROM table WHERE Venue = jinan
"What is the score of the game on November 10, 2006?","SELECT Score FROM table WHERE Date = november 10, 2006"
What is the date of the game held at Lahore?,SELECT Date FROM table WHERE Venue = lahore
What were the total number of entries in 2001 that had a front row smaller than 13?,SELECT COUNT Entries FROM table WHERE Season = 2001 AND Front row starts < 13
What are the lowest entries for a front row smaller than 15 where Michael Schumacher was driving?,SELECT MIN Entries FROM table WHERE Front row starts < 15 AND Driver = michael schumacher
What was the highest front row starts for Alain Prost?,SELECT MAX Front row starts FROM table WHERE Driver = alain prost
"Which Against has Losses larger than 2, and Wins of 8, and Byes smaller than 0?",SELECT SUM Against FROM table WHERE Losses > 2 AND Wins = 8 AND Byes < 0
Which Draws have Wins larger than 14?,SELECT SUM Draws FROM table WHERE Wins > 14
"How many Losses have an NTFA Div 2 of perth, and Wins smaller than 10?",SELECT COUNT Losses FROM table WHERE NTFA Div 2 = perth AND Wins < 10
"Which Byes have an Against smaller than 1647, and an NTFA Div 2 of fingal valley, and Wins smaller than 14?",SELECT MAX Byes FROM table WHERE Against < 1647 AND NTFA Div 2 = fingal valley AND Wins < 14
How many grids were there races with more than 10 laps and a time of +34.121?,SELECT COUNT Grid FROM table WHERE Time = +34.121 AND Laps > 10
What is the smallest grid number that had 10 laps listed with Jonathan Summerton as the driver?,SELECT MIN Grid FROM table WHERE Laps = 10 AND Driver = jonathan summerton
What is the average grid number that had Team China with less than 10 laps?,SELECT AVG Grid FROM table WHERE Laps < 10 AND Team = china
"Which Creator has the Latest stable release of unknown, and a Name of myeclipse?",SELECT Creator FROM table WHERE Latest stable release = unknown AND Name = myeclipse
Which Platform / OS has a Name of altova umodel?,SELECT Platform / OS FROM table WHERE Name = altova umodel
Which Programming language used has a First public release of 1997?,SELECT Programming language used FROM table WHERE First public release = 1997
Which First public release has a Name of rational software modeler?,SELECT First public release FROM table WHERE Name = rational software modeler
What is the College of Rice's highest overall for the guard position?,SELECT MAX Overall FROM table WHERE Position = guard AND College = rice
What is Tommy Nobis' position that has fewer than 16 picks?,SELECT Position FROM table WHERE Pick # < 16 AND Name = tommy nobis
What was the score when the Rangers were playing against the Vancouver Canucks?,SELECT Score FROM table WHERE Opponent = vancouver canucks
Who were the opponents on January 27?,SELECT Opponent FROM table WHERE January = 27
Who was the opponent for game number less than 47 and a record of 24-13-4?,SELECT Opponent FROM table WHERE Game < 47 AND Record = 24-13-4
What is the average january number when the game number was higher than 39 and the opponent was the Vancouver Canucks?,SELECT AVG January FROM table WHERE Opponent = vancouver canucks AND Game > 39
What is the Drawn number with a Points against of correct as of 08:50 10 may 2009?,SELECT Drawn FROM table WHERE Points against = correct as of 08:50 10 may 2009
What is the Tries against when lost shows 12 for pontycymmer rfc?,SELECT Tries against FROM table WHERE Lost = 12 AND Club = pontycymmer rfc
What is the Points against for the ystradgynlais rfc club?,SELECT Points against FROM table WHERE Club = ystradgynlais rfc
What is the Club name what shows 405 for the Points against?,SELECT Club FROM table WHERE Points against = 405
What shows for Try bonus when the points against are 451?,SELECT Try bonus FROM table WHERE Points against = 451
"Which Pos has a Make of chevrolet, and a Driver of jack sprague, and a Car # smaller than 2?",SELECT SUM Pos. FROM table WHERE Make = chevrolet AND Driver = jack sprague AND Car # < 2
"How many Car numbers have a Driver of erik darnell, and a Pos smaller than 2?",SELECT COUNT Car # FROM table WHERE Driver = erik darnell AND Pos. < 2
Which Pos has a Car # of 33?,SELECT SUM Pos. FROM table WHERE Car # = 33
"Which Pos has a Team of circle bar racing, and a Car # smaller than 14?",SELECT MAX Pos. FROM table WHERE Team = circle bar racing AND Car # < 14
"Which Pos has a Car # larger than 2, and a Team of billy ballew motorsports?",SELECT AVG Pos. FROM table WHERE Car # > 2 AND Team = billy ballew motorsports
What is the lowest points that has 135 as 2nd (m)?,SELECT MIN Points FROM table WHERE 2nd (m) = 135
