question,sql
"What home has Philadelphia as the visitor, and december 4 as the date?",SELECT Home FROM table WHERE Visitor = philadelphia AND Date = december 4
"What record has a decision of parent, Philadelphia as the home, with december 12 as the date?",SELECT Record FROM table WHERE Decision = parent AND Home = philadelphia AND Date = december 12
"Which Tournament has a Score of 6–4, 6–2?","SELECT Tournament FROM table WHERE Score = 6–4, 6–2"
Which Score has an Opponent in the final of mehdi tahiri?,SELECT Score FROM table WHERE Opponent in the final = mehdi tahiri
"Which Date has a Score of 6–3, 7–6?","SELECT SUM Date FROM table WHERE Score = 6–3, 7–6"
"Which Date has a Score of 7–6(3), 4–6, 6–2?","SELECT SUM Date FROM table WHERE Score = 7–6(3), 4–6, 6–2"
Which Surface has a Tournament of olbia?,SELECT Surface FROM table WHERE Tournament = olbia
What was the attendance at the week 7 game?,SELECT Attendance FROM table WHERE Week = 7
What was the result of the game after week 3 against the New York Giants?,SELECT Result FROM table WHERE Week > 3 AND Opponent = new york giants
Who was the opponent at the week 6 game?,SELECT Opponent FROM table WHERE Week = 6
What is the lowest loss that Jarius Wright has had where he also has had a gain bigger than 1.,SELECT MIN Loss FROM table WHERE Name = jarius wright AND Gain > 1
How much was the first place prize for the American golf classic located in Ohio?,SELECT 1st prize ( $ ) FROM table WHERE Location = ohio AND Tournament = american golf classic
What date was the Monsanto open located in Florida?,SELECT Date FROM table WHERE Location = florida AND Tournament = monsanto open
What was the score of Johnny Miller (7)?,SELECT Score FROM table WHERE Winner = johnny miller (7)
What is the total number of years that have divisions greater than 4?,SELECT COUNT Year FROM table WHERE Division > 4
What is the highest division for years earlier than 2011?,SELECT MAX Division FROM table WHERE Year < 2011
"In what Week were there less than 30,348 in Attendance with a Result of W 37-21?","SELECT SUM Week FROM table WHERE Attendance < 30,348 AND Result = w 37-21"
"What is the Week number on November 30, 1958 with more than 33,240 in Attendance?","SELECT COUNT Week FROM table WHERE Date = november 30, 1958 AND Attendance > 33,240"
"What was the Result on November 9, 1958?","SELECT Result FROM table WHERE Date = november 9, 1958"
What was the Attendance on Week 8?,SELECT AVG Attendance FROM table WHERE Week = 8
Which season did not qualify for UEFA competitions?,SELECT Season FROM table WHERE Against = did not qualify for uefa competitions
How many games were lost that had goals against of 5?,SELECT Lost FROM table WHERE Goals against = 5
How many draws were there with goals against that did not qualify for UEFA competitions?,SELECT Drew FROM table WHERE Goals against = did not qualify for uefa competitions
Which competition did not qualify for UEFA competitions in the 1970-71 season?,SELECT Competition FROM table WHERE Lost = did not qualify for uefa competitions AND Season = 1970-71
What is the attendance in texas stadium?,SELECT SUM Attendance FROM table WHERE Venue = texas stadium
What is the home team score for the team that has a home field of the Telstra Dome?,SELECT Home team score FROM table WHERE Ground = telstra dome
What is the date for the home team score of 6.5 (41)?,SELECT Date FROM table WHERE Home team score = 6.5 (41)
Which home team had an away team of the Brisbane Lions?,SELECT Home team FROM table WHERE Away team = brisbane lions
What is the report for the team with a home ground of MCG and a home team score of 6.5 (41)?,SELECT Report FROM table WHERE Ground = mcg AND Home team score = 6.5 (41)
What was the sensor with a resolution of 355x288 for a Naturalpoint Trackir 3?,SELECT Sensor FROM table WHERE Sensor resolution = 355x288 AND Camera = naturalpoint trackir 3
What was the sensor resolution with a minimal CPU usage for a naturalpoint trackir 3 pro?,SELECT Sensor resolution FROM table WHERE CPU usage = minimal AND Camera = naturalpoint trackir 3 pro
What was the output with no IR LEDs?,SELECT Output FROM table WHERE IR LEDs = no
"What sensor has a resolution of 640x480 with small CPU usage, jpeg compressed output and a camera of sony playstation eyetoy?",SELECT Sensor FROM table WHERE Sensor resolution = 640x480 AND CPU usage = small AND Output = jpeg compressed AND Camera = sony playstation eyetoy
What is the max speed of the unit with an 8+4 quantity built before 1971?,SELECT SUM Max Speed (km/h) FROM table WHERE Quantity built = 8+4 AND Year built < 1971
What is the numbers of the thn unit with a power greater than 220?,SELECT Numbers FROM table WHERE Power (horsepower) > 220 AND Type = thn
What is the power of the unit built after 1995?,SELECT SUM Power (horsepower) FROM table WHERE Year built > 1995
"Week larger than 6, and a Date of november 22, 1959 had what result?","SELECT Result FROM table WHERE Week > 6 AND Date = november 22, 1959"
Result of w 21–7 had what average week?,SELECT AVG Week FROM table WHERE Result = w 21–7
"Date of november 29, 1959 had what lowest attendance?","SELECT MIN Attendance FROM table WHERE Date = november 29, 1959"
"Week that has a Date of december 5, 1959 had what week?","SELECT Week FROM table WHERE Date = december 5, 1959"
Which Game has an Opponent of @ carolina hurricanes?,SELECT SUM Game FROM table WHERE Opponent = @ carolina hurricanes
How many games have a November of 10?,SELECT COUNT Game FROM table WHERE November = 10
Which Game has a November of 22?,SELECT SUM Game FROM table WHERE November = 22
What is the mean year of marriage when her age was more than 19 and his age was 30?,SELECT AVG Year of Marriage FROM table WHERE Her Age > 19 AND His Age = 30
"What is the lowest figure for her age when the year of marriage is before 1853, the number of children is less than 8, and the bride was Eliza Maria Partridge?",SELECT MIN Her Age FROM table WHERE Year of Marriage < 1853 AND # of Children < 8 AND Name = eliza maria partridge
"What is the total number of her age figures where his age is less than 33, the bride was diontha walker, and the number of children was less than 0?",SELECT SUM Her Age FROM table WHERE His Age < 33 AND Name = diontha walker AND # of Children < 0
"How much Lost has an Against larger than 19, and a Drawn smaller than 1?",SELECT SUM Lost FROM table WHERE Against > 19 AND Drawn < 1
"Which Played has a Lost of 3, and an Against of 23?",SELECT AVG Played FROM table WHERE Lost = 3 AND Against = 23
"Which Played is the highest one that has an Against smaller than 18, and Points smaller than 10?",SELECT MAX Played FROM table WHERE Against < 18 AND Points < 10
"Which Against is the highest one that has a Drawn larger than 1, and a Team of corinthians, and a Played smaller than 7?",SELECT MAX Against FROM table WHERE Drawn > 1 AND Team = corinthians AND Played < 7
"What opponent has october less than 20, and 8 for points?",SELECT Opponent FROM table WHERE October < 20 AND Points = 8
What position does Drew Callander play?,SELECT Position FROM table WHERE Player = drew callander
What round did Ray Kurpis play?,SELECT Round FROM table WHERE Player = ray kurpis
Which Built by has a Name of northern jaeger?,SELECT Built by FROM table WHERE Name = northern jaeger
"How many Horsepowers have a Year smaller than 1974, and a Tonnage of 4437?",SELECT SUM Horsepowers FROM table WHERE Year < 1974 AND Tonnage = 4437
When was the 2014 fifa world cup qualification?,SELECT Date FROM table WHERE Competition = 2014 fifa world cup qualification
When was the date of an event at Tokyo venue?,SELECT Date FROM table WHERE Venue = tokyo
What city did Yugoslavia play against Poland in?,SELECT City FROM table WHERE Opponent = poland
What day did Yugoslavia play Luxembourg?,SELECT Date FROM table WHERE Opponent = luxembourg
What type of game was played in Ljubljana?,SELECT Type of game FROM table WHERE City = ljubljana
What's the result of the game played in Belgrade?,SELECT Results¹ FROM table WHERE City = belgrade
What was the score on March 23?,SELECT Score FROM table WHERE Date = march 23
"When the Vancouver Canucks were visiting, what was the record when the score was 4-2?",SELECT Record FROM table WHERE Score = 4-2 AND Visitor = vancouver canucks
"Which Partner has a Score of 6–7, 7–6, 6–7?","SELECT Partner FROM table WHERE Score = 6–7, 7–6, 6–7"
Which Score has a Date of 13 april 1997?,SELECT Score FROM table WHERE Date = 13 april 1997
"Which Partner has a Score of 7–6, 6–3?","SELECT Partner FROM table WHERE Score = 7–6, 6–3"
Which Date has a Tournament of bmw open?,SELECT Date FROM table WHERE Tournament = bmw open
Which Partner has a Tournament of catella swedish open?,SELECT Partner FROM table WHERE Tournament = catella swedish open
"Which Date has a Surface of clay, and a Score of 6–3, 5–7, 2–6?","SELECT Date FROM table WHERE Surface = clay AND Score = 6–3, 5–7, 2–6"
Who was the winner of the tre valli varesine race?,SELECT Winner FROM table WHERE Race Name = tre valli varesine
What is the date of the omloop van de vlaamse scheldeboorden race with a UCI rating of 1.1?,SELECT Date FROM table WHERE UCI Rating = 1.1 AND Race Name = omloop van de vlaamse scheldeboorden
What is the date of the gp città di camaiore race?,SELECT Date FROM table WHERE Race Name = gp città di camaiore
What is the UCI rating of the race in Italy with the progetto ciclismo alplast team?,SELECT UCI Rating FROM table WHERE Location = italy AND Team = progetto ciclismo alplast
What is the date of the game being played at Schaeffer Stadium?,SELECT Date FROM table WHERE Game Site = schaeffer stadium
"Which Points have a Year larger than 1966, and Wins larger than 1?",SELECT AVG Points FROM table WHERE Year > 1966 AND Wins > 1
Which Year is the lowest one that has Wins smaller than 0?,SELECT MIN Year FROM table WHERE Wins < 0
Which Points have Wins larger than 1?,SELECT AVG Points FROM table WHERE Wins > 1
"Which Wins have a Year of 1963, and a Class of 50cc?",SELECT AVG Wins FROM table WHERE Year = 1963 AND Class = 50cc
How many overall WC ponts (rank) did Anders Jacobsen get when his rank was smaller than 3?,SELECT Overall WC points (Rank) FROM table WHERE Rank < 3 AND Name = anders jacobsen
Who had the highest rank with a 1st (m) of 129 and less than 255.6 points?,SELECT MAX Rank FROM table WHERE 1st (m) = 129 AND Points < 255.6
"Who had the lowest 1st (m), ranked lower than 8, with an overall WC points (rank) of 369 (16) with more than 258.2 points?",SELECT MIN 1st (m) FROM table WHERE Rank < 8 AND Overall WC points (Rank) = 369 (16) AND Points > 258.2
What is the player from Australia's rank with more than 16 wins?,SELECT COUNT Rank FROM table WHERE Wins > 16 AND Country = australia
"What is the lowest rank of a player with earnings under $11,936,443 and more than 16 wins?","SELECT MIN Rank FROM table WHERE Earnings ( $ ) < 11,936,443 AND Wins > 16"
What is the highest earnings of a player with more than 19 wins?,SELECT MAX Earnings ( $ ) FROM table WHERE Wins > 19
Which average Opened has a Manufacturer of vekoma?,SELECT AVG Opened FROM table WHERE Manufacturer = vekoma
"Which Opened is the highest one that has a Themed Area of aerial park, and a Manufacturer of zamperla?",SELECT MAX Opened FROM table WHERE Themed Area = aerial park AND Manufacturer = zamperla
Which Themed Area has a Name of troublesome trucks runaway coaster?,SELECT Themed Area FROM table WHERE Name = troublesome trucks runaway coaster
"Which Manufacturer has a Style of steel sit down, and an Opened larger than 2008?",SELECT Manufacturer FROM table WHERE Style = steel sit down AND Opened > 2008
What position has a pick less than 25 for the university of california?,SELECT Position FROM table WHERE Pick < 25 AND School = university of california
What is the pick number for tulane university?,SELECT SUM Pick FROM table WHERE School = tulane university
What is the pick number for the kansas city royals?,SELECT SUM Pick FROM table WHERE Team = kansas city royals
"What is the average Pick for the Pasco, Wa school?","SELECT AVG Pick FROM table WHERE School = pasco, wa"
What Label released a CD single in 1993?,SELECT Label FROM table WHERE Format = cd single AND Date = 1993
Where was home with a record of 7–5–2?,SELECT Home FROM table WHERE Record = 7–5–2
On what date was the record 8–6–3?,SELECT Date FROM table WHERE Record = 8–6–3
What was the score when Pittsburgh was the visitor?,SELECT Score FROM table WHERE Visitor = pittsburgh
On what date were the NY Rangers home?,SELECT Date FROM table WHERE Home = ny rangers
Which visitor had a record of 7–5–3?,SELECT Visitor FROM table WHERE Record = 7–5–3
Who was home when Detroit was visiting with a score of 4 – 1?,SELECT Home FROM table WHERE Visitor = detroit AND Score = 4 – 1
What is the earliest date with Great Expectations label with LP format?,SELECT MIN Date FROM table WHERE Label = great expectations AND Format = lp
What format was used for Mobil 1?,SELECT Format FROM table WHERE Catalog = mobil 1
what team won the friendly match,SELECT Result FROM table WHERE Competition = friendly match
"Which Runner-up has a Last win smaller than 1998, and Wins of 1, and a Rank larger than 13?",SELECT COUNT Runner-up FROM table WHERE Last win < 1998 AND Wins = 1 AND Rank > 13
"How many Last wins have a Club of mansfield town, and Wins smaller than 1?",SELECT COUNT Last win FROM table WHERE Club = mansfield town AND Wins < 1
"Which Driver has a Date of 16th september 1951, and a Race of dns?",SELECT Driver FROM table WHERE Date = 16th september 1951 AND Race = dns
At which race did reg parnell win the goodwood trophy?,SELECT Race FROM table WHERE Event = goodwood trophy AND Driver = reg parnell
"Which Race has a Date of 31st may 1953, and an Event of grand prix de l'albigeois final?",SELECT Race FROM table WHERE Date = 31st may 1953 AND Event = grand prix de l'albigeois final
"What's the highest rank of a PVG/ZSPD Code (IATA/ICAO) airport with a total cargo less than 2,543,394 metric tonnes?","SELECT MAX Rank FROM table WHERE Code (IATA/ICAO) = pvg/zspd AND Total Cargo (Metric Tonnes) < 2,543,394"
What's the average total cargo in metric tonnes that has an 11.8% Change?,SELECT AVG Total Cargo (Metric Tonnes) FROM table WHERE % Change = 11.8%
What is the highest rank of Tokyo International Airport?,SELECT MAX Rank FROM table WHERE Airport = tokyo international airport
"Where the games are smaller than 5 and the points are 6, what is the average lost?",SELECT AVG Lost FROM table WHERE Points = 6 AND Games < 5
with build 5/69-6/69 what's the order?,SELECT SUM Order FROM table WHERE Built = 5/69-6/69
"Which Outcome has a Score of 6–2, 6–2?","SELECT Outcome FROM table WHERE Score = 6–2, 6–2"
"Which Date has an Outcome of winner, and a Score of 7–5, 6–4?","SELECT Date FROM table WHERE Outcome = winner AND Score = 7–5, 6–4"
"Which Tournament has an Outcome of winner, and a Surface of clay, and a Score of 6–4, 6–1?","SELECT Tournament FROM table WHERE Outcome = winner AND Surface = clay AND Score = 6–4, 6–1"
What was the outcome in mari andersson's tournament?,SELECT Outcome FROM table WHERE Opponent = mari andersson
What's the loss of the game with the opponent of the Nationals with a score of 7-1?,SELECT Loss FROM table WHERE Opponent = nationals AND Score = 7-1
Which opponent has a record of 70-52?,SELECT Opponent FROM table WHERE Record = 70-52
What is the attendance of the game that has the opponent of The Nationals with a record of 68-51?,SELECT SUM Attendance FROM table WHERE Opponent = nationals AND Record = 68-51
What's the attendance of the game with a score of 5-4?,SELECT Attendance FROM table WHERE Score = 5-4
Who's the opponent of the game with the record 64-51?,SELECT Opponent FROM table WHERE Record = 64-51
Who were the opponents in games before number 54?,SELECT Opponent FROM table WHERE Game < 54
what was the score of bert yancey,SELECT Score FROM table WHERE Player = bert yancey
What is the Length/Fuel of the bus with a Quantity of 30?,SELECT Length/Fuel FROM table WHERE Quantity = 30
What is the Length/Fuel of the bus built between 2000-2003 with a high Floor Styling?,SELECT Length/Fuel FROM table WHERE Floor Styling = high AND Year Built = 2000-2003
In what Venue was the game with a Friendly Competition and 1 Goal played?,SELECT Venue FROM table WHERE Competition = friendly AND Goal = 1
What is the amount of money that a +5 to par with a score of 76-69-70-70=285?,SELECT COUNT Money ( $ ) FROM table WHERE To par = +5 AND Score = 76-69-70-70=285
What is the name of the player with a 71-69-71-69=280 score?,SELECT Player FROM table WHERE Score = 71-69-71-69=280
"Which average Game # has a Home of san jose, and Points smaller than 71?",SELECT AVG Game # FROM table WHERE Home = san jose AND Points < 71
Which Home has a Game # of 59?,SELECT Home FROM table WHERE Game # = 59
"Which Visitor has a Game # larger than 62, and a Date of february 25?",SELECT Visitor FROM table WHERE Game # > 62 AND Date = february 25
with delivery date of 2001 2001 what is the owns?,SELECT Owns FROM table WHERE Delivery Date = 2001 2001
with delivery date of 2001 2001 what is gross tonnage?,SELECT AVG Gross Tonnage FROM table WHERE Delivery Date = 2001 2001
with delivery date 1997 1997 what is the owns?,SELECT Owns FROM table WHERE Delivery Date = 1997 1997
"Which conference does the school from Gainesville, Florida, play in?","SELECT Present Conference FROM table WHERE Location = gainesville, florida"
What is the number of enrollments for teams named the Buccaneers founded before 1911?,SELECT COUNT Enrollment FROM table WHERE Nickname = buccaneers AND Founded < 1911
What is the highest chart number for the song Yardbirds aka Roger the Engineer?,SELECT MAX Chart no. FROM table WHERE Title = yardbirds aka roger the engineer
What is the average chart number for 11/1965?,SELECT AVG Chart no. FROM table WHERE Date = 11/1965
What is origin country for a title that charted at 52?,SELECT Origin FROM table WHERE Chart no. = 52
What is the Record of the Game after 40 with New York Rangers as Opponent?,SELECT Record FROM table WHERE Game > 40 AND Opponent = new york rangers
When did Adam Thompson play in the final?,SELECT Date FROM table WHERE Opponent in the final = adam thompson
When was the Lagos tournament?,SELECT Date FROM table WHERE Tournament = lagos
What was the score against the phillies on may 24?,SELECT Score FROM table WHERE Opponent = phillies AND Date = may 24
Opponent of new england patriots had what attendance?,SELECT Attendance FROM table WHERE Opponent = new england patriots
"Attendance of 55,340 had what opponent?","SELECT Opponent FROM table WHERE Attendance = 55,340"
"Week smaller than 4, and a Game Site of rca dome, and a Opponent of new england patriots involves what date?",SELECT Date FROM table WHERE Week < 4 AND Game Site = rca dome AND Opponent = new england patriots
Record of 0–8 had what result?,SELECT Result FROM table WHERE Record = 0–8
Record of 0–8 had what lowest week?,SELECT MIN Week FROM table WHERE Record = 0–8
What was the score when the visitor was pittsburgh?,SELECT Score FROM table WHERE Visitor = pittsburgh
What was the decision on November 26?,SELECT Decision FROM table WHERE Date = november 26
"What is the BW 2013 ranking of Washington, D.C., which has an ARWU 2012 ranking greater than 51?","SELECT BW 2013 FROM table WHERE ARWU 2012 > 51 AND Location (State, City) = washington, d.c."
"What is the USN 2013 ranking with a BW 2013 ranking less than 1000, a Forbes 2011 ranking larger than 17, and a CNN 2011 ranking less than 13?",SELECT SUM USN 2013 FROM table WHERE BW 2013 < 1000 AND Forbes 2011 > 17 AND CNN 2011 < 13
What is the average AE 2011 ranking with a Forbes 2011 ranking of 24 and a FT 2011 ranking less than 44?,SELECT AVG AE 2011 FROM table WHERE Forbes 2011 = 24 AND FT 2011 < 44
"What is the average ARWU 2012 ranking of Illinois, Champaign, which has a USN 2013 ranking less than 91 and an EC 2013 ranking larger than 1000?","SELECT AVG ARWU 2012 FROM table WHERE USN 2013 < 91 AND Location (State, City) = illinois, champaign AND Ec 2013 > 1000"
"What is the average BW 2013 ranking of Texas, Fort Worth, which has an AE 2011 ranking of 1000 and an FT 2011 ranking less than 1000?","SELECT AVG BW 2013 FROM table WHERE AE 2011 = 1000 AND Location (State, City) = texas, fort worth AND FT 2011 < 1000"
Who did they play at lincoln financial field at 8:30 (ET) after week 14?,SELECT Opponent FROM table WHERE Week > 14 AND Game Site = lincoln financial field AND Time (ET) = 8:30
"What is the density for the area that is larger than 4,015.6 and a population smaller than 6,178?","SELECT COUNT Density (km 2 ) FROM table WHERE Area (km 2 ) > 4,015.6 AND 2002 population < 6,178"
"What is the density that has an area smaller than 2,200.2 and a population larger than 2,599?","SELECT COUNT Density (km 2 ) FROM table WHERE Area (km 2 ) < 2,200.2 AND 2002 population > 2,599"
What is the average rank for nations with fewer than 0 gold medals?,SELECT AVG Rank FROM table WHERE Gold < 0
What is the total number of bronze medals with more than 1 medal total and fewer than 1 silver medal?,SELECT COUNT Bronze FROM table WHERE Total > 1 AND Silver < 1
What is the highest rank of a nation with fewer than 0 silver medals?,SELECT MAX Rank FROM table WHERE Silver < 0
"Which Bats have a First of josh, and Throws of r, and a Surname of cakebread?",SELECT Bats FROM table WHERE First = josh AND Throws = r AND Surname = cakebread
"Which DOB has Throws of r, and a Position of c, and a First of torey?",SELECT D.O.B. FROM table WHERE Throws = r AND Position = c AND First = torey
Which DOB has a Surname of cresswell?,SELECT D.O.B. FROM table WHERE Surname = cresswell
"Which DOB has Bats of r, and Throws of r, and a Position of rhp, and a First of john?",SELECT D.O.B. FROM table WHERE Bats = r AND Throws = r AND Position = rhp AND First = john
Which Position did Ruzic play?,SELECT Position FROM table WHERE Surname = ruzic
How many throws did Torey have?,SELECT Throws FROM table WHERE First = torey
"Which Ties is the highest one that has Losses smaller than 9, and Starts of 26, and Wins smaller than 21?",SELECT MAX Ties FROM table WHERE Losses < 9 AND Starts = 26 AND Wins < 21
"Which Win % has a Name of tony rice, and Wins smaller than 28?",SELECT COUNT Win % FROM table WHERE Name = tony rice AND Wins < 28
"Which Wins have a Win % smaller than 0.8270000000000001, and a Name of rick mirer, and Ties smaller than 1?",SELECT SUM Wins FROM table WHERE Win % < 0.8270000000000001 AND Name = rick mirer AND Ties < 1
How many Losses have a Name of blair kiel?,SELECT COUNT Losses FROM table WHERE Name = blair kiel
Which Losses have a Name of jimmy clausen?,SELECT AVG Losses FROM table WHERE Name = jimmy clausen
what is the number of attendance on june 24,SELECT COUNT Attendance FROM table WHERE Date = june 24
"Attendance larger than 17,001, and a Date of june 15 had what decision?","SELECT Decision FROM table WHERE Attendance > 17,001 AND Date = june 15"
Home of dallas happened on what date?,SELECT Date FROM table WHERE Home = dallas
Home of buffalo happened on what date?,SELECT Date FROM table WHERE Home = buffalo
"Visitor of dallas, and a Date of june 12 had what highest attendance?",SELECT MAX Attendance FROM table WHERE Visitor = dallas AND Date = june 12
On which date was the position less than 4 at Piraeus?,SELECT Date FROM table WHERE Pos. < 4 AND Venue = piraeus
Which team had 64 laps and 13 points?,SELECT Team FROM table WHERE Laps = 64 AND Points = 13
How many laps did the team with a time/retired of +1.906 have?,SELECT COUNT Laps FROM table WHERE Time/Retired = +1.906
What is the time/retired of the team with a grid of 14?,SELECT Time/Retired FROM table WHERE Grid = 14
"What is the lowest grid of pkv racing, which had 13 points and less than 64 laps?",SELECT MIN Grid FROM table WHERE Team = pkv racing AND Points = 13 AND Laps < 64
What is the total grid of the team with a time/retired of +7.346?,SELECT COUNT Grid FROM table WHERE Time/Retired = +7.346
What is the grid of pkv racing with the driver oriol servià?,SELECT SUM Grid FROM table WHERE Team = pkv racing AND Driver = oriol servià
"When Cancelable of yes, bubble of yes and a Category of keyboard, what was the Attribute?",SELECT Attribute FROM table WHERE Cancelable = yes AND Bubbles = yes AND Category = keyboard
"When Bubbles of no, and a Category of miscellaneous, and a Type of propertychange, what was the Cancelable?",SELECT Cancelable FROM table WHERE Bubbles = no AND Category = miscellaneous AND Type = propertychange
When Type was rowexit what was the Category?,SELECT Category FROM table WHERE Type = rowexit
"When Cancelable of yes, and a Type of drag, what was the Category?",SELECT Category FROM table WHERE Cancelable = yes AND Type = drag
"When Event has Bubbles of yes, Cancelable of yes, Category of mouse, and a Type of contextmenu what is the Attribute?",SELECT Attribute FROM table WHERE Bubbles = yes AND Cancelable = yes AND Category = mouse AND Type = contextmenu
"Let's say Type is of datasetcomplete, what is the Attribute?",SELECT Attribute FROM table WHERE Type = datasetcomplete
What is the name of the parish that has a former local authority of St Neots urban district?,SELECT Name FROM table WHERE Former local authority = st neots urban district
What district is the parish who had the South Cambridgeshire rural district as the former local authority?,SELECT District FROM table WHERE Former local authority = south cambridgeshire rural district
What district is St Martin's Without parish in with a population less than 75?,SELECT District FROM table WHERE Population < 75 AND Name = st martin's without
Who was the home team when FK kom were the guests?,SELECT Home FROM table WHERE Guest = fk kom
