question,sql
Which permanent account has registration of invite-only and userpics free of unknown?,SELECT Permanent Account FROM table WHERE Userpics Free = unknown AND Registration = invite-only
What is the year began for the site with free userpics cost of $1 and a userpics paid value of N/A?,SELECT Year Began FROM table WHERE Userpics Paid = n/a AND Userpics Free = 1
Which Week has a Tournament of monte carlo?,SELECT Week FROM table WHERE Tournament = monte carlo
Which Winner and score has a Finalist of aaron krickstein?,SELECT Winner and score FROM table WHERE Finalist = aaron krickstein
"Which Semifinalists have a Surface of hard, and a Winner and score of pete sampras 6–3, 3–6, 6–3?","SELECT Semifinalists FROM table WHERE Surface = hard AND Winner and score = pete sampras 6–3, 3–6, 6–3"
"Which Finalist has a Winner and score of boris becker 7–6(3), 6–3, 3–6, 6–3?","SELECT Finalist FROM table WHERE Winner and score = boris becker 7–6(3), 6–3, 3–6, 6–3"
Which Semifinalists have a Finalist of andrei chesnokov?,SELECT Semifinalists FROM table WHERE Finalist = andrei chesnokov
Which Surface has Semifinalists of wally masur malivai washington?,SELECT Surface FROM table WHERE Semifinalists = wally masur malivai washington
What place had a score of 73-69-68=210?,SELECT Place FROM table WHERE Score = 73-69-68=210
What country is Gary Player from in T9 place?,SELECT Country FROM table WHERE Place = t9 AND Player = gary player
What's the score of New Zealand?,SELECT Score FROM table WHERE Country = new zealand
What player has a score of 67-70-77=214?,SELECT Player FROM table WHERE Score = 67-70-77=214
What country has a finish of 59?,SELECT Country FROM table WHERE Finish = 59
What is the To Par when the finish was t16 and the player was Julius Boros?,SELECT To par FROM table WHERE Finish = t16 AND Player = julius boros
What was the finish for Billy Casper?,SELECT Finish FROM table WHERE Player = billy casper
"Who is the competitor with a downhill of more than 55, and 1st DQ run?",SELECT Competitor FROM table WHERE Downhill > 55 AND 1st run = dq
"What is the 1st run that is down hill less than 46, and 84.45 points?",SELECT 1st run FROM table WHERE Downhill < 46 AND Points = 84.45
What ground has 0.14.1.6 (93) as the home team score?,SELECT Ground FROM table WHERE Home team score = 0.14.1.6 (93)
What away team score has hawthorn as the home team?,SELECT Away team score FROM table WHERE Home team = hawthorn
What is the make of the vehicle for driver Hisashi Wada?,SELECT Make FROM table WHERE Drivers = hisashi wada
In what rounds was the featured team of Avanzza Rosso?,SELECT Rounds FROM table WHERE Team = avanzza rosso
In what rounds was the featured driver Tomonobu Fujii with a Tyre of Y?,SELECT Rounds FROM table WHERE Tyre = y AND Drivers = tomonobu fujii
Who is the driver with a tyre of k for Avanzza Rosso?,SELECT Drivers FROM table WHERE Tyre = k AND Team = avanzza rosso
What is the tyre for Yoshihisa Namekata?,SELECT Tyre FROM table WHERE Drivers = yoshihisa namekata
"If the pick is under 28 and the position is k, what's the highest Overall pick?",SELECT MAX Overall FROM table WHERE Position = k AND Pick < 28
"During round 8 when the Position being picked was rb, what was the highest overall pick?",SELECT MAX Overall FROM table WHERE Position = rb AND Round = 8
Which county had a Bush number of votes of 566?,SELECT County FROM table WHERE Bush# = 566
who is the opponent when the year is after 1996 and the outcome is winner?,SELECT Opponent FROM table WHERE Year > 1996 AND Outcome = winner
what is the surface when the championship is rome and the opponent is sergi bruguera?,SELECT Surface FROM table WHERE Championship = rome AND Opponent = sergi bruguera
what is the score when the surface is hard and outcome is runner-up?,SELECT Score FROM table WHERE Surface = hard AND Outcome = runner-up
What was the number of the game played on February 24?,SELECT SUM Game FROM table WHERE Date = february 24
"Where was the game played when the opponent was Oklahoma City, and what was the attendance?",SELECT Location Attendance FROM table WHERE Team = oklahoma city
What was the record when they played game 58?,SELECT Record FROM table WHERE Game = 58
"What is Score In The Final, when Date is ""22 October 1990""?",SELECT Score in the final FROM table WHERE Date = 22 october 1990
"What is Outcome, when Surface is ""Carpet (I)"", and when Date is ""15 November 1993""?",SELECT Outcome FROM table WHERE Surface = carpet (i) AND Date = 15 november 1993
"What is Tournament, when Opponent In The Final is ""Andre Agassi""?",SELECT Tournament FROM table WHERE Opponent in the final = andre agassi
"What is Score In The Final, when Date is ""30 August 1993""?",SELECT Score in the final FROM table WHERE Date = 30 august 1993
"What is Date, when Outcome is ""Winner"", and when Surface is ""Grass""?",SELECT Date FROM table WHERE Outcome = winner AND Surface = grass
"What is Opponent In The Final, when Outcome is ""Winner"", when Surface is ""Carpet (I)"", and when Tournament is ""Lyon, France""?","SELECT Opponent in the final FROM table WHERE Outcome = winner AND Surface = carpet (i) AND Tournament = lyon, france"
"What are the total goals against the winner with less than 5 wins, and less than 5 plays?",SELECT COUNT Goals Against FROM table WHERE Wins < 5 AND Played < 5
What is the average losses for 22 goals?,SELECT AVG Losses FROM table WHERE Goals For > 22
"What is the total wins with less than 2 ties, 18 goals, and less than 2 losses?",SELECT SUM Wins FROM table WHERE Ties < 2 AND Goals Against = 18 AND Losses < 2
"What is the Overall Record when the Last 10 Meetings is ou, 7-3, and Norman is ou, 18-3?","SELECT Overall Record FROM table WHERE Last 10 Meetings = ou, 7-3 AND at Norman = ou, 18-3"
"What is Oklahoma vs. when Current Streak is l 1, and Neutral Site is osu, 7-6?","SELECT Oklahoma vs. FROM table WHERE Current Streak = l 1 AND at Neutral Site = osu, 7-6"
"What is the Overall Record when Since Beginning of Big 12 is ou, 27-3?","SELECT Overall Record FROM table WHERE Since Beginning of Big 12 = ou, 27-3"
"What is the Last 10 Meetings when Norman is ou, 18-6?","SELECT Last 10 Meetings FROM table WHERE at Norman = ou, 18-6"
"what is the since beginning of big 12 when last 10 meetings is ou, 7-3, neutral site is ou, 2-1, and last 5 meetings is bu, 3-2?","SELECT Since Beginning of Big 12 FROM table WHERE Last 10 Meetings = ou, 7-3 AND at Neutral Site = ou, 2-1 AND Last 5 Meetings = bu, 3-2"
"what is the current streak when the last 5 meetings is osu, 4-1?","SELECT Current Streak FROM table WHERE Last 5 Meetings = osu, 4-1"
What is the record for a game lower than 79?,SELECT Record FROM table WHERE Game < 79
"Who was the partner when the final score was 7–6, 3–6, 6–7?","SELECT Partner FROM table WHERE Score in the final = 7–6, 3–6, 6–7"
"Who was the partner for the match with a score in the final of 4–6, 6–7?","SELECT Partner FROM table WHERE Score in the final = 4–6, 6–7"
"What tournament took place after 1986 and had a final score of 7–6, 3–6, 6–2?","SELECT Tournament FROM table WHERE Date > 1986 AND Score in the final = 7–6, 3–6, 6–2"
"Which Year is the lowest one that has an Athlete of markus thalmann, and a Time of 23:28:24?",SELECT MIN Year FROM table WHERE Athlete = markus thalmann AND Time = 23:28:24
"Which Year is the lowest one that has a Time of 24:55:58, and a Place larger than 3?",SELECT MIN Year FROM table WHERE Time = 24:55:58 AND Place > 3
"Which Athlete has a Place of 1, and a Year smaller than 1988, and a Country of gre, and a Time of 21:57:00?",SELECT Athlete FROM table WHERE Place = 1 AND Year < 1988 AND Country = gre AND Time = 21:57:00
"Which Time has a Year larger than 1985, and a Place smaller than 2, and an Athlete of riochy sekiya?",SELECT Time FROM table WHERE Year > 1985 AND Place < 2 AND Athlete = riochy sekiya
What was Anand's score in game 8?,SELECT Anand FROM table WHERE Game = 8
What is the day and date of game 2?,"SELECT Day, Date FROM table WHERE Game = 2"
WHAT IS THE HIGH ASSISTS ON NOVEMBER 24?,SELECT High assists FROM table WHERE Date = november 24
WHAT IS THE LOCATION ATTENDANCE FOR GAME 4?,SELECT Location Attendance FROM table WHERE Game = 4
WHAT IS THE RECORD FOR DATE NOVEMBER 14?,SELECT Record FROM table WHERE Date = november 14
What tournament is on 18 May 1992?,SELECT Tournament FROM table WHERE Date = 18 may 1992
What is the score of the tournament with a carpet surface and tim henman as the partnering?,SELECT Score FROM table WHERE Surface = carpet AND Partnering = tim henman
On what surface did Katarina Srebotnik play Paola Suárez?,SELECT Surface FROM table WHERE Opponent in Final = paola suárez
"At what tournament was the Score 5–7, 7–5, 6–4?","SELECT Tournament FROM table WHERE Score in Final = 5–7, 7–5, 6–4"
"What was the Final Score on February 24, 2002?","SELECT Score in Final FROM table WHERE Date = february 24, 2002"
What was the smallest crowd when the away team scored 12.16 (88)?,SELECT MIN Crowd FROM table WHERE Away team score = 12.16 (88)
What was the average crowd size for a home team score of 11.11 (77)?,SELECT AVG Crowd FROM table WHERE Home team score = 11.11 (77)
What is the 1st leg when the 2nd leg was 67-83?,SELECT 1st leg FROM table WHERE 2nd leg = 67-83
Which Team #1 had a 1st leg of 78-78?,SELECT Team #1 FROM table WHERE 1st leg = 78-78
Who was Team #1 when Team #2 was galatasaray cc i̇stanbul?,SELECT Team #1 FROM table WHERE Team #2 = galatasaray cc i̇stanbul
What are the Podiums that has a Poles of 3?,SELECT Podiums FROM table WHERE Poles = 3
"What is the Team that has a Races of 4, and a Points of 0?",SELECT Team FROM table WHERE Races = 4 AND Points = 0
What to par is located in the united states and has a player by the name of hal sutton?,SELECT To par FROM table WHERE Country = united states AND Player = hal sutton
What player is in the place of t1 and has the score of 67-70=137?,SELECT Player FROM table WHERE Place = t1 AND Score = 67-70=137
What place has the score of 67-74=141?,SELECT Place FROM table WHERE Score = 67-74=141
What player has the score of 67-72=139?,SELECT Player FROM table WHERE Score = 67-72=139
"What was Gassaway's record at the fight in mississippi, united states against anthony macias?","SELECT Record FROM table WHERE Location = mississippi, united states AND Opponent = anthony macias"
What was the location the fight was held at that lasted 5 rounds?,SELECT Location FROM table WHERE Round = 5
What was the location of the fight when Gassaway fought kevin knabjian?,SELECT Location FROM table WHERE Opponent = kevin knabjian
What place did Fred Couples finish in?,SELECT Place FROM table WHERE Player = fred couples
What is the rank of the company who has a revenue of $428.2 billion?,SELECT COUNT Rank FROM table WHERE Revenue in USD = $428.2 billion
What is the rank of the petroleum company who has a revenue of $481.7 billion?,SELECT MIN Rank FROM table WHERE Industry = petroleum AND Revenue in USD = $481.7 billion
"What is Tournament, when 2005 is ""N/A"", and when 2002 is ""0 / 1""?",SELECT Tournament FROM table WHERE 2005 = n/a AND 2002 = 0 / 1
"What is Career Win-Loss, when 2002 is ""A"", and when 2001 is ""4R""?",SELECT Career Win-Loss FROM table WHERE 2002 = a AND 2001 = 4r
"What is Tournament, when 2001 is ""1R""?",SELECT Tournament FROM table WHERE 2001 = 1r
What was the score in the 1st leg when 2nd leg was 1–4?,SELECT 1st leg FROM table WHERE 2nd leg = 1–4
"Who is in the south-west next to Vishnu on the east, Durga on the west, and in the center of Ganapati?",SELECT South West FROM table WHERE North East = vishnu AND North West = durga AND Center = ganapati
What was the final score of game 26?,SELECT Score FROM table WHERE Game = 26
What game was played on December 8?,SELECT AVG Game FROM table WHERE Date = december 8
"What was the highest score for a California home game with over 10,870 in attendance?","SELECT MAX Points FROM table WHERE Attendance > 10,870 AND Home = california"
What is the sum of the areas for populations of 542?,SELECT SUM Area km 2 FROM table WHERE Population = 542
What is the highest area for locations named Centreville having populations over 532?,SELECT MAX Area km 2 FROM table WHERE Population > 532 AND Official Name = centreville
what is the competition when the result is 1-1 and venue is gwangju?,SELECT Competition FROM table WHERE Result = 1-1 AND Venue = gwangju
what is the date when the competition is 1998 asian games?,SELECT Date FROM table WHERE Competition = 1998 asian games
"what is the venue when the score is 1 goal and the date is october 11, 1997?","SELECT Venue FROM table WHERE Score = 1 goal AND Date = october 11, 1997"
what is the competition when the result is 2-1?,SELECT Competition FROM table WHERE Result = 2-1
"what is the result when the date is august 24, 1997?","SELECT Result FROM table WHERE Date = august 24, 1997"
"what is the venue when the date is december 7, 1998?","SELECT Venue FROM table WHERE Date = december 7, 1998"
Who is the driver with a time/retired of +5.2684?,SELECT Driver FROM table WHERE Time/Retired = +5.2684
What is the grid of driver tomas scheckter from vision racing team?,SELECT Grid FROM table WHERE Team = vision racing AND Driver = tomas scheckter
What is the grid of car no. 3?,SELECT Grid FROM table WHERE Car No. = 3
What is the grid with a +6.8359 time/retired?,SELECT Grid FROM table WHERE Time/Retired = +6.8359
"WHAT TEAM 1 HAS A 1st leg of 1–1, and a 2nd leg of 1–3?",SELECT Team 1 FROM table WHERE 1st leg = 1–1 AND 2nd leg = 1–3
WHAT IS THE 1ST LEG WITH TEAM 2 AS ATHLETIC?,SELECT 1st leg FROM table WHERE Team 2 = athletic
WHAT IS THE 2ND LEG WITH TEAM 1 OF SPORTING?,SELECT 2nd leg FROM table WHERE Team 1 = sporting
Sum of cuyo selection as the opposing team?,SELECT SUM Against FROM table WHERE Opposing Team = cuyo selection
Lowest against for tour match on 21 july 1990?,SELECT MIN Against FROM table WHERE Status = tour match AND Date = 21 july 1990
Name the lowest version with a code of u+1034a that began after 2001.,SELECT MIN Version FROM table WHERE Code = u+1034a AND Year > 2001
What character was the version 5.1 and had a Greek capital letter Archaic Sampi?,SELECT Character FROM table WHERE Version = 5.1 AND Name = greek capital letter archaic sampi
"Give the sum of the version with the coptic small letter sampi, and a year after 2005.",SELECT SUM Version FROM table WHERE Name = coptic small letter sampi AND Year > 2005
What is the year that has a name with the Greek small letter sampi?,SELECT SUM Year FROM table WHERE Name = greek small letter sampi
What country id Bob Rosburg from?,SELECT Country FROM table WHERE Player = bob rosburg
What country has a score of 73-72-67=212?,SELECT Country FROM table WHERE Score = 73-72-67=212
What is Mike Souchak's to par?,SELECT To Par FROM table WHERE Player = mike souchak
What is Mike Souchak's to par score?,SELECT To Par FROM table WHERE Player = mike souchak
What was the finish for the golfer with a total of 285?,SELECT Finish FROM table WHERE Total = 285
What was the total for the golfer who had a year won of 1987?,SELECT Total FROM table WHERE Year(s) won = 1987
What was the finish for the golfer with a To par of +2?,SELECT Finish FROM table WHERE To par = +2
What was the total for the golfer who had a To par of +10 and year won of 1971?,SELECT SUM Total FROM table WHERE To par = +10 AND Year(s) won = 1971
What team played before game 71 and had a score w 91–86 (ot)?,SELECT Team FROM table WHERE Game < 71 AND Score = w 91–86 (ot)
What was the high assist for game 66?,SELECT High assists FROM table WHERE Game = 66
What is josé maría olazábal's country?,SELECT Country FROM table WHERE Player = josé maría olazábal
Which Player has a Score of 74-67-74-71=286?,SELECT Player FROM table WHERE Score = 74-67-74-71=286
"Which Place has a Country of united states, and a Player of corey pavin?",SELECT Place FROM table WHERE Country = united states AND Player = corey pavin
Who is the opponent in week 15?,SELECT Opponent FROM table WHERE Week = 15
What is the highest attendance a result of W 30-7?,SELECT MAX Attendance FROM table WHERE Result = w 30-7
"What is the average attendance at week earlier than 6 on October 14, 2001?","SELECT AVG Attendance FROM table WHERE Week < 6 AND Date = october 14, 2001"
what is the record when the method is submission (armbar) and the round is less than 3?,SELECT Record FROM table WHERE Method = submission (armbar) AND Round < 3
How many average points did svg burgkirchen have with a loss smaller than 6?,SELECT AVG Points FROM table WHERE Name = svg burgkirchen AND Lost < 6
Who had points smaller than 22 and a drawn of 2?,SELECT Name FROM table WHERE Points < 22 AND Drawn = 2
Who lost 2 and had a position bigger than 1?,SELECT Name FROM table WHERE Lost = 2 AND Position > 1
What is the name of the catalog issued with the title of 1958 Miles on the Sony label at a year prior to 2006?,SELECT Catalog FROM table WHERE Issued title = 1958 miles AND Label = sony AND Year < 2006
What is the label of the Year before 1979?,SELECT Label FROM table WHERE Year < 1979
WHAT IS THE 2011 PERFORMANCE AT THE MIAMI MASTERS?,SELECT 2011 FROM table WHERE Tournament = miami masters
WHAT IS THE 2008 PERFORMANCE WITH A 2007 CAREER STATISTICS?,SELECT 2008 FROM table WHERE 2007 = career statistics
"WHAT IS THE TOURNAMENT WITH A 2010 OF A, 2009 OF A, AND 001 PERFORMANCE OF Q1?",SELECT Tournament FROM table WHERE 2010 = a AND 2009 = a AND 2011 = q1
"WHAT IS THE 2009 PERFORMANCE WITH A 2012 OF 2R, 2001 OF 1R, 2007 OF A, AND 2008 OF A?",SELECT 2009 FROM table WHERE 2012 = 2r AND 2011 = 1r AND 2007 = a AND 2008 = a
WHAT IS THE 2011 PERFORMANCE WITH A 2007 OF Q3?,SELECT 2011 FROM table WHERE 2007 = q3
Which Score has a Place of t2?,SELECT Score FROM table WHERE Place = t2
What was spain's score?,SELECT Score FROM table WHERE Country = spain
Which To par has a Score of 70-73-80-68=291?,SELECT To par FROM table WHERE Score = 70-73-80-68=291
From what Country is T6 Place Player Tom Weiskopf?,SELECT Country FROM table WHERE Place = t6 AND Player = tom weiskopf
"With a To par of –2, what is Johnny Miller's Place?",SELECT Place FROM table WHERE To par = –2 AND Player = johnny miller
From what Country is Gene Borek?,SELECT Country FROM table WHERE Player = gene borek
What is the Country of the Player with a To par of –5?,SELECT Country FROM table WHERE To par = –5
What is the Place of the Player from New Zealand?,SELECT Place FROM table WHERE Country = new zealand
What is the Place of the Player with a Score of 70-68=138?,SELECT Place FROM table WHERE Score = 70-68=138
"What is the highest Losses, when Wins is greater than 1, and when Last Appearance is 2003?",SELECT MAX Losses FROM table WHERE Wins > 1 AND Last Appearance = 2003
"What is the highest Wins, when Percent is 0.000, when School is Oklahoma State, and when Appearances is less than 1?",SELECT MAX Wins FROM table WHERE Percent = 0.000 AND School = oklahoma state AND Appearances < 1
"What is the total number of Losses, when Last Appearance is 2003, and when Wins is greater than 2?",SELECT COUNT Losses FROM table WHERE Last Appearance = 2003 AND Wins > 2
"What is Last Appearance, when Wins is less than 1, when Losses is 1, and when School is Oklahoma State?",SELECT Last Appearance FROM table WHERE Wins < 1 AND Losses = 1 AND School = oklahoma state
"What is College, when Pick is less than 145, and when Player is Jeff Wilkins?",SELECT College FROM table WHERE Pick < 145 AND Player = jeff wilkins
"What is Nationality, and when College is Illinois State?",SELECT Nationality FROM table WHERE College = illinois state
"What is Nationality, when Round is 6?",SELECT Nationality FROM table WHERE Round = 6
"What is the total number of Round, when College is Northern Illinois?",SELECT COUNT Round FROM table WHERE College = northern illinois
"What is the average bronze when the total is 2, silver is less than 1 and gold is more than 1?",SELECT AVG Bronze FROM table WHERE Total = 2 AND Silver < 1 AND Gold > 1
what is the average silver when the total is more than 20?,SELECT AVG Silver FROM table WHERE Total > 20
what is the highest rank when the nation is united states (usa) and bronze is more than 1?,SELECT MAX Rank FROM table WHERE Nation = united states (usa) AND Bronze > 1
"what is the average total when bronze is more than 0, gold is 0, the nation is united states (usa) and silver is 0?",SELECT AVG Total FROM table WHERE Bronze > 0 AND Gold = 0 AND Nation = united states (usa) AND Silver < 0
What was the resolution for the fight against enrique guzman?,SELECT Res. FROM table WHERE Opponent = enrique guzman
What was the resolution of the fight when Nate Mohr's record was 8-6?,SELECT Res. FROM table WHERE Record = 8-6
What is the smallest number of third place earned for the Es Sahel at a rank less than 3?,SELECT MIN Third FROM table WHERE Club = es sahel AND Rank < 3
Which club has 1 runners-up with 0 winners and 2 third place earned?,SELECT Club FROM table WHERE Runners-up = 1 AND Winners = 0 AND Third = 2
"Which Annual ridership (2008) has a Number of stations larger than 70, and an Annual ridership (1998) smaller than 451,971,849?","SELECT MIN Annual ridership (2008) FROM table WHERE Number of stations > 70 AND Annual ridership (1998) < 451,971,849"
"What is Name, when Bonus is greater than 1, when Only Point is greater than 7, and when Total Point is less than 21?",SELECT Name FROM table WHERE Bonus > 1 AND Only Point > 7 AND Total Point < 21
"What is Name, when Only Point is greater than 1, when Catch Taken is greater than 3, when Bonus is greater than 4, and when Total Point is less than 30?",SELECT Name FROM table WHERE Only Point > 1 AND Catch Taken > 3 AND Bonus > 4 AND Total Point < 30
How many grids does Ducati have with Casey Stoner as a rider with fewer than 27 laps?,SELECT COUNT Grid FROM table WHERE Manufacturer = ducati AND Rider = casey stoner AND Laps < 27
Which manufacturer has a time of +10.142?,SELECT Manufacturer FROM table WHERE Time = +10.142
What is Loris Capirossi's time?,SELECT Time FROM table WHERE Rider = loris capirossi
What were the highest laps when the grid was larger than 19 and the time/retired was fuel?,SELECT MAX Laps FROM table WHERE Grid > 19 AND Time/Retired = fuel
Which team did Scott Pruett drive for when the grid was smaller than 20 and there were 65 laps?,SELECT Team FROM table WHERE Laps = 65 AND Grid < 20 AND Driver = scott pruett
"What year is the date when the boiler type is forward topfeed, the built at is Crewe, and lot number is less than 187?",SELECT COUNT Date FROM table WHERE Boiler type = forward topfeed AND Built at = crewe AND Lot No. < 187
What was the date of the game where Esteban Paredes scored 2 goals?,SELECT Date FROM table WHERE Goal = 2
What is the highest attendance when the opponent is the Los Angeles Rams and the week is less than 11?,SELECT MAX Attendance FROM table WHERE Opponent = los angeles rams AND Week < 11
What is the result when the week is greater than 7 and the Houston Oilers were the opponent?,SELECT Result FROM table WHERE Week > 7 AND Opponent = houston oilers
"What is Record, when Location Attendance is ""Izod Center 16,911""?","SELECT Record FROM table WHERE Location Attendance = izod center 16,911"
"What is High Rebounds, when High Assists is ""Delonte West (10)""?",SELECT High rebounds FROM table WHERE High assists = delonte west (10)
What catalog had an Epic Records label in CD format?,SELECT Catalog FROM table WHERE Label = epic records AND Format = cd
Which label is in Australia?,SELECT Label FROM table WHERE Region = australia
The match that lasted 2:43 has what record?,SELECT Record FROM table WHERE Time = 2:43
The match that was held at Club Med Sandpiper has what method?,SELECT Method FROM table WHERE Venue = club med sandpiper
The match of at Michael's Eighth Avenue venue against Tim Coleman that went 3:00 has what record?,SELECT Record FROM table WHERE Time = 3:00 AND Venue = michael's eighth avenue AND Opponent = tim coleman
What method did the match at Club Med Sandpiper have?,SELECT Method FROM table WHERE Venue = club med sandpiper
What is the Label of the release with Catalog number LPM-2899?,SELECT Label FROM table WHERE Catalog = lpm-2899
What is the Date of the RCA release with Catalog number SF-7635?,SELECT Date FROM table WHERE Label = rca AND Catalog = sf-7635
What is the Catalog of the RCA release?,SELECT Catalog FROM table WHERE Label = rca
What is the Catalog number of the CD Reissue Universal release?,SELECT Catalog FROM table WHERE Format = cd reissue AND Label = universal
What is the Label of the release on Stereo vinyl LP with Catalog number SF-7635?,SELECT Label FROM table WHERE Format = stereo vinyl lp AND Catalog = sf-7635
What university has a 2009 int'l student review greater than 268 and median rank greater than 4?,SELECT University FROM table WHERE Median ranks > 4 AND 2009 QS Asian Rankings: Int’l student review > 268
"What's the ARWU ranking that has the int' student review of 144, a median rank of less than 10, and 2000 Singapore “Asiaweek” of none?",SELECT 2010 ARWU Rankings FROM table WHERE 2000 Singapore “Asiaweek” Rankings = none AND Median ranks < 10 AND 2009 QS Asian Rankings: Int’l student review = 144
Name the local that has the Int'l student review less than 320 and 2010 Eduniversal ranking of none.,SELECT Local FROM table WHERE 2010 eduniversal Rankings = none AND 2010 ARWU Rankings = none AND 2009 QS Asian Rankings: Int’l student review < 320
What's the int'l student review that has the 2010 QS Rank of none?,SELECT SUM 2009 QS Asian Rankings: Int’l student review FROM table WHERE 2010 QS Asian Rankings = none
What university has an int'l student review of 195?,SELECT University FROM table WHERE 2009 QS Asian Rankings: Int’l student review = 195
