question,sql
Who has a roll value of 422?,SELECT Name FROM table WHERE Roll = 422
In what area is the decile value 10?,SELECT Area FROM table WHERE Decile = 10
What is the highest decile value with a roll greater than 301 in Hauraki?,SELECT MAX Decile FROM table WHERE Roll > 301 AND Area = hauraki
"Which Points classification has a Trofeo Fast Team of metauro mobili-pinarello, and a Stage of 6?",SELECT Points classification FROM table WHERE Trofeo Fast Team = metauro mobili-pinarello AND Stage = 6
Which stage has a Winner of lucien van impe?,SELECT Stage FROM table WHERE Winner = lucien van impe
Which Trofeo Fast Team has a Winner of alessandro paganessi?,SELECT Trofeo Fast Team FROM table WHERE Winner = alessandro paganessi
Which General classification has a Stage of 7?,SELECT General classification FROM table WHERE Stage = 7
"Which Winner has a Trofeo Fast Team of metauro mobili-pinarello, and a General classification of giuseppe saronni?",SELECT Winner FROM table WHERE Trofeo Fast Team = metauro mobili-pinarello AND General classification = giuseppe saronni
What's the report for the mosport park circuit?,SELECT Report FROM table WHERE Circuit = mosport park
Who has the pole position for the nürburgring circuit?,SELECT Pole position FROM table WHERE Circuit = nürburgring
When was pedro rodríguez the winning driver?,SELECT Date FROM table WHERE Winning driver = pedro rodríguez
What's the report for the mexican grand prix?,SELECT Report FROM table WHERE Race = mexican grand prix
What is nigel mansell's time/retired?,SELECT Time/Retired FROM table WHERE Driver = nigel mansell
What team was the away team at Junction Oval?,SELECT Away team FROM table WHERE Venue = junction oval
What is the home team when the visiting team is the Mavericks?,SELECT Home FROM table WHERE Visitor = mavericks
"What was the average year for a coin that had a mintage smaller than 10,000?","SELECT AVG Year FROM table WHERE Mintage < 10,000"
What is he Atsushi Aoki when the Black Tiger V is ibushi (16:35)?,SELECT Atsushi Aoki FROM table WHERE Black Tiger V = ibushi (16:35)
What is the Akira when Tiger Mask IV is Akira (10:05)?,SELECT Akira FROM table WHERE Tiger Mask IV = akira (10:05)
What is the corresponding Akira when Milano Collection A.T is Milano (10:29)?,SELECT Akira FROM table WHERE Milano Collection A.T. = milano (10:29)
What is Block A when Prince Devitt is Devitt (9:53)?,SELECT Block A FROM table WHERE Prince Devitt = devitt (9:53)
What is the Akira when Prince Devitt is Devitt (7:20)?,SELECT Akira FROM table WHERE Prince Devitt = devitt (7:20)
What is the Prince Devitt when Block A is Yamato?,SELECT Prince Devitt FROM table WHERE Block A = yamato
I want the league one/second division for club of millwall,SELECT League One/Second Division FROM table WHERE Club = millwall
What was the score of the home team when they played carlton?,SELECT Home team score FROM table WHERE Away team = carlton
How many points did the visiting team score at south melbourne?,SELECT Away team score FROM table WHERE Home team = south melbourne
"Which Date has a Crowd that is larger than 18,000 with a Home team score of 14.13 (97)?","SELECT Date FROM table WHERE Crowd > 18,000 AND Home team score = 14.13 (97)"
Which Date has an Away team score of 11.7 (73)?,SELECT Date FROM table WHERE Away team score = 11.7 (73)
What is the total Crowd number for the Away team of Hawthorn?,SELECT COUNT Crowd FROM table WHERE Away team = hawthorn
What did the team score when playing against home in geelong?,SELECT Home team score FROM table WHERE Away team = geelong
How many people watched when st kilda played at home?,SELECT Crowd FROM table WHERE Home team = st kilda
"Who was the away team when the crowd was larger than 41,451?","SELECT Away team FROM table WHERE Crowd > 41,451"
Who was the home team when the venue was Junction Oval?,SELECT Home team FROM table WHERE Venue = junction oval
What is the average crowd size when the home team score was 8.11 (59)?,SELECT AVG Crowd FROM table WHERE Home team score = 8.11 (59)
"I want to know the time which has attendance of 66,772","SELECT Time FROM table WHERE Attendance = 66,772"
"Name the opponent that has attendance of 76,965","SELECT Opponent FROM table WHERE Attendance = 76,965"
"Tell me the week that has an attendance of 78,301","SELECT Week FROM table WHERE Attendance = 78,301"
I want to know the opponent that ha a week of 3,SELECT Opponent FROM table WHERE Week = 3
How many were in attendance on 14 April 2007?,SELECT MIN Attendance FROM table WHERE Date = 14 april 2007
"What is the venue where there are more than 52,302 in attendance and the result is 2-0?","SELECT Venue FROM table WHERE Attendance > 52,302 AND Result = 2-0"
What is catcher Josh Donaldson's pick number?,SELECT Pick FROM table WHERE Position = catcher AND Player = josh donaldson
Which players plays at Akron College?,SELECT Player FROM table WHERE College = akron
Which college does the player jon hameister-ries play for?,SELECT College FROM table WHERE Player = jon hameister-ries
What is the nationality of the player with a pick larger than 21 from the College of the Sequoias?,SELECT Nationality FROM table WHERE Pick > 21 AND College/High School/Club = college of the sequoias
I want the result for goals which has goals of deacon 6/6,SELECT Result FROM table WHERE Goals = deacon 6/6
Which competition was at wilderspool?,SELECT Competition FROM table WHERE Venue = wilderspool
Tell me the venue for score of 82-0,SELECT Venue FROM table WHERE Score = 82-0
I want the date with the venue of mcalpine stadium,SELECT Date FROM table WHERE Venue = mcalpine stadium
Tell me the goals for score of 38-28,SELECT Goals FROM table WHERE Score = 38-28
Tell me the least Grid with points more than 11 and drivers being sébastien bourdais with laps less than 67,SELECT MIN Grid FROM table WHERE Points > 11 AND Driver = sébastien bourdais AND Laps < 67
Name the most laps for grid more than 9 and the driver being jan heylen,SELECT MAX Laps FROM table WHERE Grid > 9 AND Driver = jan heylen
How many voted in queens for the canddiate with all write-in votes and 26 staten island votes?,SELECT Queens FROM table WHERE 2009 Democratic primary = all write-in votes AND Staten Island = 26
What is the grid when the laps were 24?,SELECT COUNT Grid FROM table WHERE Laps = 24
Who constructed Chris Amon's car?,SELECT Constructor FROM table WHERE Driver = chris amon
What was Jack Brabham's highest grid when his laps were more than 90?,SELECT MAX Grid FROM table WHERE Driver = jack brabham AND Laps > 90
What was CHris Amon's highest lap when his grid was 4?,SELECT MAX Laps FROM table WHERE Driver = chris amon AND Grid < 4
Where did Hawthorn have their away match against North Melbourne?,SELECT Venue FROM table WHERE Away team = hawthorn
What was the home team score at Richmond's away game against Footscray?,SELECT Home team score FROM table WHERE Away team = richmond
On what date did the away team score 14.4 (88)?,SELECT Date FROM table WHERE Away team score = 14.4 (88)
What is the size of the crowd for the home team of Footscray?,SELECT Crowd FROM table WHERE Home team = footscray
What is the Time/Retired for the car going 42 Laps?,SELECT Time/Retired FROM table WHERE Laps = 42
How many laps for alexander wurz with a grid under 12?,SELECT COUNT Laps FROM table WHERE Grid < 12 AND Driver = alexander wurz
"What is the lowest evening gown score a contestant with an average less than 8.23, an interview score of 8.11, and a swimsuit larger than 7.84 has?",SELECT MIN Evening gown FROM table WHERE Average < 8.23 AND Interview = 8.11 AND Swimsuit > 7.84
What is the total interview score a contestant from Indiana with an average smaller than 8.3 has?,SELECT COUNT Interview FROM table WHERE State = indiana AND Average < 8.3
"What is the highest swimsuit a contestant from Kansas with an average larger than 8.48, an interview higher than 8.58, and an evening gown higher than 8.82 has?",SELECT MAX Swimsuit FROM table WHERE Average > 8.48 AND Interview > 8.58 AND Evening gown > 8.82 AND State = kansas
What is the average interview score of a contestant from Louisiana with an evening gown smaller than 8.82?,SELECT AVG Interview FROM table WHERE Evening gown < 8.82 AND State = louisiana
What prefix has Haloalkane as the chemical class?,SELECT Prefix FROM table WHERE Chemical class = haloalkane
Which example has rx as the formula?,SELECT Example FROM table WHERE Formula = rx
Which chemical class uses the example Chloroethane (ethyl chloride)?,SELECT Chemical class FROM table WHERE Example = chloroethane (ethyl chloride)
What prefix has Bromo as the group?,SELECT Prefix FROM table WHERE Group = bromo
What is the chemical class for ri?,SELECT Chemical class FROM table WHERE Formula = ri
What prefix has chemical class Iodoalkane?,SELECT Prefix FROM table WHERE Chemical class = iodoalkane
"What is the highest rank of the player with earnings of $6,715,649?","SELECT MAX Rank FROM table WHERE Earnings( $ ) = 6,715,649"
"What is the rank of Lee Trevino, who had less than 27 wins?",SELECT SUM Rank FROM table WHERE Player = lee trevino AND Wins < 27
"Who is the player with more than $6,570,797 in earnings and less than 27 wins?","SELECT Player FROM table WHERE Earnings( $ ) > 6,570,797 AND Wins < 27"
"What date did the show with a series larger than 40, production code smaller than 213, and a season number larger than 11 air?",SELECT Original air date FROM table WHERE Series no. > 40 AND Production Code < 213 AND Season no. > 11
Who wrote the series number 49 with a season larger than 4?,SELECT Written by FROM table WHERE Season no. > 4 AND Series no. = 49
"What was the latest gross 75,50,00,000?","SELECT MAX Year FROM table WHERE Nett Gross = 75,50,00,000"
What is the total count of net gross in 1957?,SELECT COUNT Nett Gross FROM table WHERE Year = 1957
What is the total End term with a Title of prince regent of bavaria?,SELECT SUM End term FROM table WHERE Title = prince regent of bavaria
"What is the smallest End term with a Start term of 1913, and a Name of ludwig iii?",SELECT MIN End term FROM table WHERE Start term = 1913 AND Name = ludwig iii
Which Title has an 1825 end term?,SELECT Title FROM table WHERE End term = 1825
What is the average Start term with a 1912 end term?,SELECT AVG Start term FROM table WHERE End term = 1912
What date were the high rebounds Evans (14)?,SELECT Date FROM table WHERE High rebounds = evans (14)
"Which game has a high rebound of Evans (7) and a high assist of Evans, Ollie (3)?","SELECT MAX Game FROM table WHERE High rebounds = evans (7) AND High assists = evans, ollie (3)"
"What division has the highest FA Cup Goals, but a Total Goal score less than 5, and a Total Apps of 52?",SELECT MAX FA Cup Goals FROM table WHERE Total Apps (Sub) = 52 AND Total Goals < 5
"What is the average FL Cup Apps, with a FL Cup Goals greater than 0, but a Other Apps less than 0?",SELECT AVG FL Cup Apps (Sub) FROM table WHERE FL Cup Goals > 0 AND Other Apps < 0
"What is Division One's total number of FL Cup Goals, with an Other Apps greater than 3, and a FA Cup Goals greater than 0?",SELECT COUNT FL Cup Goals FROM table WHERE Division = one AND Other Apps > 3 AND FA Cup Goals > 0
"What is Division One's average Other Apps, with a League Goal less than 1?",SELECT AVG Other Apps FROM table WHERE Division = one AND League Goals < 1
Who plays at Victoria Park?,SELECT Away team FROM table WHERE Venue = victoria park
What is the score against the indians after game 2?,SELECT Score FROM table WHERE Game > 2 AND Opponent = indians
What is the average grid for piers courage?,SELECT AVG Grid FROM table WHERE Driver = piers courage
Who drove 53 laps?,SELECT Driver FROM table WHERE Laps = 53
"What is the lap total for george eaton, with a grid under 17 retiring due to gearbox?",SELECT SUM Laps FROM table WHERE Time/Retired = gearbox AND Driver = george eaton AND Grid < 17
How many laps for denny hulme with under 4 on the grid?,SELECT SUM Laps FROM table WHERE Driver = denny hulme AND Grid < 4
How many people were in the crowd when the home team scored 13.10 (88)?,SELECT Crowd FROM table WHERE Home team score = 13.10 (88)
What is the sum of the crowd when the away team score was 12.11 (83)?,SELECT SUM Crowd FROM table WHERE Away team score = 12.11 (83)
"What was the score of the home team when there were more than 5,500 people in the crowd?","SELECT Home team score FROM table WHERE Crowd > 5,500"
What is the sum of Crowd when Essendon was the home team?,SELECT SUM Crowd FROM table WHERE Home team = essendon
What was the home team score when North Melbourne was the away team?,SELECT Home team score FROM table WHERE Away team = north melbourne
"What is the U.S. Hot 100 chart number of the single off of the 2002 album west coast bad boyz, vol. 3: poppin' collars?","SELECT U.S. Hot 100 FROM table WHERE Year = 2002 AND Album = west coast bad boyz, vol. 3: poppin' collars"
"What is the U.S. Rap chart number of the album west coast bad boyz, vol. 3: poppin' collars?","SELECT U.S. Rap FROM table WHERE Album = west coast bad boyz, vol. 3: poppin' collars"
What is the top round for the baltimore bullets with a Pick larger than 6?,SELECT MAX Round FROM table WHERE Team = baltimore bullets AND Pick > 6
What team was the away team when the home team scored 12.8 (80)?,SELECT Away team FROM table WHERE Home team score = 12.8 (80)
What team was the away team when the home team scored 9.10 (64)?,SELECT Away team FROM table WHERE Home team score = 9.10 (64)
What team was the away team when they played at lake oval?,SELECT Away team score FROM table WHERE Venue = lake oval
How many people were in the crowd when North Melbourne was the home team?,SELECT Crowd FROM table WHERE Home team = north melbourne
What is Mark Grieb's average when his TDs are smaller than 2?,SELECT SUM Avg. FROM table WHERE Player = mark grieb AND TD's < 2
What is Craig Whelihan's average when his yards are smaller than 0?,SELECT SUM Avg. FROM table WHERE Player = craig whelihan AND Yards < 0
Which largest average had 1229 yards?,SELECT MAX Avg. FROM table WHERE Yards = 1229
What is the constructor where the circuit is Silverstone?,SELECT Constructor FROM table WHERE Circuit = silverstone
Who is the Winning Driver in the race viii gran premio di siracusa?,SELECT Winning driver FROM table WHERE Race Name = viii gran premio di siracusa
What is the date that the winner driver is Stirling Moss in the race named vi grand prix de caen?,SELECT Date FROM table WHERE Winning driver = stirling moss AND Race Name = vi grand prix de caen
Which state is the location of 39.1178°n 106.4454°w in?,SELECT State FROM table WHERE Location = 39.1178°n 106.4454°w
What is the highest rank Mount Elbert has?,SELECT MAX Rank FROM table WHERE Mountain Peak = mount elbert
What is the mountain range at 37.3934°n 104.9201°w?,SELECT Mountain Range FROM table WHERE Location = 37.3934°n 104.9201°w
What is the location of Blanca Peak?,SELECT Location FROM table WHERE Mountain Peak = blanca peak
Which state is West Spanish Peak in?,SELECT State FROM table WHERE Mountain Peak = west spanish peak
What is the ranked 5 mountain range?,SELECT Mountain Range FROM table WHERE Rank = 5
Name of choice b. Randell is the name of which District Residence?,SELECT District Residence FROM table WHERE Name = choice b. randell
"Who has a Took Office of march 4, 1903?","SELECT Name FROM table WHERE Took Office = march 4, 1903"
"Which Took Office that has a Party of democrat, under the name of John Hancock",SELECT Took Office FROM table WHERE Party = democrat AND Name = john hancock
"Who has Took Office of march 4, 1875?","SELECT Name FROM table WHERE Took Office = march 4, 1875"
Name the record on june 22,SELECT Record FROM table WHERE Date = june 22
Name the total number in attendance for when the bulls visited,SELECT COUNT Attendance FROM table WHERE Visitor = bulls
Name the most swimsuit for interview less than 8.46,SELECT MAX Swimsuit FROM table WHERE Interview < 8.46
Name the most evening gown for average less than 8.793 with interview of 8.51 and swimsuit less than 8.12,SELECT MAX Evening Gown FROM table WHERE Average < 8.793 AND Swimsuit < 8.12 AND Interview = 8.51
"On average, how many Starts have Wins that are smaller than 0?",SELECT AVG Starts FROM table WHERE Wins < 0
Which of the top-10s has a starts value of 14?,SELECT MAX Top-10s FROM table WHERE Starts = 14
"In the tournament of HSBC Champions, what was the sum of the Starts with Wins lower than 0?",SELECT SUM Starts FROM table WHERE Tournament = hsbc champions AND Wins < 0
Who trained the horse on post 11 with over 36 odds?,SELECT Trainer FROM table WHERE Odds > 36 AND Post = 11
What is the lowest post number for calvin borel?,SELECT MIN Post FROM table WHERE Jockey = calvin borel
What horse for jara?,SELECT Horse FROM table WHERE Jockey = jara
What is the date when Lebron James (25) was the lead scorer?,SELECT Date FROM table WHERE Leading scorer = lebron james (25)
Which Total has a Gold smaller than 0?,SELECT SUM Total FROM table WHERE Gold < 0
Which Bronze has a Gold smaller than 0?,SELECT AVG Bronze FROM table WHERE Gold < 0
"Which T.C. has a Win of 1, and a Race of 21?",SELECT T.C. FROM table WHERE Wins = 1 AND Races = 21
"How many years have Drivers of ben hanley, and Flaps smaller than 0?",SELECT COUNT Year FROM table WHERE Drivers = ben hanley AND FLaps < 0
"How many Points have Drivers of adrián vallés, and a Year larger than 2006?",SELECT AVG Points FROM table WHERE Drivers = adrián vallés AND Year > 2006
"How many Poles have Drivers of juan cruz álvarez, and FLaps larger than 0?",SELECT SUM Poles FROM table WHERE Drivers = juan cruz álvarez AND FLaps > 0
Who was the away team at Victoria Park?,SELECT Away team FROM table WHERE Venue = victoria park
What is the name of the train numbered less than 6 before 1993?,SELECT Name FROM table WHERE Number < 6 AND Date < 1993
What is the name of the bo-bodh train with a number less than 5?,SELECT Name FROM table WHERE Number < 5 AND Type = bo-bodh
Name the record when the visitor is st. louis,SELECT Record FROM table WHERE Visitor = st. louis
What was the scory when calgary was visiting?,SELECT Score FROM table WHERE Visitor = calgary
Name the home when the visitor was dallas on february 2,SELECT Home FROM table WHERE Visitor = dallas AND Date = february 2
Name the date for turco decision and home of st. louis,SELECT Date FROM table WHERE Decision = turco AND Home = st. louis
Which rider had a speed of 104.630mph?,SELECT Rider FROM table WHERE Speed = 104.630mph
What is the best rank with a time of 1:05.14.10?,SELECT MAX Rank FROM table WHERE Time = 1:05.14.10
Where was the game played when the final score was 35-62?,SELECT Stadium FROM table WHERE Final Score = 35-62
"During the game at Candlestick Park, who was the visiting team?",SELECT Visiting Team FROM table WHERE Stadium = candlestick park
Which visiting team had a final score of 14-34?,SELECT Visiting Team FROM table WHERE Final Score = 14-34
What was the final score in the game against the Cincinnati Bengals?,SELECT Final Score FROM table WHERE Visiting Team = cincinnati bengals
Who was the visiting team in the game against the Dallas Cowboys?,SELECT Visiting Team FROM table WHERE Host Team = dallas cowboys
"Which tournament has an Outcome of runner-up, and an Opponent of maša zec peškirič?",SELECT Tournament FROM table WHERE Outcome = runner-up AND Opponent = maša zec peškirič
"Which surface has a Score of 6–4, 6–2?","SELECT Surface FROM table WHERE Score = 6–4, 6–2"
Which surface has a Date of 22 august 2006?,SELECT Surface FROM table WHERE Date = 22 august 2006
"Which tournament has an Outcome of runner-up, a Surface of hard, and a Score of 6–4, 6–2?","SELECT Tournament FROM table WHERE Outcome = runner-up AND Surface = hard AND Score = 6–4, 6–2"
What is the outcome with marina erakovic as opponent?,SELECT Outcome FROM table WHERE Opponent = marina erakovic
"Which tournament has an Outcome of winner, and a Opponent of dia evtimova?",SELECT Tournament FROM table WHERE Outcome = winner AND Opponent = dia evtimova
What title runs for 3:22?,SELECT Title FROM table WHERE Time = 3:22
Who wrote the song that runs for 2:22?,SELECT Author(s) FROM table WHERE Time = 2:22
What Constructor had 66 Laps?,SELECT Constructor FROM table WHERE Laps = 66
"With Laps greater than 78, what is the lowest Grid?",SELECT MIN Grid FROM table WHERE Laps > 78
How many Laps with a Grid smaller than 11 did John Watson have?,SELECT AVG Laps FROM table WHERE Driver = john watson AND Grid < 11
How many Laps with a Grid smaller than 3 did Driver NIki Lauda have?,SELECT AVG Laps FROM table WHERE Driver = niki lauda AND Grid < 3
What is the low grid total for a retired due to steering in under 15 laps?,SELECT MIN Grid FROM table WHERE Time/Retired = steering AND Laps < 15
What is the average laps that had a time/retired of +5 laps?,SELECT AVG Laps FROM table WHERE Time/Retired = +5 laps
"Which Opponent has Location Wonju Chiak Indoor Gym, South Korea?","SELECT Opponent FROM table WHERE Location = wonju chiak indoor gym, south korea"
"Which is the lowest Round with the Opponent, Paul Cahoon and Location, Amsterdam, Netherlands?","SELECT MIN Round FROM table WHERE Opponent = paul cahoon AND Location = amsterdam, netherlands"
"Which Event has the Opponent, Bernard Ackah?",SELECT Event FROM table WHERE Opponent = bernard ackah
when was the destroyer launched when it was laid down on 14 august 1942?,SELECT Launched FROM table WHERE Laid Down = 14 august 1942
"what is the launched date when the builder is john brown, clydebank?","SELECT Launched FROM table WHERE Builder = john brown, clydebank"
"what is the pennant when the builder is yarrow, scotstoun?","SELECT Pennant FROM table WHERE Builder = yarrow, scotstoun"
what is the name when the laid down is 28 february 1943?,SELECT Name FROM table WHERE Laid Down = 28 february 1943
"when was it commissioned when the destroyer was built by scotts, greenock?","SELECT Commissioned FROM table WHERE Builder = scotts, greenock"
when was the launched date when the laid down date is 14 august 1942?,SELECT Launched FROM table WHERE Laid Down = 14 august 1942
What was the record for a week below 13 on July 12?,SELECT Record FROM table WHERE Week < 13 AND Date = july 12
What location had a final score of W 30 – 5?,SELECT Location FROM table WHERE Final Score = w 30 – 5
Which label had a catalog designation of ch-9196?,SELECT Label FROM table WHERE Catalog = ch-9196
Which format's catalog designation was 21-382a?,SELECT Format FROM table WHERE Catalog = 21-382a
Which catalog had a date year of 1984?,SELECT Catalog FROM table WHERE Date = 1984
Which format was under the London Records label?,SELECT Format FROM table WHERE Label = london records
Which label was in the United Kingdom region?,SELECT Label FROM table WHERE Region = united kingdom
Which date had the catalog designation of ha-m 2230?,SELECT Date FROM table WHERE Catalog = ha-m 2230
"What is the maximum goals conceded for a team with 2 draws, more than 29 goals and a diff larger than 15?",SELECT MAX Goals Conceded (GC) FROM table WHERE Draw (PE) = 2 AND Goals Scored (GF) > 29 AND +/- (Dif.) > 15
What is the points for a team with more than 9 wins and more than 40 goals?,SELECT SUM Points (Pts.) FROM table WHERE Won (PG) > 9 AND Goals Scored (GF) > 40
What was the score of the game played in the 2012 Africa Cup of Nations?,SELECT Score FROM table WHERE Competition = 2012 africa cup of nations
What is the score of the friendly competition?,SELECT Score FROM table WHERE Competition = friendly
What venue was the game played on 9 February 2011 played at?,SELECT Venue FROM table WHERE Date = 9 february 2011
What date did NY Rangers play at home?,SELECT Date FROM table WHERE Home = ny rangers
What is the score of Colorado when they were a visitor and had a Smith decision?,SELECT Score FROM table WHERE Decision = smith AND Visitor = colorado
"Who is the runner up when the score was 3–6, 6–3, [10–4]?","SELECT Runner-up FROM table WHERE Score = 3–6, 6–3, [10–4]"
What is the name of the runner up in the Tournament of são paulo?,SELECT Runner-up FROM table WHERE Tournament = são paulo
What person is in the third place when Thomas Enqvist won and a Runner-up was guy forget?,SELECT Third Place FROM table WHERE Winner = thomas enqvist AND Runner-up = guy forget
What tournament was Thomas Enqvist runner up?,SELECT Tournament FROM table WHERE Runner-up = thomas enqvist
"What is the name of the runner up when yevgeny kafelnikov was third place and the score was 3–6, 6–4, [10–3]?","SELECT Runner-up FROM table WHERE Third Place = yevgeny kafelnikov AND Score = 3–6, 6–4, [10–3]"
What is the name of the winner when Goran Ivanišević was in third place?,SELECT Winner FROM table WHERE Third Place = goran ivanišević
Which analog channel has a digital channel of 4.1?,SELECT Analog Channel FROM table WHERE Digital Channel = 4.1
Which digital channel is named Storm Tracker?,SELECT Digital Channel FROM table WHERE Name = storm tracker
Which analog channel is Fox on?,SELECT Analog Channel FROM table WHERE Network = fox
Name the area president when the area name is south america south,SELECT Area president (Quorum) FROM table WHERE Area name = south america south
Tell me the total number of Grid for Time/Retired of +2 Laps and Laps less than 70,SELECT COUNT Grid FROM table WHERE Time/Retired = +2 laps AND Laps < 70
What year did Shelley Winters win?,SELECT Year FROM table WHERE Actress = shelley winters
Which award was won by Gloria Stuart after 1984?,SELECT Superlative FROM table WHERE Year > 1984 AND Actress = gloria stuart
Which award has Thelma Ritter won?,SELECT Superlative FROM table WHERE Actress = thelma ritter
I want the lowest points diff for against being less than 578 and lost being 15 and points more than 26,SELECT MIN Points Diff FROM table WHERE Against < 578 AND Lost = 15 AND Points > 26
